[{"HicriTarihKisa": "17.8.1447", "HicriTarihKisaIso8601": null, "HicriTarihUzun": "17 Şaban 1447", "HicriTarihUzunIso8601": null, "AyinSekliURL": "https://namazvakti.diyanet.gov.tr/images/d3.gif", "MiladiTarihKisa": "05.02.2026", "MiladiTarihKisaIso8601": "05.02.2026", "MiladiTarihUzun": "05 Şubat 2026 Perşembe", "MiladiTarihUzunIso8601": "2026-02-05T00:00:00.0000000-03:00", "GreenwichOrtalamaZamani": 3.0, "Aksam": "21:09", "Gunes": "06:49", "GunesBatis": "21:02", "GunesDogus": "06:56", "Ikindi": "17:56", "Imsak": "05:09", "KibleSaati": "07:05", "Ogle": "14:04", "Yatsi": "22:43"}, {"HicriTarihKisa": "18.8.1447", "HicriTarihKisaIso8601": null, "HicriTarihUzun": "18 Şaban 1447", "HicriTarihUzunIso8601": null, "AyinSekliURL": "https://namazvakti.diyanet.gov.tr/images/d4.gif", "MiladiTarihKisa": "06.02.2026", "MiladiTarihKisaIso8601": "06.02.2026", "MiladiTarihUzun": "06 Şubat 2026 Cuma", "MiladiTarihUzunIso8601": "2026-02-06T00:00:00.0000000-03:00", "GreenwichOrtalamaZamani": 3.0, "Aksam": "21:08", "Gunes": "06:51", "GunesBatis": "21:01", "GunesDogus": "06:58", "Ikindi": "17:56", "Imsak": "05:11", "KibleSaati": "07:06", "Ogle": "14:04", "Yatsi": "22:41"}, {"HicriTarihKisa": "19.8.1447", "HicriTarihKisaIso8601": null, "HicriTarihUzun": "19 Şaban 1447", "HicriTarihUzunIso8601": null, "AyinSekliURL": "https://namazvakti.diyanet.gov.tr/images/d5.gif", "MiladiTarihKisa": "07.02.2026", "MiladiTarihKisaIso8601": "07.02.2026", "MiladiTarihUzun": "07 Şubat 2026 Cumartesi", "MiladiTarihUzunIso8601": "2026-02-07T00:00:00.0000000-03:00", "GreenwichOrtalamaZamani": 3.0, "Aksam": "21:07", "Gunes": "06:52", "GunesBatis": "21:00", "GunesDogus": "06:59", "Ikindi": "17:55", "Imsak": "05:12", "KibleSaati": "07:08", "Ogle": "14:04", "Yatsi": "22:39"}, {"HicriTarihKisa": "20.8.1447", "HicriTarihKisaIso8601": null, "HicriTarihUzun": "20 Şaban 1447", "HicriTarihUzunIso8601": null, "AyinSekliURL": "https://namazvakti.diyanet.gov.tr/images/d6.gif", "MiladiTarihKisa": "08.02.2026", "MiladiTarihKisaIso8601": "08.02.2026", "MiladiTarihUzun": "08 Şubat 2026 Pazar", "MiladiTarihUzunIso8601": "2026-02-08T00:00:00.0000000-03:00", "GreenwichOrtalamaZamani": 3.0, "Aksam": "21:05", "Gunes": "06:53", "GunesBatis": "20:58", "GunesDogus": "07:00", "Ikindi": "17:55", "Imsak": "05:14", "KibleSaati": "07:10", "Ogle": "14:04", "Yatsi": "22:38"}, {"HicriTarihKisa": "21.8.1447", "HicriTarihKisaIso8601": null, "HicriTarihUzun": "21 Şaban 1447", "HicriTarihUzunIso8601": null, "AyinSekliURL": "https://namazvakti.diyanet.gov.tr/images/sondordun.gif", "MiladiTarihKisa": "09.02.2026", "MiladiTarihKisaIso8601": "09.02.2026", "MiladiTarihUzun": "09 Şubat 2026 Pazartesi", "MiladiTarihUzunIso8601": "2026-02-09T00:00:00.0000000-03:00", "GreenwichOrtalamaZamani": 3.0, "Aksam": "21:04", "Gunes": "06:55", "GunesBatis": "20:57", "GunesDogus": "07:02", "Ikindi": "17:55", "Imsak": "05:16", "KibleSaati": "07:11", "Ogle": "14:04", "Yatsi": "22:36"}, {"HicriTarihKisa": "22.8.1447", "HicriTarihKisaIso8601": null, "HicriTarihUzun": "22 Şaban 1447", "HicriTarihUzunIso8601": null, "AyinSekliURL": "https://namazvakti.diyanet.gov.tr/images/sd1.gif", "MiladiTarihKisa": "10.02.2026", "MiladiTarihKisaIso8601": "10.02.2026", "MiladiTarihUzun": "10 Şubat 2026 Salı", "MiladiTarihUzunIso8601": "2026-02-10T00:00:00.0000000-03:00", "GreenwichOrtalamaZamani": 3.0, "Aksam": "21:03", "Gunes": "06:56", "GunesBatis": "20:56", "GunesDogus": "07:03", "Ikindi": "17:54", "Imsak": "05:18", "KibleSaati": "07:13", "Ogle": "14:04", "Yatsi": "22:34"}, {"HicriTarihKisa": "23.8.1447", "HicriTarihKisaIso8601": null, "HicriTarihUzun": "23 Şaban 1447", "HicriTarihUzunIso8601": null, "AyinSekliURL": "https://namazvakti.diyanet.gov.tr/images/sd2.gif", "MiladiTarihKisa": "11.02.2026", "MiladiTarihKisaIso8601": "11.02.2026", "MiladiTarihUzun": "11 Şubat 2026 Çarşamba", "MiladiTarihUzunIso8601": "2026-02-11T00:00:00.0000000-03:00", "GreenwichOrtalamaZamani": 3.0, "Aksam": "21:02", "Gunes": "06:57", "GunesBatis": "20:55", "GunesDogus": "07:04", "Ikindi": "17:54", "Imsak": "05:20", "KibleSaati": "07:15", "Ogle": "14:04", "Yatsi": "22:33"}, {"HicriTarihKisa": "24.8.1447", "HicriTarihKisaIso8601": null, "HicriTarihUzun": "24 Şaban 1447", "HicriTarihUzunIso8601": null, "AyinSekliURL": "https://namazvakti.diyanet.gov.tr/images/sd3.gif", "MiladiTarihKisa": "12.02.2026", "MiladiTarihKisaIso8601": "12.02.2026", "MiladiTarihUzun": "12 Şubat 2026 Perşembe", "MiladiTarihUzunIso8601": "2026-02-12T00:00:00.0000000-03:00", "GreenwichOrtalamaZamani": 3.0, "Aksam": "21:01", "Gunes": "06:58", "GunesBatis": "20:54", "GunesDogus": "07:05", "Ikindi": "17:53", "Imsak": "05:21", "KibleSaati": "07:16", "Ogle": "14:04", "Yatsi": "22:31"}, {"HicriTarihKisa": "25.8.1447", "HicriTarihKisaIso8601": null, "HicriTarihUzun": "25 Şaban 1447", "HicriTarihUzunIso8601": null, "AyinSekliURL": "https://namazvakti.diyanet.gov.tr/images/sd4.gif", "MiladiTarihKisa": "13.02.2026", "MiladiTarihKisaIso8601": "13.02.2026", "MiladiTarihUzun": "13 Şubat 2026 Cuma", "MiladiTarihUzunIso8601": "2026-02-13T00:00:00.0000000-03:00", "GreenwichOrtalamaZamani": 3.0, "Aksam": "20:59", "Gunes": "07:00", "GunesBatis": "20:52", "GunesDogus": "07:07", "Ikindi": "17:53", "Imsak": "05:23", "KibleSaati": "07:18", "Ogle": "14:04", "Yatsi": "22:29"}, {"HicriTarihKisa": "26.8.1447", "HicriTarihKisaIso8601": null, "HicriTarihUzun": "26 Şaban 1447", "HicriTarihUzunIso8601": null, "AyinSekliURL": "https://namazvakti.diyanet.gov.tr/images/sd5.gif", "MiladiTarihKisa": "14.02.2026", "MiladiTarihKisaIso8601": "14.02.2026", "MiladiTarihUzun": "14 Şubat 2026 Cumartesi", "MiladiTarihUzunIso8601": "2026-02-14T00:00:00.0000000-03:00", "GreenwichOrtalamaZamani": 3.0, "Aksam": "20:58", "Gunes": "07:01", "GunesBatis": "20:51", "GunesDogus": "07:08", "Ikindi": "17:52", "Imsak": "05:25", "KibleSaati": "07:20", "Ogle": "14:04", "Yatsi": "22:27"}, {"HicriTarihKisa": "27.8.1447", "HicriTarihKisaIso8601": null, "HicriTarihUzun": "27 Şaban 1447", "HicriTarihUzunIso8601": null, "AyinSekliURL": "https://namazvakti.diyanet.gov.tr/images/sd6.gif", "MiladiTarihKisa": "15.02.2026", "MiladiTarihKisaIso8601": "15.02.2026", "MiladiTarihUzun": "15 Şubat 2026 Pazar", "MiladiTarihUzunIso8601": "2026-02-15T00:00:00.0000000-03:00", "GreenwichOrtalamaZamani": 3.0, "Aksam": "20:57", "Gunes": "07:02", "GunesBatis": "20:50", "GunesDogus": "07:09", "Ikindi": "17:52", "Imsak": "05:27", "KibleSaati": "07:21", "Ogle": "14:04", "Yatsi": "22:26"}, {"HicriTarihKisa": "28.8.1447", "HicriTarihKisaIso8601": null, "HicriTarihUzun": "28 Şaban 1447", "HicriTarihUzunIso8601": null, "AyinSekliURL": "https://namazvakti.diyanet.gov.tr/images/sd7.gif", "MiladiTarihKisa": "16.02.2026", "MiladiTarihKisaIso8601": "16.02.2026", "MiladiTarihUzun": "16 Şubat 2026 Pazartesi", "MiladiTarihUzunIso8601": "2026-02-16T00:00:00.0000000-03:00", "GreenwichOrtalamaZamani": 3.0, "Aksam": "20:55", "Gunes": "07:03", "GunesBatis": "20:48", "GunesDogus": "07:10", "Ikindi": "17:51", "Imsak": "05:28", "KibleSaati": "07:23", "Ogle": "14:04", "Yatsi": "22:24"}, {"HicriTarihKisa": "29.8.1447", "HicriTarihKisaIso8601": null, "HicriTarihUzun": "29 Şaban 1447", "HicriTarihUzunIso8601": null, "AyinSekliURL": "https://namazvakti.diyanet.gov.tr/images/ictima.gif", "MiladiTarihKisa": "17.02.2026", "MiladiTarihKisaIso8601": "17.02.2026", "MiladiTarihUzun": "17 Şubat 2026 Salı", "MiladiTarihUzunIso8601": "2026-02-17T00:00:00.0000000-03:00", "GreenwichOrtalamaZamani": 3.0, "Aksam": "20:54", "Gunes": "07:05", "GunesBatis": "20:47", "GunesDogus": "07:12", "Ikindi": "17:51", "Imsak": "05:30", "KibleSaati": "07:25", "Ogle": "14:04", "Yatsi": "22:22"}, {"HicriTarihKisa": "30.8.1447", "HicriTarihKisaIso8601": null, "HicriTarihUzun": "30 Şaban 1447", "HicriTarihUzunIso8601": null, "AyinSekliURL": "https://namazvakti.diyanet.gov.tr/images/ruyet.gif", "MiladiTarihKisa": "18.02.2026", "MiladiTarihKisaIso8601": "18.02.2026", "MiladiTarihUzun": "18 Şubat 2026 Çarşamba", "MiladiTarihUzunIso8601": "2026-02-18T00:00:00.0000000-03:00", "GreenwichOrtalamaZamani": 3.0, "Aksam": "20:53", "Gunes": "07:06", "GunesBatis": "20:46", "GunesDogus": "07:13", "Ikindi": "17:50", "Imsak": "05:32", "KibleSaati": "07:26", "Ogle": "14:04", "Yatsi": "22:20"}, {"HicriTarihKisa": "1.9.1447", "HicriTarihKisaIso8601": null, "HicriTarihUzun": "1 Ramazan 1447", "HicriTarihUzunIso8601": null, "AyinSekliURL": "https://namazvakti.diyanet.gov.tr/images/r1.gif", "MiladiTarihKisa": "19.02.2026", "MiladiTarihKisaIso8601": "19.02.2026", "MiladiTarihUzun": "19 Şubat 2026 Perşembe", "MiladiTarihUzunIso8601": "2026-02-19T00:00:00.0000000-03:00", "GreenwichOrtalamaZamani": 3.0, "Aksam": "20:51", "Gunes": "07:07", "GunesBatis": "20:44", "GunesDogus": "07:14", "Ikindi": "17:49", "Imsak": "05:33", "KibleSaati": "07:28", "Ogle": "14:04", "Yatsi": "22:18"}, {"HicriTarihKisa": "2.9.1447", "HicriTarihKisaIso8601": null, "HicriTarihUzun": "2 Ramazan 1447", "HicriTarihUzunIso8601": null, "AyinSekliURL": "https://namazvakti.diyanet.gov.tr/images/r2.gif", "MiladiTarihKisa": "20.02.2026", "MiladiTarihKisaIso8601": "20.02.2026", "MiladiTarihUzun": "20 Şubat 2026 Cuma", "MiladiTarihUzunIso8601": "2026-02-20T00:00:00.0000000-03:00", "GreenwichOrtalamaZamani": 3.0, "Aksam": "20:50", "Gunes": "07:08", "GunesBatis": "20:43", "GunesDogus": "07:15", "Ikindi": "17:49", "Imsak": "05:35", "KibleSaati": "07:30", "Ogle": "14:04", "Yatsi": "22:17"}, {"HicriTarihKisa": "3.9.1447", "HicriTarihKisaIso8601": null, "HicriTarihUzun": "3 Ramazan 1447", "HicriTarihUzunIso8601": null, "AyinSekliURL": "https://namazvakti.diyanet.gov.tr/images/r3.gif", "MiladiTarihKisa": "21.02.2026", "MiladiTarihKisaIso8601": "21.02.2026", "MiladiTarihUzun": "21 Şubat 2026 Cumartesi", "MiladiTarihUzunIso8601": "2026-02-21T00:00:00.0000000-03:00", "GreenwichOrtalamaZamani": 3.0, "Aksam": "20:48", "Gunes": "07:10", "GunesBatis": "20:41", "GunesDogus": "07:17", "Ikindi": "17:48", "Imsak": "05:37", "KibleSaati": "07:31", "Ogle": "14:04", "Yatsi": "22:15"}, {"HicriTarihKisa": "4.9.1447", "HicriTarihKisaIso8601": null, "HicriTarihUzun": "4 Ramazan 1447", "HicriTarihUzunIso8601": null, "AyinSekliURL": "https://namazvakti.diyanet.gov.tr/images/r4.gif", "MiladiTarihKisa": "22.02.2026", "MiladiTarihKisaIso8601": "22.02.2026", "MiladiTarihUzun": "22 Şubat 2026 Pazar", "MiladiTarihUzunIso8601": "2026-02-22T00:00:00.0000000-03:00", "GreenwichOrtalamaZamani": 3.0, "Aksam": "20:47", "Gunes": "07:11", "GunesBatis": "20:40", "GunesDogus": "07:18", "Ikindi": "17:47", "Imsak": "05:38", "KibleSaati": "07:33", "Ogle": "14:04", "Yatsi": "22:13"}, {"HicriTarihKisa": "5.9.1447", "HicriTarihKisaIso8601": null, "HicriTarihUzun": "5 Ramazan 1447", "HicriTarihUzunIso8601": null, "AyinSekliURL": "https://namazvakti.diyanet.gov.tr/images/r5.gif", "MiladiTarihKisa": "23.02.2026", "MiladiTarihKisaIso8601": "23.02.2026", "MiladiTarihUzun": "23 Şubat 2026 Pazartesi", "MiladiTarihUzunIso8601": "2026-02-23T00:00:00.0000000-03:00", "GreenwichOrtalamaZamani": 3.0, "Aksam": "20:45", "Gunes": "07:12", "GunesBatis": "20:38", "GunesDogus": "07:19", "Ikindi": "17:46", "Imsak": "05:40", "KibleSaati": "07:34", "Ogle": "14:04", "Yatsi": "22:11"}, {"HicriTarihKisa": "6.9.1447", "HicriTarihKisaIso8601": null, "HicriTarihUzun": "6 Ramazan 1447", "HicriTarihUzunIso8601": null, "AyinSekliURL": "https://namazvakti.diyanet.gov.tr/images/ilkdordun.gif", "MiladiTarihKisa": "24.02.2026", "MiladiTarihKisaIso8601": "24.02.2026", "MiladiTarihUzun": "24 Şubat 2026 Salı", "MiladiTarihUzunIso8601": "2026-02-24T00:00:00.0000000-03:00", "GreenwichOrtalamaZamani": 3.0, "Aksam": "20:44", "Gunes": "07:13", "GunesBatis": "20:37", "GunesDogus": "07:20", "Ikindi": "17:46", "Imsak": "05:42", "KibleSaati": "07:36", "Ogle": "14:04", "Yatsi": "22:09"}, {"HicriTarihKisa": "7.9.1447", "HicriTarihKisaIso8601": null, "HicriTarihUzun": "7 Ramazan 1447", "HicriTarihUzunIso8601": null, "AyinSekliURL": "https://namazvakti.diyanet.gov.tr/images/i1.gif", "MiladiTarihKisa": "25.02.2026", "MiladiTarihKisaIso8601": "25.02.2026", "MiladiTarihUzun": "25 Şubat 2026 Çarşamba", "MiladiTarihUzunIso8601": "2026-02-25T00:00:00.0000000-03:00", "GreenwichOrtalamaZamani": 3.0, "Aksam": "20:42", "Gunes": "07:14", "GunesBatis": "20:35", "GunesDogus": "07:21", "Ikindi": "17:45", "Imsak": "05:43", "KibleSaati": "07:38", "Ogle": "14:03", "Yatsi": "22:08"}, {"HicriTarihKisa": "8.9.1447", "HicriTarihKisaIso8601": null, "HicriTarihUzun": "8 Ramazan 1447", "HicriTarihUzunIso8601": null, "AyinSekliURL": "https://namazvakti.diyanet.gov.tr/images/i2.gif", "MiladiTarihKisa": "26.02.2026", "MiladiTarihKisaIso8601": "26.02.2026", "MiladiTarihUzun": "26 Şubat 2026 Perşembe", "MiladiTarihUzunIso8601": "2026-02-26T00:00:00.0000000-03:00", "GreenwichOrtalamaZamani": 3.0, "Aksam": "20:41", "Gunes": "07:16", "GunesBatis": "20:34", "GunesDogus": "07:23", "Ikindi": "17:44", "Imsak": "05:45", "KibleSaati": "07:39", "Ogle": "14:03", "Yatsi": "22:06"}, {"HicriTarihKisa": "9.9.1447", "HicriTarihKisaIso8601": null, "HicriTarihUzun": "9 Ramazan 1447", "HicriTarihUzunIso8601": null, "AyinSekliURL": "https://namazvakti.diyanet.gov.tr/images/i3.gif", "MiladiTarihKisa": "27.02.2026", "MiladiTarihKisaIso8601": "27.02.2026", "MiladiTarihUzun": "27 Şubat 2026 Cuma", "MiladiTarihUzunIso8601": "2026-02-27T00:00:00.0000000-03:00", "GreenwichOrtalamaZamani": 3.0, "Aksam": "20:39", "Gunes": "07:17", "GunesBatis": "20:32", "GunesDogus": "07:24", "Ikindi": "17:43", "Imsak": "05:46", "KibleSaati": "07:41", "Ogle": "14:03", "Yatsi": "22:04"}, {"HicriTarihKisa": "10.9.1447", "HicriTarihKisaIso8601": null, "HicriTarihUzun": "10 Ramazan 1447", "HicriTarihUzunIso8601": null, "AyinSekliURL": "https://namazvakti.diyanet.gov.tr/images/i4.gif", "MiladiTarihKisa": "28.02.2026", "MiladiTarihKisaIso8601": "28.02.2026", "MiladiTarihUzun": "28 Şubat 2026 Cumartesi", "MiladiTarihUzunIso8601": "2026-02-28T00:00:00.0000000-03:00", "GreenwichOrtalamaZamani": 3.0, "Aksam": "20:38", "Gunes": "07:18", "GunesBatis": "20:31", "GunesDogus": "07:25", "Ikindi": "17:43", "Imsak": "05:48", "KibleSaati": "07:42", "Ogle": "14:03", "Yatsi": "22:02"}, {"HicriTarihKisa": "11.9.1447", "HicriTarihKisaIso8601": null, "HicriTarihUzun": "11 Ramazan 1447", "HicriTarihUzunIso8601": null, "AyinSekliURL": "https://namazvakti.diyanet.gov.tr/images/i5.gif", "MiladiTarihKisa": "01.03.2026", "MiladiTarihKisaIso8601": "01.03.2026", "MiladiTarihUzun": "01 Mart 2026 Pazar", "MiladiTarihUzunIso8601": "2026-03-01T00:00:00.0000000-03:00", "GreenwichOrtalamaZamani": 3.0, "Aksam": "20:36", "Gunes": "07:19", "GunesBatis": "20:29", "GunesDogus": "07:26", "Ikindi": "17:42", "Imsak": "05:49", "KibleSaati": "07:44", "Ogle": "14:03", "Yatsi": "22:00"}, {"HicriTarihKisa": "12.9.1447", "HicriTarihKisaIso8601": null, "HicriTarihUzun": "12 Ramazan 1447", "HicriTarihUzunIso8601": null, "AyinSekliURL": "https://namazvakti.diyanet.gov.tr/images/i6.gif", "MiladiTarihKisa": "02.03.2026", "MiladiTarihKisaIso8601": "02.03.2026", "MiladiTarihUzun": "02 Mart 2026 Pazartesi", "MiladiTarihUzunIso8601": "2026-03-02T00:00:00.0000000-03:00", "GreenwichOrtalamaZamani": 3.0, "Aksam": "20:35", "Gunes": "07:20", "GunesBatis": "20:28", "GunesDogus": "07:27", "Ikindi": "17:41", "Imsak": "05:51", "KibleSaati": "07:46", "Ogle": "14:02", "Yatsi": "21:58"}, {"HicriTarihKisa": "13.9.1447", "HicriTarihKisaIso8601": null, "HicriTarihUzun": "13 Ramazan 1447", "HicriTarihUzunIso8601": null, "AyinSekliURL": "https://namazvakti.diyanet.gov.tr/images/dolunay.gif", "MiladiTarihKisa": "03.03.2026", "MiladiTarihKisaIso8601": "03.03.2026", "MiladiTarihUzun": "03 Mart 2026 Salı", "MiladiTarihUzunIso8601": "2026-03-03T00:00:00.0000000-03:00", "GreenwichOrtalamaZamani": 3.0, "Aksam": "20:33", "Gunes": "07:22", "GunesBatis": "20:26", "GunesDogus": "07:29", "Ikindi": "17:40", "Imsak": "05:52", "KibleSaati": "07:47", "Ogle": "14:02", "Yatsi": "21:56"}, {"HicriTarihKisa": "14.9.1447", "HicriTarihKisaIso8601": null, "HicriTarihUzun": "14 Ramazan 1447", "HicriTarihUzunIso8601": null, "AyinSekliURL": "https://namazvakti.diyanet.gov.tr/images/d1.gif", "MiladiTarihKisa": "04.03.2026", "MiladiTarihKisaIso8601": "04.03.2026", "MiladiTarihUzun": "04 Mart 2026 Çarşamba", "MiladiTarihUzunIso8601": "2026-03-04T00:00:00.0000000-03:00", "GreenwichOrtalamaZamani": 3.0, "Aksam": "20:31", "Gunes": "07:23", "GunesBatis": "20:24", "GunesDogus": "07:30", "Ikindi": "17:39", "Imsak": "05:54", "KibleSaati": "07:49", "Ogle": "14:02", "Yatsi": "21:55"}, {"HicriTarihKisa": "15.9.1447", "HicriTarihKisaIso8601": null, "HicriTarihUzun": "15 Ramazan 1447", "HicriTarihUzunIso8601": null, "AyinSekliURL": "https://namazvakti.diyanet.gov.tr/images/d2.gif", "MiladiTarihKisa": "05.03.2026", "MiladiTarihKisaIso8601": "05.03.2026", "MiladiTarihUzun": "05 Mart 2026 Perşembe", "MiladiTarihUzunIso8601": "2026-03-05T00:00:00.0000000-03:00", "GreenwichOrtalamaZamani": 3.0, "Aksam": "20:30", "Gunes": "07:24", "GunesBatis": "20:23", "GunesDogus": "07:31", "Ikindi": "17:38", "Imsak": "05:55", "KibleSaati": "07:50", "Ogle": "14:02", "Yatsi": "21:53"}, {"HicriTarihKisa": "16.9.1447", "HicriTarihKisaIso8601": null, "HicriTarihUzun": "16 Ramazan 1447", "HicriTarihUzunIso8601": null, "AyinSekliURL": "https://namazvakti.diyanet.gov.tr/images/d3.gif", "MiladiTarihKisa": "06.03.2026", "MiladiTarihKisaIso8601": "06.03.2026", "MiladiTarihUzun": "06 Mart 2026 Cuma", "MiladiTarihUzunIso8601": "2026-03-06T00:00:00.0000000-03:00", "GreenwichOrtalamaZamani": 3.0, "Aksam": "20:28", "Gunes": "07:25", "GunesBatis": "20:21", "GunesDogus": "07:32", "Ikindi": "17:37", "Imsak": "05:57", "KibleSaati": "07:52", "Ogle": "14:02", "Yatsi": "21:51"}, {"HicriTarihKisa": "17.9.1447", "HicriTarihKisaIso8601": null, "HicriTarihUzun": "17 Ramazan 1447", "HicriTarihUzunIso8601": null, "AyinSekliURL": "https://namazvakti.diyanet.gov.tr/images/d4.gif", "MiladiTarihKisa": "07.03.2026", "MiladiTarihKisaIso8601": "07.03.2026", "MiladiTarihUzun": "07 Mart 2026 Cumartesi", "MiladiTarihUzunIso8601": "2026-03-07T00:00:00.0000000-03:00", "GreenwichOrtalamaZamani": 3.0, "Aksam": "20:27", "Gunes": "07:26", "GunesBatis": "20:20", "GunesDogus": "07:33", "Ikindi": "17:36", "Imsak": "05:58", "KibleSaati": "07:54", "Ogle": "14:01", "Yatsi": "21:49"}, {"HicriTarihKisa": "18.9.1447", "HicriTarihKisaIso8601": null, "HicriTarihUzun": "18 Ramazan 1447", "HicriTarihUzunIso8601": null, "AyinSekliURL": "https://namazvakti.diyanet.gov.tr/images/d5.gif", "MiladiTarihKisa": "08.03.2026", "MiladiTarihKisaIso8601": "08.03.2026", "MiladiTarihUzun": "08 Mart 2026 Pazar", "MiladiTarihUzunIso8601": "2026-03-08T00:00:00.0000000-03:00", "GreenwichOrtalamaZamani": 3.0, "Aksam": "20:25", "Gunes": "07:27", "GunesBatis": "20:18", "GunesDogus": "07:34", "Ikindi": "17:35", "Imsak": "05:59", "KibleSaati": "07:55", "Ogle": "14:01", "Yatsi": "21:47"}]