[{"HicriTarihKisa": "16.8.1447", "HicriTarihKisaIso8601": null, "HicriTarihUzun": "16 Şaban 1447", "HicriTarihUzunIso8601": null, "AyinSekliURL": "https://namazvakti.diyanet.gov.tr/images/d2.gif", "MiladiTarihKisa": "04.02.2026", "MiladiTarihKisaIso8601": "04.02.2026", "MiladiTarihUzun": "04 Şubat 2026 Çarşamba", "MiladiTarihUzunIso8601": "2026-02-04T00:00:00.0000000+04:00", "GreenwichOrtalamaZamani": 3.0, "Aksam": "16:29", "Gunes": "06:03", "GunesBatis": "16:22", "GunesDogus": "06:10", "Ikindi": "14:04", "Imsak": "04:36", "KibleSaati": "12:01", "Ogle": "11:21", "Yatsi": "17:50"}, {"HicriTarihKisa": "17.8.1447", "HicriTarihKisaIso8601": null, "HicriTarihUzun": "17 Şaban 1447", "HicriTarihUzunIso8601": null, "AyinSekliURL": "https://namazvakti.diyanet.gov.tr/images/d3.gif", "MiladiTarihKisa": "05.02.2026", "MiladiTarihKisaIso8601": "05.02.2026", "MiladiTarihUzun": "05 Şubat 2026 Perşembe", "MiladiTarihUzunIso8601": "2026-02-05T00:00:00.0000000+04:00", "GreenwichOrtalamaZamani": 3.0, "Aksam": "16:30", "Gunes": "06:02", "GunesBatis": "16:23", "GunesDogus": "06:09", "Ikindi": "14:05", "Imsak": "04:35", "KibleSaati": "12:01", "Ogle": "11:21", "Yatsi": "17:52"}, {"HicriTarihKisa": "18.8.1447", "HicriTarihKisaIso8601": null, "HicriTarihUzun": "18 Şaban 1447", "HicriTarihUzunIso8601": null, "AyinSekliURL": "https://namazvakti.diyanet.gov.tr/images/d4.gif", "MiladiTarihKisa": "06.02.2026", "MiladiTarihKisaIso8601": "06.02.2026", "MiladiTarihUzun": "06 Şubat 2026 Cuma", "MiladiTarihUzunIso8601": "2026-02-06T00:00:00.0000000+04:00", "GreenwichOrtalamaZamani": 3.0, "Aksam": "16:32", "Gunes": "06:01", "GunesBatis": "16:25", "GunesDogus": "06:08", "Ikindi": "14:06", "Imsak": "04:34", "KibleSaati": "12:01", "Ogle": "11:21", "Yatsi": "17:53"}, {"HicriTarihKisa": "19.8.1447", "HicriTarihKisaIso8601": null, "HicriTarihUzun": "19 Şaban 1447", "HicriTarihUzunIso8601": null, "AyinSekliURL": "https://namazvakti.diyanet.gov.tr/images/d5.gif", "MiladiTarihKisa": "07.02.2026", "MiladiTarihKisaIso8601": "07.02.2026", "MiladiTarihUzun": "07 Şubat 2026 Cumartesi", "MiladiTarihUzunIso8601": "2026-02-07T00:00:00.0000000+04:00", "GreenwichOrtalamaZamani": 3.0, "Aksam": "16:33", "Gunes": "05:59", "GunesBatis": "16:26", "GunesDogus": "06:06", "Ikindi": "14:07", "Imsak": "04:33", "KibleSaati": "12:01", "Ogle": "11:21", "Yatsi": "17:54"}, {"HicriTarihKisa": "20.8.1447", "HicriTarihKisaIso8601": null, "HicriTarihUzun": "20 Şaban 1447", "HicriTarihUzunIso8601": null, "AyinSekliURL": "https://namazvakti.diyanet.gov.tr/images/d6.gif", "MiladiTarihKisa": "08.02.2026", "MiladiTarihKisaIso8601": "08.02.2026", "MiladiTarihUzun": "08 Şubat 2026 Pazar", "MiladiTarihUzunIso8601": "2026-02-08T00:00:00.0000000+04:00", "GreenwichOrtalamaZamani": 3.0, "Aksam": "16:34", "Gunes": "05:58", "GunesBatis": "16:27", "GunesDogus": "06:05", "Ikindi": "14:08", "Imsak": "04:32", "KibleSaati": "12:01", "Ogle": "11:21", "Yatsi": "17:55"}, {"HicriTarihKisa": "21.8.1447", "HicriTarihKisaIso8601": null, "HicriTarihUzun": "21 Şaban 1447", "HicriTarihUzunIso8601": null, "AyinSekliURL": "https://namazvakti.diyanet.gov.tr/images/sondordun.gif", "MiladiTarihKisa": "09.02.2026", "MiladiTarihKisaIso8601": "09.02.2026", "MiladiTarihUzun": "09 Şubat 2026 Pazartesi", "MiladiTarihUzunIso8601": "2026-02-09T00:00:00.0000000+04:00", "GreenwichOrtalamaZamani": 3.0, "Aksam": "16:35", "Gunes": "05:57", "GunesBatis": "16:28", "GunesDogus": "06:04", "Ikindi": "14:09", "Imsak": "04:31", "KibleSaati": "12:01", "Ogle": "11:21", "Yatsi": "17:56"}, {"HicriTarihKisa": "22.8.1447", "HicriTarihKisaIso8601": null, "HicriTarihUzun": "22 Şaban 1447", "HicriTarihUzunIso8601": null, "AyinSekliURL": "https://namazvakti.diyanet.gov.tr/images/sd1.gif", "MiladiTarihKisa": "10.02.2026", "MiladiTarihKisaIso8601": "10.02.2026", "MiladiTarihUzun": "10 Şubat 2026 Salı", "MiladiTarihUzunIso8601": "2026-02-10T00:00:00.0000000+04:00", "GreenwichOrtalamaZamani": 3.0, "Aksam": "16:37", "Gunes": "05:56", "GunesBatis": "16:30", "GunesDogus": "06:03", "Ikindi": "14:10", "Imsak": "04:30", "KibleSaati": "12:00", "Ogle": "11:21", "Yatsi": "17:57"}, {"HicriTarihKisa": "23.8.1447", "HicriTarihKisaIso8601": null, "HicriTarihUzun": "23 Şaban 1447", "HicriTarihUzunIso8601": null, "AyinSekliURL": "https://namazvakti.diyanet.gov.tr/images/sd2.gif", "MiladiTarihKisa": "11.02.2026", "MiladiTarihKisaIso8601": "11.02.2026", "MiladiTarihUzun": "11 Şubat 2026 Çarşamba", "MiladiTarihUzunIso8601": "2026-02-11T00:00:00.0000000+04:00", "GreenwichOrtalamaZamani": 3.0, "Aksam": "16:38", "Gunes": "05:55", "GunesBatis": "16:31", "GunesDogus": "06:02", "Ikindi": "14:11", "Imsak": "04:29", "KibleSaati": "12:00", "Ogle": "11:21", "Yatsi": "17:58"}, {"HicriTarihKisa": "24.8.1447", "HicriTarihKisaIso8601": null, "HicriTarihUzun": "24 Şaban 1447", "HicriTarihUzunIso8601": null, "AyinSekliURL": "https://namazvakti.diyanet.gov.tr/images/sd3.gif", "MiladiTarihKisa": "12.02.2026", "MiladiTarihKisaIso8601": "12.02.2026", "MiladiTarihUzun": "12 Şubat 2026 Perşembe", "MiladiTarihUzunIso8601": "2026-02-12T00:00:00.0000000+04:00", "GreenwichOrtalamaZamani": 3.0, "Aksam": "16:39", "Gunes": "05:53", "GunesBatis": "16:32", "GunesDogus": "06:00", "Ikindi": "14:12", "Imsak": "04:28", "KibleSaati": "12:00", "Ogle": "11:21", "Yatsi": "17:59"}, {"HicriTarihKisa": "25.8.1447", "HicriTarihKisaIso8601": null, "HicriTarihUzun": "25 Şaban 1447", "HicriTarihUzunIso8601": null, "AyinSekliURL": "https://namazvakti.diyanet.gov.tr/images/sd4.gif", "MiladiTarihKisa": "13.02.2026", "MiladiTarihKisaIso8601": "13.02.2026", "MiladiTarihUzun": "13 Şubat 2026 Cuma", "MiladiTarihUzunIso8601": "2026-02-13T00:00:00.0000000+04:00", "GreenwichOrtalamaZamani": 3.0, "Aksam": "16:40", "Gunes": "05:52", "GunesBatis": "16:33", "GunesDogus": "05:59", "Ikindi": "14:12", "Imsak": "04:27", "KibleSaati": "12:00", "Ogle": "11:21", "Yatsi": "18:00"}, {"HicriTarihKisa": "26.8.1447", "HicriTarihKisaIso8601": null, "HicriTarihUzun": "26 Şaban 1447", "HicriTarihUzunIso8601": null, "AyinSekliURL": "https://namazvakti.diyanet.gov.tr/images/sd5.gif", "MiladiTarihKisa": "14.02.2026", "MiladiTarihKisaIso8601": "14.02.2026", "MiladiTarihUzun": "14 Şubat 2026 Cumartesi", "MiladiTarihUzunIso8601": "2026-02-14T00:00:00.0000000+04:00", "GreenwichOrtalamaZamani": 3.0, "Aksam": "16:42", "Gunes": "05:51", "GunesBatis": "16:35", "GunesDogus": "05:58", "Ikindi": "14:13", "Imsak": "04:26", "KibleSaati": "11:59", "Ogle": "11:21", "Yatsi": "18:01"}, {"HicriTarihKisa": "27.8.1447", "HicriTarihKisaIso8601": null, "HicriTarihUzun": "27 Şaban 1447", "HicriTarihUzunIso8601": null, "AyinSekliURL": "https://namazvakti.diyanet.gov.tr/images/sd6.gif", "MiladiTarihKisa": "15.02.2026", "MiladiTarihKisaIso8601": "15.02.2026", "MiladiTarihUzun": "15 Şubat 2026 Pazar", "MiladiTarihUzunIso8601": "2026-02-15T00:00:00.0000000+04:00", "GreenwichOrtalamaZamani": 3.0, "Aksam": "16:43", "Gunes": "05:50", "GunesBatis": "16:36", "GunesDogus": "05:57", "Ikindi": "14:14", "Imsak": "04:25", "KibleSaati": "11:59", "Ogle": "11:21", "Yatsi": "18:03"}, {"HicriTarihKisa": "28.8.1447", "HicriTarihKisaIso8601": null, "HicriTarihUzun": "28 Şaban 1447", "HicriTarihUzunIso8601": null, "AyinSekliURL": "https://namazvakti.diyanet.gov.tr/images/sd7.gif", "MiladiTarihKisa": "16.02.2026", "MiladiTarihKisaIso8601": "16.02.2026", "MiladiTarihUzun": "16 Şubat 2026 Pazartesi", "MiladiTarihUzunIso8601": "2026-02-16T00:00:00.0000000+04:00", "GreenwichOrtalamaZamani": 3.0, "Aksam": "16:44", "Gunes": "05:48", "GunesBatis": "16:37", "GunesDogus": "05:55", "Ikindi": "14:15", "Imsak": "04:23", "KibleSaati": "11:59", "Ogle": "11:21", "Yatsi": "18:04"}, {"HicriTarihKisa": "29.8.1447", "HicriTarihKisaIso8601": null, "HicriTarihUzun": "29 Şaban 1447", "HicriTarihUzunIso8601": null, "AyinSekliURL": "https://namazvakti.diyanet.gov.tr/images/ictima.gif", "MiladiTarihKisa": "17.02.2026", "MiladiTarihKisaIso8601": "17.02.2026", "MiladiTarihUzun": "17 Şubat 2026 Salı", "MiladiTarihUzunIso8601": "2026-02-17T00:00:00.0000000+04:00", "GreenwichOrtalamaZamani": 3.0, "Aksam": "16:45", "Gunes": "05:47", "GunesBatis": "16:38", "GunesDogus": "05:54", "Ikindi": "14:16", "Imsak": "04:22", "KibleSaati": "11:59", "Ogle": "11:21", "Yatsi": "18:05"}, {"HicriTarihKisa": "30.8.1447", "HicriTarihKisaIso8601": null, "HicriTarihUzun": "30 Şaban 1447", "HicriTarihUzunIso8601": null, "AyinSekliURL": "https://namazvakti.diyanet.gov.tr/images/ruyet.gif", "MiladiTarihKisa": "18.02.2026", "MiladiTarihKisaIso8601": "18.02.2026", "MiladiTarihUzun": "18 Şubat 2026 Çarşamba", "MiladiTarihUzunIso8601": "2026-02-18T00:00:00.0000000+04:00", "GreenwichOrtalamaZamani": 3.0, "Aksam": "16:46", "Gunes": "05:46", "GunesBatis": "16:39", "GunesDogus": "05:53", "Ikindi": "14:17", "Imsak": "04:21", "KibleSaati": "11:58", "Ogle": "11:21", "Yatsi": "18:06"}, {"HicriTarihKisa": "1.9.1447", "HicriTarihKisaIso8601": null, "HicriTarihUzun": "1 Ramazan 1447", "HicriTarihUzunIso8601": null, "AyinSekliURL": "https://namazvakti.diyanet.gov.tr/images/r1.gif", "MiladiTarihKisa": "19.02.2026", "MiladiTarihKisaIso8601": "19.02.2026", "MiladiTarihUzun": "19 Şubat 2026 Perşembe", "MiladiTarihUzunIso8601": "2026-02-19T00:00:00.0000000+04:00", "GreenwichOrtalamaZamani": 3.0, "Aksam": "16:48", "Gunes": "05:44", "GunesBatis": "16:41", "GunesDogus": "05:51", "Ikindi": "14:18", "Imsak": "04:20", "KibleSaati": "11:58", "Ogle": "11:21", "Yatsi": "18:07"}, {"HicriTarihKisa": "2.9.1447", "HicriTarihKisaIso8601": null, "HicriTarihUzun": "2 Ramazan 1447", "HicriTarihUzunIso8601": null, "AyinSekliURL": "https://namazvakti.diyanet.gov.tr/images/r2.gif", "MiladiTarihKisa": "20.02.2026", "MiladiTarihKisaIso8601": "20.02.2026", "MiladiTarihUzun": "20 Şubat 2026 Cuma", "MiladiTarihUzunIso8601": "2026-02-20T00:00:00.0000000+04:00", "GreenwichOrtalamaZamani": 3.0, "Aksam": "16:49", "Gunes": "05:43", "GunesBatis": "16:42", "GunesDogus": "05:50", "Ikindi": "14:19", "Imsak": "04:18", "KibleSaati": "11:58", "Ogle": "11:21", "Yatsi": "18:08"}, {"HicriTarihKisa": "3.9.1447", "HicriTarihKisaIso8601": null, "HicriTarihUzun": "3 Ramazan 1447", "HicriTarihUzunIso8601": null, "AyinSekliURL": "https://namazvakti.diyanet.gov.tr/images/r3.gif", "MiladiTarihKisa": "21.02.2026", "MiladiTarihKisaIso8601": "21.02.2026", "MiladiTarihUzun": "21 Şubat 2026 Cumartesi", "MiladiTarihUzunIso8601": "2026-02-21T00:00:00.0000000+04:00", "GreenwichOrtalamaZamani": 3.0, "Aksam": "16:50", "Gunes": "05:42", "GunesBatis": "16:43", "GunesDogus": "05:49", "Ikindi": "14:20", "Imsak": "04:17", "KibleSaati": "11:57", "Ogle": "11:21", "Yatsi": "18:09"}, {"HicriTarihKisa": "4.9.1447", "HicriTarihKisaIso8601": null, "HicriTarihUzun": "4 Ramazan 1447", "HicriTarihUzunIso8601": null, "AyinSekliURL": "https://namazvakti.diyanet.gov.tr/images/r4.gif", "MiladiTarihKisa": "22.02.2026", "MiladiTarihKisaIso8601": "22.02.2026", "MiladiTarihUzun": "22 Şubat 2026 Pazar", "MiladiTarihUzunIso8601": "2026-02-22T00:00:00.0000000+04:00", "GreenwichOrtalamaZamani": 3.0, "Aksam": "16:51", "Gunes": "05:40", "GunesBatis": "16:44", "GunesDogus": "05:47", "Ikindi": "14:21", "Imsak": "04:16", "KibleSaati": "11:57", "Ogle": "11:21", "Yatsi": "18:10"}, {"HicriTarihKisa": "5.9.1447", "HicriTarihKisaIso8601": null, "HicriTarihUzun": "5 Ramazan 1447", "HicriTarihUzunIso8601": null, "AyinSekliURL": "https://namazvakti.diyanet.gov.tr/images/r5.gif", "MiladiTarihKisa": "23.02.2026", "MiladiTarihKisaIso8601": "23.02.2026", "MiladiTarihUzun": "23 Şubat 2026 Pazartesi", "MiladiTarihUzunIso8601": "2026-02-23T00:00:00.0000000+04:00", "GreenwichOrtalamaZamani": 3.0, "Aksam": "16:52", "Gunes": "05:39", "GunesBatis": "16:45", "GunesDogus": "05:46", "Ikindi": "14:21", "Imsak": "04:14", "KibleSaati": "11:56", "Ogle": "11:20", "Yatsi": "18:11"}, {"HicriTarihKisa": "6.9.1447", "HicriTarihKisaIso8601": null, "HicriTarihUzun": "6 Ramazan 1447", "HicriTarihUzunIso8601": null, "AyinSekliURL": "https://namazvakti.diyanet.gov.tr/images/ilkdordun.gif", "MiladiTarihKisa": "24.02.2026", "MiladiTarihKisaIso8601": "24.02.2026", "MiladiTarihUzun": "24 Şubat 2026 Salı", "MiladiTarihUzunIso8601": "2026-02-24T00:00:00.0000000+04:00", "GreenwichOrtalamaZamani": 3.0, "Aksam": "16:53", "Gunes": "05:37", "GunesBatis": "16:46", "GunesDogus": "05:44", "Ikindi": "14:22", "Imsak": "04:13", "KibleSaati": "11:56", "Ogle": "11:20", "Yatsi": "18:12"}, {"HicriTarihKisa": "7.9.1447", "HicriTarihKisaIso8601": null, "HicriTarihUzun": "7 Ramazan 1447", "HicriTarihUzunIso8601": null, "AyinSekliURL": "https://namazvakti.diyanet.gov.tr/images/i1.gif", "MiladiTarihKisa": "25.02.2026", "MiladiTarihKisaIso8601": "25.02.2026", "MiladiTarihUzun": "25 Şubat 2026 Çarşamba", "MiladiTarihUzunIso8601": "2026-02-25T00:00:00.0000000+04:00", "GreenwichOrtalamaZamani": 3.0, "Aksam": "16:55", "Gunes": "05:36", "GunesBatis": "16:48", "GunesDogus": "05:43", "Ikindi": "14:23", "Imsak": "04:12", "KibleSaati": "11:56", "Ogle": "11:20", "Yatsi": "18:14"}, {"HicriTarihKisa": "8.9.1447", "HicriTarihKisaIso8601": null, "HicriTarihUzun": "8 Ramazan 1447", "HicriTarihUzunIso8601": null, "AyinSekliURL": "https://namazvakti.diyanet.gov.tr/images/i2.gif", "MiladiTarihKisa": "26.02.2026", "MiladiTarihKisaIso8601": "26.02.2026", "MiladiTarihUzun": "26 Şubat 2026 Perşembe", "MiladiTarihUzunIso8601": "2026-02-26T00:00:00.0000000+04:00", "GreenwichOrtalamaZamani": 3.0, "Aksam": "16:56", "Gunes": "05:34", "GunesBatis": "16:49", "GunesDogus": "05:41", "Ikindi": "14:24", "Imsak": "04:10", "KibleSaati": "11:55", "Ogle": "11:20", "Yatsi": "18:15"}, {"HicriTarihKisa": "9.9.1447", "HicriTarihKisaIso8601": null, "HicriTarihUzun": "9 Ramazan 1447", "HicriTarihUzunIso8601": null, "AyinSekliURL": "https://namazvakti.diyanet.gov.tr/images/i3.gif", "MiladiTarihKisa": "27.02.2026", "MiladiTarihKisaIso8601": "27.02.2026", "MiladiTarihUzun": "27 Şubat 2026 Cuma", "MiladiTarihUzunIso8601": "2026-02-27T00:00:00.0000000+04:00", "GreenwichOrtalamaZamani": 3.0, "Aksam": "16:57", "Gunes": "05:33", "GunesBatis": "16:50", "GunesDogus": "05:40", "Ikindi": "14:25", "Imsak": "04:09", "KibleSaati": "11:55", "Ogle": "11:20", "Yatsi": "18:16"}, {"HicriTarihKisa": "10.9.1447", "HicriTarihKisaIso8601": null, "HicriTarihUzun": "10 Ramazan 1447", "HicriTarihUzunIso8601": null, "AyinSekliURL": "https://namazvakti.diyanet.gov.tr/images/i4.gif", "MiladiTarihKisa": "28.02.2026", "MiladiTarihKisaIso8601": "28.02.2026", "MiladiTarihUzun": "28 Şubat 2026 Cumartesi", "MiladiTarihUzunIso8601": "2026-02-28T00:00:00.0000000+04:00", "GreenwichOrtalamaZamani": 3.0, "Aksam": "16:58", "Gunes": "05:31", "GunesBatis": "16:51", "GunesDogus": "05:38", "Ikindi": "14:25", "Imsak": "04:07", "KibleSaati": "11:54", "Ogle": "11:20", "Yatsi": "18:17"}, {"HicriTarihKisa": "11.9.1447", "HicriTarihKisaIso8601": null, "HicriTarihUzun": "11 Ramazan 1447", "HicriTarihUzunIso8601": null, "AyinSekliURL": "https://namazvakti.diyanet.gov.tr/images/i5.gif", "MiladiTarihKisa": "01.03.2026", "MiladiTarihKisaIso8601": "01.03.2026", "MiladiTarihUzun": "01 Mart 2026 Pazar", "MiladiTarihUzunIso8601": "2026-03-01T00:00:00.0000000+04:00", "GreenwichOrtalamaZamani": 3.0, "Aksam": "16:59", "Gunes": "05:30", "GunesBatis": "16:52", "GunesDogus": "05:37", "Ikindi": "14:26", "Imsak": "04:06", "KibleSaati": "11:54", "Ogle": "11:19", "Yatsi": "18:18"}, {"HicriTarihKisa": "12.9.1447", "HicriTarihKisaIso8601": null, "HicriTarihUzun": "12 Ramazan 1447", "HicriTarihUzunIso8601": null, "AyinSekliURL": "https://namazvakti.diyanet.gov.tr/images/i6.gif", "MiladiTarihKisa": "02.03.2026", "MiladiTarihKisaIso8601": "02.03.2026", "MiladiTarihUzun": "02 Mart 2026 Pazartesi", "MiladiTarihUzunIso8601": "2026-03-02T00:00:00.0000000+04:00", "GreenwichOrtalamaZamani": 3.0, "Aksam": "17:00", "Gunes": "05:28", "GunesBatis": "16:53", "GunesDogus": "05:35", "Ikindi": "14:27", "Imsak": "04:04", "KibleSaati": "11:53", "Ogle": "11:19", "Yatsi": "18:19"}, {"HicriTarihKisa": "13.9.1447", "HicriTarihKisaIso8601": null, "HicriTarihUzun": "13 Ramazan 1447", "HicriTarihUzunIso8601": null, "AyinSekliURL": "https://namazvakti.diyanet.gov.tr/images/dolunay.gif", "MiladiTarihKisa": "03.03.2026", "MiladiTarihKisaIso8601": "03.03.2026", "MiladiTarihUzun": "03 Mart 2026 Salı", "MiladiTarihUzunIso8601": "2026-03-03T00:00:00.0000000+04:00", "GreenwichOrtalamaZamani": 3.0, "Aksam": "17:02", "Gunes": "05:27", "GunesBatis": "16:55", "GunesDogus": "05:34", "Ikindi": "14:28", "Imsak": "04:03", "KibleSaati": "11:53", "Ogle": "11:19", "Yatsi": "18:20"}, {"HicriTarihKisa": "14.9.1447", "HicriTarihKisaIso8601": null, "HicriTarihUzun": "14 Ramazan 1447", "HicriTarihUzunIso8601": null, "AyinSekliURL": "https://namazvakti.diyanet.gov.tr/images/d1.gif", "MiladiTarihKisa": "04.03.2026", "MiladiTarihKisaIso8601": "04.03.2026", "MiladiTarihUzun": "04 Mart 2026 Çarşamba", "MiladiTarihUzunIso8601": "2026-03-04T00:00:00.0000000+04:00", "GreenwichOrtalamaZamani": 3.0, "Aksam": "17:03", "Gunes": "05:25", "GunesBatis": "16:56", "GunesDogus": "05:32", "Ikindi": "14:28", "Imsak": "04:01", "KibleSaati": "11:52", "Ogle": "11:19", "Yatsi": "18:21"}, {"HicriTarihKisa": "15.9.1447", "HicriTarihKisaIso8601": null, "HicriTarihUzun": "15 Ramazan 1447", "HicriTarihUzunIso8601": null, "AyinSekliURL": "https://namazvakti.diyanet.gov.tr/images/d2.gif", "MiladiTarihKisa": "05.03.2026", "MiladiTarihKisaIso8601": "05.03.2026", "MiladiTarihUzun": "05 Mart 2026 Perşembe", "MiladiTarihUzunIso8601": "2026-03-05T00:00:00.0000000+04:00", "GreenwichOrtalamaZamani": 3.0, "Aksam": "17:04", "Gunes": "05:24", "GunesBatis": "16:57", "GunesDogus": "05:31", "Ikindi": "14:29", "Imsak": "04:00", "KibleSaati": "11:52", "Ogle": "11:19", "Yatsi": "18:22"}, {"HicriTarihKisa": "16.9.1447", "HicriTarihKisaIso8601": null, "HicriTarihUzun": "16 Ramazan 1447", "HicriTarihUzunIso8601": null, "AyinSekliURL": "https://namazvakti.diyanet.gov.tr/images/d3.gif", "MiladiTarihKisa": "06.03.2026", "MiladiTarihKisaIso8601": "06.03.2026", "MiladiTarihUzun": "06 Mart 2026 Cuma", "MiladiTarihUzunIso8601": "2026-03-06T00:00:00.0000000+04:00", "GreenwichOrtalamaZamani": 3.0, "Aksam": "17:05", "Gunes": "05:22", "GunesBatis": "16:58", "GunesDogus": "05:29", "Ikindi": "14:30", "Imsak": "03:58", "KibleSaati": "11:51", "Ogle": "11:18", "Yatsi": "18:24"}, {"HicriTarihKisa": "17.9.1447", "HicriTarihKisaIso8601": null, "HicriTarihUzun": "17 Ramazan 1447", "HicriTarihUzunIso8601": null, "AyinSekliURL": "https://namazvakti.diyanet.gov.tr/images/d4.gif", "MiladiTarihKisa": "07.03.2026", "MiladiTarihKisaIso8601": "07.03.2026", "MiladiTarihUzun": "07 Mart 2026 Cumartesi", "MiladiTarihUzunIso8601": "2026-03-07T00:00:00.0000000+04:00", "GreenwichOrtalamaZamani": 3.0, "Aksam": "17:06", "Gunes": "05:20", "GunesBatis": "16:59", "GunesDogus": "05:27", "Ikindi": "14:31", "Imsak": "03:56", "KibleSaati": "11:51", "Ogle": "11:18", "Yatsi": "18:25"}]