[
  {
    "HicriTarihKisa": "21.8.1447",
    "HicriTarihKisaIso8601": null,
    "HicriTarihUzun": "21 Şaban 1447",
    "HicriTarihUzunIso8601": null,
    "AyinSekliURL": "https://namazvakti.diyanet.gov.tr/images/sondordun.gif",
    "MiladiTarihKisa": "09.02.2026",
    "MiladiTarihKisaIso8601": "09.02.2026",
    "MiladiTarihUzun": "09 Şubat 2026 Pazartesi",
    "MiladiTarihUzunIso8601": "2026-02-09T00:00:00.0000000+01:00",
    "GreenwichOrtalamaZamani": 3.0,
    "Aksam": "18:08",
    "Gunes": "08:04",
    "GunesBatis": "18:01",
    "GunesDogus": "08:11",
    "Ikindi": "15:39",
    "Imsak": "06:24",
    "KibleSaati": "08:48",
    "Ogle": "13:11",
    "Yatsi": "19:36"
  },
  {
    "HicriTarihKisa": "22.8.1447",
    "HicriTarihKisaIso8601": null,
    "HicriTarihUzun": "22 Şaban 1447",
    "HicriTarihUzunIso8601": null,
    "AyinSekliURL": "https://namazvakti.diyanet.gov.tr/images/sd1.gif",
    "MiladiTarihKisa": "10.02.2026",
    "MiladiTarihKisaIso8601": "10.02.2026",
    "MiladiTarihUzun": "10 Şubat 2026 Salı",
    "MiladiTarihUzunIso8601": "2026-02-10T00:00:00.0000000+01:00",
    "GreenwichOrtalamaZamani": 3.0,
    "Aksam": "18:10",
    "Gunes": "08:02",
    "GunesBatis": "18:03",
    "GunesDogus": "08:09",
    "Ikindi": "15:40",
    "Imsak": "06:22",
    "KibleSaati": "08:49",
    "Ogle": "13:11",
    "Yatsi": "19:38"
  },
  {
    "HicriTarihKisa": "23.8.1447",
    "HicriTarihKisaIso8601": null,
    "HicriTarihUzun": "23 Şaban 1447",
    "HicriTarihUzunIso8601": null,
    "AyinSekliURL": "https://namazvakti.diyanet.gov.tr/images/sd2.gif",
    "MiladiTarihKisa": "11.02.2026",
    "MiladiTarihKisaIso8601": "11.02.2026",
    "MiladiTarihUzun": "11 Şubat 2026 Çarşamba",
    "MiladiTarihUzunIso8601": "2026-02-11T00:00:00.0000000+01:00",
    "GreenwichOrtalamaZamani": 3.0,
    "Aksam": "18:12",
    "Gunes": "08:01",
    "GunesBatis": "18:05",
    "GunesDogus": "08:08",
    "Ikindi": "15:41",
    "Imsak": "06:21",
    "KibleSaati": "08:50",
    "Ogle": "13:11",
    "Yatsi": "19:39"
  },
  {
    "HicriTarihKisa": "24.8.1447",
    "HicriTarihKisaIso8601": null,
    "HicriTarihUzun": "24 Şaban 1447",
    "HicriTarihUzunIso8601": null,
    "AyinSekliURL": "https://namazvakti.diyanet.gov.tr/images/sd3.gif",
    "MiladiTarihKisa": "12.02.2026",
    "MiladiTarihKisaIso8601": "12.02.2026",
    "MiladiTarihUzun": "12 Şubat 2026 Perşembe",
    "MiladiTarihUzunIso8601": "2026-02-12T00:00:00.0000000+01:00",
    "GreenwichOrtalamaZamani": 3.0,
    "Aksam": "18:13",
    "Gunes": "07:59",
    "GunesBatis": "18:06",
    "GunesDogus": "08:06",
    "Ikindi": "15:43",
    "Imsak": "06:19",
    "KibleSaati": "08:51",
    "Ogle": "13:11",
    "Yatsi": "19:41"
  },
  {
    "HicriTarihKisa": "25.8.1447",
    "HicriTarihKisaIso8601": null,
    "HicriTarihUzun": "25 Şaban 1447",
    "HicriTarihUzunIso8601": null,
    "AyinSekliURL": "https://namazvakti.diyanet.gov.tr/images/sd4.gif",
    "MiladiTarihKisa": "13.02.2026",
    "MiladiTarihKisaIso8601": "13.02.2026",
    "MiladiTarihUzun": "13 Şubat 2026 Cuma",
    "MiladiTarihUzunIso8601": "2026-02-13T00:00:00.0000000+01:00",
    "GreenwichOrtalamaZamani": 3.0,
    "Aksam": "18:15",
    "Gunes": "07:57",
    "GunesBatis": "18:08",
    "GunesDogus": "08:04",
    "Ikindi": "15:44",
    "Imsak": "06:18",
    "KibleSaati": "08:52",
    "Ogle": "13:11",
    "Yatsi": "19:42"
  },
  {
    "HicriTarihKisa": "26.8.1447",
    "HicriTarihKisaIso8601": null,
    "HicriTarihUzun": "26 Şaban 1447",
    "HicriTarihUzunIso8601": null,
    "AyinSekliURL": "https://namazvakti.diyanet.gov.tr/images/sd5.gif",
    "MiladiTarihKisa": "14.02.2026",
    "MiladiTarihKisaIso8601": "14.02.2026",
    "MiladiTarihUzun": "14 Şubat 2026 Cumartesi",
    "MiladiTarihUzunIso8601": "2026-02-14T00:00:00.0000000+01:00",
    "GreenwichOrtalamaZamani": 3.0,
    "Aksam": "18:17",
    "Gunes": "07:56",
    "GunesBatis": "18:10",
    "GunesDogus": "08:03",
    "Ikindi": "15:45",
    "Imsak": "06:16",
    "KibleSaati": "08:53",
    "Ogle": "13:11",
    "Yatsi": "19:44"
  },
  {
    "HicriTarihKisa": "27.8.1447",
    "HicriTarihKisaIso8601": null,
    "HicriTarihUzun": "27 Şaban 1447",
    "HicriTarihUzunIso8601": null,
    "AyinSekliURL": "https://namazvakti.diyanet.gov.tr/images/sd6.gif",
    "MiladiTarihKisa": "15.02.2026",
    "MiladiTarihKisaIso8601": "15.02.2026",
    "MiladiTarihUzun": "15 Şubat 2026 Pazar",
    "MiladiTarihUzunIso8601": "2026-02-15T00:00:00.0000000+01:00",
    "GreenwichOrtalamaZamani": 3.0,
    "Aksam": "18:18",
    "Gunes": "07:54",
    "GunesBatis": "18:11",
    "GunesDogus": "08:01",
    "Ikindi": "15:47",
    "Imsak": "06:15",
    "KibleSaati": "08:54",
    "Ogle": "13:11",
    "Yatsi": "19:45"
  },
  {
    "HicriTarihKisa": "28.8.1447",
    "HicriTarihKisaIso8601": null,
    "HicriTarihUzun": "28 Şaban 1447",
    "HicriTarihUzunIso8601": null,
    "AyinSekliURL": "https://namazvakti.diyanet.gov.tr/images/sd7.gif",
    "MiladiTarihKisa": "16.02.2026",
    "MiladiTarihKisaIso8601": "16.02.2026",
    "MiladiTarihUzun": "16 Şubat 2026 Pazartesi",
    "MiladiTarihUzunIso8601": "2026-02-16T00:00:00.0000000+01:00",
    "GreenwichOrtalamaZamani": 3.0,
    "Aksam": "18:20",
    "Gunes": "07:52",
    "GunesBatis": "18:13",
    "GunesDogus": "07:59",
    "Ikindi": "15:48",
    "Imsak": "06:13",
    "KibleSaati": "08:55",
    "Ogle": "13:11",
    "Yatsi": "19:47"
  },
  {
    "HicriTarihKisa": "29.8.1447",
    "HicriTarihKisaIso8601": null,
    "HicriTarihUzun": "29 Şaban 1447",
    "HicriTarihUzunIso8601": null,
    "AyinSekliURL": "https://namazvakti.diyanet.gov.tr/images/ictima.gif",
    "MiladiTarihKisa": "17.02.2026",
    "MiladiTarihKisaIso8601": "17.02.2026",
    "MiladiTarihUzun": "17 Şubat 2026 Salı",
    "MiladiTarihUzunIso8601": "2026-02-17T00:00:00.0000000+01:00",
    "GreenwichOrtalamaZamani": 3.0,
    "Aksam": "18:21",
    "Gunes": "07:50",
    "GunesBatis": "18:14",
    "GunesDogus": "07:57",
    "Ikindi": "15:49",
    "Imsak": "06:11",
    "KibleSaati": "08:56",
    "Ogle": "13:11",
    "Yatsi": "19:48"
  },
  {
    "HicriTarihKisa": "30.8.1447",
    "HicriTarihKisaIso8601": null,
    "HicriTarihUzun": "30 Şaban 1447",
    "HicriTarihUzunIso8601": null,
    "AyinSekliURL": "https://namazvakti.diyanet.gov.tr/images/ruyet.gif",
    "MiladiTarihKisa": "18.02.2026",
    "MiladiTarihKisaIso8601": "18.02.2026",
    "MiladiTarihUzun": "18 Şubat 2026 Çarşamba",
    "MiladiTarihUzunIso8601": "2026-02-18T00:00:00.0000000+01:00",
    "GreenwichOrtalamaZamani": 3.0,
    "Aksam": "18:23",
    "Gunes": "07:49",
    "GunesBatis": "18:16",
    "GunesDogus": "07:56",
    "Ikindi": "15:50",
    "Imsak": "06:10",
    "KibleSaati": "08:57",
    "Ogle": "13:11",
    "Yatsi": "19:50"
  },
  {
    "HicriTarihKisa": "1.9.1447",
    "HicriTarihKisaIso8601": null,
    "HicriTarihUzun": "1 Ramazan 1447",
    "HicriTarihUzunIso8601": null,
    "AyinSekliURL": "https://namazvakti.diyanet.gov.tr/images/r1.gif",
    "MiladiTarihKisa": "19.02.2026",
    "MiladiTarihKisaIso8601": "19.02.2026",
    "MiladiTarihUzun": "19 Şubat 2026 Perşembe",
    "MiladiTarihUzunIso8601": "2026-02-19T00:00:00.0000000+01:00",
    "GreenwichOrtalamaZamani": 3.0,
    "Aksam": "18:25",
    "Gunes": "07:47",
    "GunesBatis": "18:18",
    "GunesDogus": "07:54",
    "Ikindi": "15:52",
    "Imsak": "06:08",
    "KibleSaati": "08:58",
    "Ogle": "13:11",
    "Yatsi": "19:51"
  },
  {
    "HicriTarihKisa": "2.9.1447",
    "HicriTarihKisaIso8601": null,
    "HicriTarihUzun": "2 Ramazan 1447",
    "HicriTarihUzunIso8601": null,
    "AyinSekliURL": "https://namazvakti.diyanet.gov.tr/images/r2.gif",
    "MiladiTarihKisa": "20.02.2026",
    "MiladiTarihKisaIso8601": "20.02.2026",
    "MiladiTarihUzun": "20 Şubat 2026 Cuma",
    "MiladiTarihUzunIso8601": "2026-02-20T00:00:00.0000000+01:00",
    "GreenwichOrtalamaZamani": 3.0,
    "Aksam": "18:26",
    "Gunes": "07:45",
    "GunesBatis": "18:19",
    "GunesDogus": "07:52",
    "Ikindi": "15:53",
    "Imsak": "06:06",
    "KibleSaati": "08:59",
    "Ogle": "13:11",
    "Yatsi": "19:53"
  },
  {
    "HicriTarihKisa": "3.9.1447",
    "HicriTarihKisaIso8601": null,
    "HicriTarihUzun": "3 Ramazan 1447",
    "HicriTarihUzunIso8601": null,
    "AyinSekliURL": "https://namazvakti.diyanet.gov.tr/images/r3.gif",
    "MiladiTarihKisa": "21.02.2026",
    "MiladiTarihKisaIso8601": "21.02.2026",
    "MiladiTarihUzun": "21 Şubat 2026 Cumartesi",
    "MiladiTarihUzunIso8601": "2026-02-21T00:00:00.0000000+01:00",
    "GreenwichOrtalamaZamani": 3.0,
    "Aksam": "18:28",
    "Gunes": "07:43",
    "GunesBatis": "18:21",
    "GunesDogus": "07:50",
    "Ikindi": "15:54",
    "Imsak": "06:04",
    "KibleSaati": "09:00",
    "Ogle": "13:11",
    "Yatsi": "19:54"
  },
  {
    "HicriTarihKisa": "4.9.1447",
    "HicriTarihKisaIso8601": null,
    "HicriTarihUzun": "4 Ramazan 1447",
    "HicriTarihUzunIso8601": null,
    "AyinSekliURL": "https://namazvakti.diyanet.gov.tr/images/r4.gif",
    "MiladiTarihKisa": "22.02.2026",
    "MiladiTarihKisaIso8601": "22.02.2026",
    "MiladiTarihUzun": "22 Şubat 2026 Pazar",
    "MiladiTarihUzunIso8601": "2026-02-22T00:00:00.0000000+01:00",
    "GreenwichOrtalamaZamani": 3.0,
    "Aksam": "18:30",
    "Gunes": "07:41",
    "GunesBatis": "18:23",
    "GunesDogus": "07:48",
    "Ikindi": "15:55",
    "Imsak": "06:03",
    "KibleSaati": "09:01",
    "Ogle": "13:10",
    "Yatsi": "19:56"
  },
  {
    "HicriTarihKisa": "5.9.1447",
    "HicriTarihKisaIso8601": null,
    "HicriTarihUzun": "5 Ramazan 1447",
    "HicriTarihUzunIso8601": null,
    "AyinSekliURL": "https://namazvakti.diyanet.gov.tr/images/r5.gif",
    "MiladiTarihKisa": "23.02.2026",
    "MiladiTarihKisaIso8601": "23.02.2026",
    "MiladiTarihUzun": "23 Şubat 2026 Pazartesi",
    "MiladiTarihUzunIso8601": "2026-02-23T00:00:00.0000000+01:00",
    "GreenwichOrtalamaZamani": 3.0,
    "Aksam": "18:31",
    "Gunes": "07:39",
    "GunesBatis": "18:24",
    "GunesDogus": "07:46",
    "Ikindi": "15:57",
    "Imsak": "06:01",
    "KibleSaati": "09:02",
    "Ogle": "13:10",
    "Yatsi": "19:57"
  },
  {
    "HicriTarihKisa": "6.9.1447",
    "HicriTarihKisaIso8601": null,
    "HicriTarihUzun": "6 Ramazan 1447",
    "HicriTarihUzunIso8601": null,
    "AyinSekliURL": "https://namazvakti.diyanet.gov.tr/images/ilkdordun.gif",
    "MiladiTarihKisa": "24.02.2026",
    "MiladiTarihKisaIso8601": "24.02.2026",
    "MiladiTarihUzun": "24 Şubat 2026 Salı",
    "MiladiTarihUzunIso8601": "2026-02-24T00:00:00.0000000+01:00",
    "GreenwichOrtalamaZamani": 3.0,
    "Aksam": "18:33",
    "Gunes": "07:37",
    "GunesBatis": "18:26",
    "GunesDogus": "07:44",
    "Ikindi": "15:58",
    "Imsak": "05:59",
    "KibleSaati": "09:03",
    "Ogle": "13:10",
    "Yatsi": "19:59"
  },
  {
    "HicriTarihKisa": "7.9.1447",
    "HicriTarihKisaIso8601": null,
    "HicriTarihUzun": "7 Ramazan 1447",
    "HicriTarihUzunIso8601": null,
    "AyinSekliURL": "https://namazvakti.diyanet.gov.tr/images/i1.gif",
    "MiladiTarihKisa": "25.02.2026",
    "MiladiTarihKisaIso8601": "25.02.2026",
    "MiladiTarihUzun": "25 Şubat 2026 Çarşamba",
    "MiladiTarihUzunIso8601": "2026-02-25T00:00:00.0000000+01:00",
    "GreenwichOrtalamaZamani": 3.0,
    "Aksam": "18:35",
    "Gunes": "07:35",
    "GunesBatis": "18:28",
    "GunesDogus": "07:42",
    "Ikindi": "15:59",
    "Imsak": "05:57",
    "KibleSaati": "09:04",
    "Ogle": "13:10",
    "Yatsi": "20:00"
  },
  {
    "HicriTarihKisa": "8.9.1447",
    "HicriTarihKisaIso8601": null,
    "HicriTarihUzun": "8 Ramazan 1447",
    "HicriTarihUzunIso8601": null,
    "AyinSekliURL": "https://namazvakti.diyanet.gov.tr/images/i2.gif",
    "MiladiTarihKisa": "26.02.2026",
    "MiladiTarihKisaIso8601": "26.02.2026",
    "MiladiTarihUzun": "26 Şubat 2026 Perşembe",
    "MiladiTarihUzunIso8601": "2026-02-26T00:00:00.0000000+01:00",
    "GreenwichOrtalamaZamani": 3.0,
    "Aksam": "18:36",
    "Gunes": "07:34",
    "GunesBatis": "18:29",
    "GunesDogus": "07:41",
    "Ikindi": "16:00",
    "Imsak": "05:55",
    "KibleSaati": "09:05",
    "Ogle": "13:10",
    "Yatsi": "20:02"
  },
  {
    "HicriTarihKisa": "9.9.1447",
    "HicriTarihKisaIso8601": null,
    "HicriTarihUzun": "9 Ramazan 1447",
    "HicriTarihUzunIso8601": null,
    "AyinSekliURL": "https://namazvakti.diyanet.gov.tr/images/i3.gif",
    "MiladiTarihKisa": "27.02.2026",
    "MiladiTarihKisaIso8601": "27.02.2026",
    "MiladiTarihUzun": "27 Şubat 2026 Cuma",
    "MiladiTarihUzunIso8601": "2026-02-27T00:00:00.0000000+01:00",
    "GreenwichOrtalamaZamani": 3.0,
    "Aksam": "18:38",
    "Gunes": "07:32",
    "GunesBatis": "18:31",
    "GunesDogus": "07:39",
    "Ikindi": "16:01",
    "Imsak": "05:53",
    "KibleSaati": "09:06",
    "Ogle": "13:10",
    "Yatsi": "20:04"
  },
  {
    "HicriTarihKisa": "10.9.1447",
    "HicriTarihKisaIso8601": null,
    "HicriTarihUzun": "10 Ramazan 1447",
    "HicriTarihUzunIso8601": null,
    "AyinSekliURL": "https://namazvakti.diyanet.gov.tr/images/i4.gif",
    "MiladiTarihKisa": "28.02.2026",
    "MiladiTarihKisaIso8601": "28.02.2026",
    "MiladiTarihUzun": "28 Şubat 2026 Cumartesi",
    "MiladiTarihUzunIso8601": "2026-02-28T00:00:00.0000000+01:00",
    "GreenwichOrtalamaZamani": 3.0,
    "Aksam": "18:39",
    "Gunes": "07:30",
    "GunesBatis": "18:32",
    "GunesDogus": "07:37",
    "Ikindi": "16:02",
    "Imsak": "05:52",
    "KibleSaati": "09:06",
    "Ogle": "13:09",
    "Yatsi": "20:05"
  },
  {
    "HicriTarihKisa": "11.9.1447",
    "HicriTarihKisaIso8601": null,
    "HicriTarihUzun": "11 Ramazan 1447",
    "HicriTarihUzunIso8601": null,
    "AyinSekliURL": "https://namazvakti.diyanet.gov.tr/images/i5.gif",
    "MiladiTarihKisa": "01.03.2026",
    "MiladiTarihKisaIso8601": "01.03.2026",
    "MiladiTarihUzun": "01 Mart 2026 Pazar",
    "MiladiTarihUzunIso8601": "2026-03-01T00:00:00.0000000+01:00",
    "GreenwichOrtalamaZamani": 3.0,
    "Aksam": "18:41",
    "Gunes": "07:28",
    "GunesBatis": "18:34",
    "GunesDogus": "07:35",
    "Ikindi": "16:04",
    "Imsak": "05:50",
    "KibleSaati": "09:07",
    "Ogle": "13:09",
    "Yatsi": "20:07"
  },
  {
    "HicriTarihKisa": "12.9.1447",
    "HicriTarihKisaIso8601": null,
    "HicriTarihUzun": "12 Ramazan 1447",
    "HicriTarihUzunIso8601": null,
    "AyinSekliURL": "https://namazvakti.diyanet.gov.tr/images/i6.gif",
    "MiladiTarihKisa": "02.03.2026",
    "MiladiTarihKisaIso8601": "02.03.2026",
    "MiladiTarihUzun": "02 Mart 2026 Pazartesi",
    "MiladiTarihUzunIso8601": "2026-03-02T00:00:00.0000000+01:00",
    "GreenwichOrtalamaZamani": 3.0,
    "Aksam": "18:43",
    "Gunes": "07:26",
    "GunesBatis": "18:36",
    "GunesDogus": "07:33",
    "Ikindi": "16:05",
    "Imsak": "05:48",
    "KibleSaati": "09:08",
    "Ogle": "13:09",
    "Yatsi": "20:08"
  },
  {
    "HicriTarihKisa": "13.9.1447",
    "HicriTarihKisaIso8601": null,
    "HicriTarihUzun": "13 Ramazan 1447",
    "HicriTarihUzunIso8601": null,
    "AyinSekliURL": "https://namazvakti.diyanet.gov.tr/images/dolunay.gif",
    "MiladiTarihKisa": "03.03.2026",
    "MiladiTarihKisaIso8601": "03.03.2026",
    "MiladiTarihUzun": "03 Mart 2026 Salı",
    "MiladiTarihUzunIso8601": "2026-03-03T00:00:00.0000000+01:00",
    "GreenwichOrtalamaZamani": 3.0,
    "Aksam": "18:44",
    "Gunes": "07:24",
    "GunesBatis": "18:37",
    "GunesDogus": "07:31",
    "Ikindi": "16:06",
    "Imsak": "05:46",
    "KibleSaati": "09:09",
    "Ogle": "13:09",
    "Yatsi": "20:10"
  },
  {
    "HicriTarihKisa": "14.9.1447",
    "HicriTarihKisaIso8601": null,
    "HicriTarihUzun": "14 Ramazan 1447",
    "HicriTarihUzunIso8601": null,
    "AyinSekliURL": "https://namazvakti.diyanet.gov.tr/images/d1.gif",
    "MiladiTarihKisa": "04.03.2026",
    "MiladiTarihKisaIso8601": "04.03.2026",
    "MiladiTarihUzun": "04 Mart 2026 Çarşamba",
    "MiladiTarihUzunIso8601": "2026-03-04T00:00:00.0000000+01:00",
    "GreenwichOrtalamaZamani": 3.0,
    "Aksam": "18:46",
    "Gunes": "07:22",
    "GunesBatis": "18:39",
    "GunesDogus": "07:29",
    "Ikindi": "16:07",
    "Imsak": "05:44",
    "KibleSaati": "09:10",
    "Ogle": "13:09",
    "Yatsi": "20:11"
  },
  {
    "HicriTarihKisa": "15.9.1447",
    "HicriTarihKisaIso8601": null,
    "HicriTarihUzun": "15 Ramazan 1447",
    "HicriTarihUzunIso8601": null,
    "AyinSekliURL": "https://namazvakti.diyanet.gov.tr/images/d2.gif",
    "MiladiTarihKisa": "05.03.2026",
    "MiladiTarihKisaIso8601": "05.03.2026",
    "MiladiTarihUzun": "05 Mart 2026 Perşembe",
    "MiladiTarihUzunIso8601": "2026-03-05T00:00:00.0000000+01:00",
    "GreenwichOrtalamaZamani": 3.0,
    "Aksam": "18:47",
    "Gunes": "07:20",
    "GunesBatis": "18:40",
    "GunesDogus": "07:27",
    "Ikindi": "16:08",
    "Imsak": "05:42",
    "KibleSaati": "09:11",
    "Ogle": "13:08",
    "Yatsi": "20:13"
  },
  {
    "HicriTarihKisa": "16.9.1447",
    "HicriTarihKisaIso8601": null,
    "HicriTarihUzun": "16 Ramazan 1447",
    "HicriTarihUzunIso8601": null,
    "AyinSekliURL": "https://namazvakti.diyanet.gov.tr/images/d3.gif",
    "MiladiTarihKisa": "06.03.2026",
    "MiladiTarihKisaIso8601": "06.03.2026",
    "MiladiTarihUzun": "06 Mart 2026 Cuma",
    "MiladiTarihUzunIso8601": "2026-03-06T00:00:00.0000000+01:00",
    "GreenwichOrtalamaZamani": 3.0,
    "Aksam": "18:49",
    "Gunes": "07:18",
    "GunesBatis": "18:42",
    "GunesDogus": "07:25",
    "Ikindi": "16:09",
    "Imsak": "05:39",
    "KibleSaati": "09:12",
    "Ogle": "13:08",
    "Yatsi": "20:15"
  },
  {
    "HicriTarihKisa": "17.9.1447",
    "HicriTarihKisaIso8601": null,
    "HicriTarihUzun": "17 Ramazan 1447",
    "HicriTarihUzunIso8601": null,
    "AyinSekliURL": "https://namazvakti.diyanet.gov.tr/images/d4.gif",
    "MiladiTarihKisa": "07.03.2026",
    "MiladiTarihKisaIso8601": "07.03.2026",
    "MiladiTarihUzun": "07 Mart 2026 Cumartesi",
    "MiladiTarihUzunIso8601": "2026-03-07T00:00:00.0000000+01:00",
    "GreenwichOrtalamaZamani": 3.0,
    "Aksam": "18:50",
    "Gunes": "07:16",
    "GunesBatis": "18:43",
    "GunesDogus": "07:23",
    "Ikindi": "16:10",
    "Imsak": "05:37",
    "KibleSaati": "09:13",
    "Ogle": "13:08",
    "Yatsi": "20:16"
  },
  {
    "HicriTarihKisa": "18.9.1447",
    "HicriTarihKisaIso8601": null,
    "HicriTarihUzun": "18 Ramazan 1447",
    "HicriTarihUzunIso8601": null,
    "AyinSekliURL": "https://namazvakti.diyanet.gov.tr/images/d5.gif",
    "MiladiTarihKisa": "08.03.2026",
    "MiladiTarihKisaIso8601": "08.03.2026",
    "MiladiTarihUzun": "08 Mart 2026 Pazar",
    "MiladiTarihUzunIso8601": "2026-03-08T00:00:00.0000000+01:00",
    "GreenwichOrtalamaZamani": 3.0,
    "Aksam": "18:52",
    "Gunes": "07:14",
    "GunesBatis": "18:45",
    "GunesDogus": "07:21",
    "Ikindi": "16:11",
    "Imsak": "05:35",
    "KibleSaati": "09:14",
    "Ogle": "13:08",
    "Yatsi": "20:18"
  },
  {
    "HicriTarihKisa": "19.9.1447",
    "HicriTarihKisaIso8601": null,
    "HicriTarihUzun": "19 Ramazan 1447",
    "HicriTarihUzunIso8601": null,
    "AyinSekliURL": "https://namazvakti.diyanet.gov.tr/images/d6.gif",
    "MiladiTarihKisa": "09.03.2026",
    "MiladiTarihKisaIso8601": "09.03.2026",
    "MiladiTarihUzun": "09 Mart 2026 Pazartesi",
    "MiladiTarihUzunIso8601": "2026-03-09T00:00:00.0000000+01:00",
    "GreenwichOrtalamaZamani": 3.0,
    "Aksam": "18:54",
    "Gunes": "07:11",
    "GunesBatis": "18:47",
    "GunesDogus": "07:18",
    "Ikindi": "16:12",
    "Imsak": "05:33",
    "KibleSaati": "09:14",
    "Ogle": "13:08",
    "Yatsi": "20:19"
  },
  {
    "HicriTarihKisa": "20.9.1447",
    "HicriTarihKisaIso8601": null,
    "HicriTarihUzun": "20 Ramazan 1447",
    "HicriTarihUzunIso8601": null,
    "AyinSekliURL": "https://namazvakti.diyanet.gov.tr/images/d7.gif",
    "MiladiTarihKisa": "10.03.2026",
    "MiladiTarihKisaIso8601": "10.03.2026",
    "MiladiTarihUzun": "10 Mart 2026 Salı",
    "MiladiTarihUzunIso8601": "2026-03-10T00:00:00.0000000+01:00",
    "GreenwichOrtalamaZamani": 3.0,
    "Aksam": "18:55",
    "Gunes": "07:09",
    "GunesBatis": "18:48",
    "GunesDogus": "07:16",
    "Ikindi": "16:13",
    "Imsak": "05:31",
    "KibleSaati": "09:15",
    "Ogle": "13:07",
    "Yatsi": "20:21"
  },
  {
    "HicriTarihKisa": "21.9.1447",
    "HicriTarihKisaIso8601": null,
    "HicriTarihUzun": "21 Ramazan 1447",
    "HicriTarihUzunIso8601": null,
    "AyinSekliURL": "https://namazvakti.diyanet.gov.tr/images/sondordun.gif",
    "MiladiTarihKisa": "11.03.2026",
    "MiladiTarihKisaIso8601": "11.03.2026",
    "MiladiTarihUzun": "11 Mart 2026 Çarşamba",
    "MiladiTarihUzunIso8601": "2026-03-11T00:00:00.0000000+01:00",
    "GreenwichOrtalamaZamani": 3.0,
    "Aksam": "18:57",
    "Gunes": "07:07",
    "GunesBatis": "18:50",
    "GunesDogus": "07:14",
    "Ikindi": "16:14",
    "Imsak": "05:29",
    "KibleSaati": "09:16",
    "Ogle": "13:07",
    "Yatsi": "20:23"
  },
  {
    "HicriTarihKisa": "22.9.1447",
    "HicriTarihKisaIso8601": null,
    "HicriTarihUzun": "22 Ramazan 1447",
    "HicriTarihUzunIso8601": null,
    "AyinSekliURL": "https://namazvakti.diyanet.gov.tr/images/sd1.gif",
    "MiladiTarihKisa": "12.03.2026",
    "MiladiTarihKisaIso8601": "12.03.2026",
    "MiladiTarihUzun": "12 Mart 2026 Perşembe",
    "MiladiTarihUzunIso8601": "2026-03-12T00:00:00.0000000+01:00",
    "GreenwichOrtalamaZamani": 3.0,
    "Aksam": "18:58",
    "Gunes": "07:05",
    "GunesBatis": "18:51",
    "GunesDogus": "07:12",
    "Ikindi": "16:15",
    "Imsak": "05:27",
    "KibleSaati": "09:17",
    "Ogle": "13:07",
    "Yatsi": "20:24"
  }
]