[{"HicriTarihKisa": "15.8.1447", "HicriTarihKisaIso8601": null, "HicriTarihUzun": "15 Şaban 1447", "HicriTarihUzunIso8601": null, "AyinSekliURL": "https://namazvakti.diyanet.gov.tr/images/d1.gif", "MiladiTarihKisa": "03.02.2026", "MiladiTarihKisaIso8601": "03.02.2026", "MiladiTarihUzun": "03 Şubat 2026 Salı", "MiladiTarihUzunIso8601": "2026-02-03T00:00:00.0000000+00:00", "GreenwichOrtalamaZamani": 3.0, "Aksam": "16:59", "Gunes": "07:29", "GunesBatis": "16:52", "GunesDogus": "07:36", "Ikindi": "14:31", "Imsak": "05:41", "KibleSaati": "07:51", "Ogle": "12:19", "Yatsi": "18:34"}, {"HicriTarihKisa": "16.8.1447", "HicriTarihKisaIso8601": null, "HicriTarihUzun": "16 Şaban 1447", "HicriTarihUzunIso8601": null, "AyinSekliURL": "https://namazvakti.diyanet.gov.tr/images/d2.gif", "MiladiTarihKisa": "04.02.2026", "MiladiTarihKisaIso8601": "04.02.2026", "MiladiTarihUzun": "04 Şubat 2026 Çarşamba", "MiladiTarihUzunIso8601": "2026-02-04T00:00:00.0000000+00:00", "GreenwichOrtalamaZamani": 3.0, "Aksam": "17:01", "Gunes": "07:28", "GunesBatis": "16:54", "GunesDogus": "07:35", "Ikindi": "14:32", "Imsak": "05:40", "KibleSaati": "07:52", "Ogle": "12:19", "Yatsi": "18:36"}, {"HicriTarihKisa": "17.8.1447", "HicriTarihKisaIso8601": null, "HicriTarihUzun": "17 Şaban 1447", "HicriTarihUzunIso8601": null, "AyinSekliURL": "https://namazvakti.diyanet.gov.tr/images/d3.gif", "MiladiTarihKisa": "05.02.2026", "MiladiTarihKisaIso8601": "05.02.2026", "MiladiTarihUzun": "05 Şubat 2026 Perşembe", "MiladiTarihUzunIso8601": "2026-02-05T00:00:00.0000000+00:00", "GreenwichOrtalamaZamani": 3.0, "Aksam": "17:03", "Gunes": "07:26", "GunesBatis": "16:56", "GunesDogus": "07:33", "Ikindi": "14:34", "Imsak": "05:38", "KibleSaati": "07:53", "Ogle": "12:19", "Yatsi": "18:37"}, {"HicriTarihKisa": "18.8.1447", "HicriTarihKisaIso8601": null, "HicriTarihUzun": "18 Şaban 1447", "HicriTarihUzunIso8601": null, "AyinSekliURL": "https://namazvakti.diyanet.gov.tr/images/d4.gif", "MiladiTarihKisa": "06.02.2026", "MiladiTarihKisaIso8601": "06.02.2026", "MiladiTarihUzun": "06 Şubat 2026 Cuma", "MiladiTarihUzunIso8601": "2026-02-06T00:00:00.0000000+00:00", "GreenwichOrtalamaZamani": 3.0, "Aksam": "17:05", "Gunes": "07:24", "GunesBatis": "16:58", "GunesDogus": "07:31", "Ikindi": "14:35", "Imsak": "05:37", "KibleSaati": "07:54", "Ogle": "12:19", "Yatsi": "18:39"}, {"HicriTarihKisa": "19.8.1447", "HicriTarihKisaIso8601": null, "HicriTarihUzun": "19 Şaban 1447", "HicriTarihUzunIso8601": null, "AyinSekliURL": "https://namazvakti.diyanet.gov.tr/images/d5.gif", "MiladiTarihKisa": "07.02.2026", "MiladiTarihKisaIso8601": "07.02.2026", "MiladiTarihUzun": "07 Şubat 2026 Cumartesi", "MiladiTarihUzunIso8601": "2026-02-07T00:00:00.0000000+00:00", "GreenwichOrtalamaZamani": 3.0, "Aksam": "17:06", "Gunes": "07:23", "GunesBatis": "16:59", "GunesDogus": "07:30", "Ikindi": "14:37", "Imsak": "05:36", "KibleSaati": "07:55", "Ogle": "12:19", "Yatsi": "18:41"}, {"HicriTarihKisa": "20.8.1447", "HicriTarihKisaIso8601": null, "HicriTarihUzun": "20 Şaban 1447", "HicriTarihUzunIso8601": null, "AyinSekliURL": "https://namazvakti.diyanet.gov.tr/images/d6.gif", "MiladiTarihKisa": "08.02.2026", "MiladiTarihKisaIso8601": "08.02.2026", "MiladiTarihUzun": "08 Şubat 2026 Pazar", "MiladiTarihUzunIso8601": "2026-02-08T00:00:00.0000000+00:00", "GreenwichOrtalamaZamani": 3.0, "Aksam": "17:08", "Gunes": "07:21", "GunesBatis": "17:01", "GunesDogus": "07:28", "Ikindi": "14:38", "Imsak": "05:34", "KibleSaati": "07:56", "Ogle": "12:20", "Yatsi": "18:42"}, {"HicriTarihKisa": "21.8.1447", "HicriTarihKisaIso8601": null, "HicriTarihUzun": "21 Şaban 1447", "HicriTarihUzunIso8601": null, "AyinSekliURL": "https://namazvakti.diyanet.gov.tr/images/sondordun.gif", "MiladiTarihKisa": "09.02.2026", "MiladiTarihKisaIso8601": "09.02.2026", "MiladiTarihUzun": "09 Şubat 2026 Pazartesi", "MiladiTarihUzunIso8601": "2026-02-09T00:00:00.0000000+00:00", "GreenwichOrtalamaZamani": 3.0, "Aksam": "17:10", "Gunes": "07:19", "GunesBatis": "17:03", "GunesDogus": "07:26", "Ikindi": "14:40", "Imsak": "05:33", "KibleSaati": "07:57", "Ogle": "12:20", "Yatsi": "18:44"}, {"HicriTarihKisa": "22.8.1447", "HicriTarihKisaIso8601": null, "HicriTarihUzun": "22 Şaban 1447", "HicriTarihUzunIso8601": null, "AyinSekliURL": "https://namazvakti.diyanet.gov.tr/images/sd1.gif", "MiladiTarihKisa": "10.02.2026", "MiladiTarihKisaIso8601": "10.02.2026", "MiladiTarihUzun": "10 Şubat 2026 Salı", "MiladiTarihUzunIso8601": "2026-02-10T00:00:00.0000000+00:00", "GreenwichOrtalamaZamani": 3.0, "Aksam": "17:12", "Gunes": "07:17", "GunesBatis": "17:05", "GunesDogus": "07:24", "Ikindi": "14:41", "Imsak": "05:31", "KibleSaati": "07:58", "Ogle": "12:20", "Yatsi": "18:45"}, {"HicriTarihKisa": "23.8.1447", "HicriTarihKisaIso8601": null, "HicriTarihUzun": "23 Şaban 1447", "HicriTarihUzunIso8601": null, "AyinSekliURL": "https://namazvakti.diyanet.gov.tr/images/sd2.gif", "MiladiTarihKisa": "11.02.2026", "MiladiTarihKisaIso8601": "11.02.2026", "MiladiTarihUzun": "11 Şubat 2026 Çarşamba", "MiladiTarihUzunIso8601": "2026-02-11T00:00:00.0000000+00:00", "GreenwichOrtalamaZamani": 3.0, "Aksam": "17:14", "Gunes": "07:15", "GunesBatis": "17:07", "GunesDogus": "07:22", "Ikindi": "14:43", "Imsak": "05:29", "KibleSaati": "07:58", "Ogle": "12:20", "Yatsi": "18:47"}, {"HicriTarihKisa": "24.8.1447", "HicriTarihKisaIso8601": null, "HicriTarihUzun": "24 Şaban 1447", "HicriTarihUzunIso8601": null, "AyinSekliURL": "https://namazvakti.diyanet.gov.tr/images/sd3.gif", "MiladiTarihKisa": "12.02.2026", "MiladiTarihKisaIso8601": "12.02.2026", "MiladiTarihUzun": "12 Şubat 2026 Perşembe", "MiladiTarihUzunIso8601": "2026-02-12T00:00:00.0000000+00:00", "GreenwichOrtalamaZamani": 3.0, "Aksam": "17:16", "Gunes": "07:14", "GunesBatis": "17:09", "GunesDogus": "07:21", "Ikindi": "14:44", "Imsak": "05:28", "KibleSaati": "07:59", "Ogle": "12:20", "Yatsi": "18:49"}, {"HicriTarihKisa": "25.8.1447", "HicriTarihKisaIso8601": null, "HicriTarihUzun": "25 Şaban 1447", "HicriTarihUzunIso8601": null, "AyinSekliURL": "https://namazvakti.diyanet.gov.tr/images/sd4.gif", "MiladiTarihKisa": "13.02.2026", "MiladiTarihKisaIso8601": "13.02.2026", "MiladiTarihUzun": "13 Şubat 2026 Cuma", "MiladiTarihUzunIso8601": "2026-02-13T00:00:00.0000000+00:00", "GreenwichOrtalamaZamani": 3.0, "Aksam": "17:17", "Gunes": "07:12", "GunesBatis": "17:10", "GunesDogus": "07:19", "Ikindi": "14:45", "Imsak": "05:26", "KibleSaati": "08:00", "Ogle": "12:20", "Yatsi": "18:50"}, {"HicriTarihKisa": "26.8.1447", "HicriTarihKisaIso8601": null, "HicriTarihUzun": "26 Şaban 1447", "HicriTarihUzunIso8601": null, "AyinSekliURL": "https://namazvakti.diyanet.gov.tr/images/sd5.gif", "MiladiTarihKisa": "14.02.2026", "MiladiTarihKisaIso8601": "14.02.2026", "MiladiTarihUzun": "14 Şubat 2026 Cumartesi", "MiladiTarihUzunIso8601": "2026-02-14T00:00:00.0000000+00:00", "GreenwichOrtalamaZamani": 3.0, "Aksam": "17:19", "Gunes": "07:10", "GunesBatis": "17:12", "GunesDogus": "07:17", "Ikindi": "14:47", "Imsak": "05:24", "KibleSaati": "08:01", "Ogle": "12:20", "Yatsi": "18:52"}, {"HicriTarihKisa": "27.8.1447", "HicriTarihKisaIso8601": null, "HicriTarihUzun": "27 Şaban 1447", "HicriTarihUzunIso8601": null, "AyinSekliURL": "https://namazvakti.diyanet.gov.tr/images/sd6.gif", "MiladiTarihKisa": "15.02.2026", "MiladiTarihKisaIso8601": "15.02.2026", "MiladiTarihUzun": "15 Şubat 2026 Pazar", "MiladiTarihUzunIso8601": "2026-02-15T00:00:00.0000000+00:00", "GreenwichOrtalamaZamani": 3.0, "Aksam": "17:21", "Gunes": "07:08", "GunesBatis": "17:14", "GunesDogus": "07:15", "Ikindi": "14:48", "Imsak": "05:23", "KibleSaati": "08:02", "Ogle": "12:20", "Yatsi": "18:54"}, {"HicriTarihKisa": "28.8.1447", "HicriTarihKisaIso8601": null, "HicriTarihUzun": "28 Şaban 1447", "HicriTarihUzunIso8601": null, "AyinSekliURL": "https://namazvakti.diyanet.gov.tr/images/sd7.gif", "MiladiTarihKisa": "16.02.2026", "MiladiTarihKisaIso8601": "16.02.2026", "MiladiTarihUzun": "16 Şubat 2026 Pazartesi", "MiladiTarihUzunIso8601": "2026-02-16T00:00:00.0000000+00:00", "GreenwichOrtalamaZamani": 3.0, "Aksam": "17:23", "Gunes": "07:06", "GunesBatis": "17:16", "GunesDogus": "07:13", "Ikindi": "14:50", "Imsak": "05:21", "KibleSaati": "08:03", "Ogle": "12:19", "Yatsi": "18:55"}, {"HicriTarihKisa": "29.8.1447", "HicriTarihKisaIso8601": null, "HicriTarihUzun": "29 Şaban 1447", "HicriTarihUzunIso8601": null, "AyinSekliURL": "https://namazvakti.diyanet.gov.tr/images/ictima.gif", "MiladiTarihKisa": "17.02.2026", "MiladiTarihKisaIso8601": "17.02.2026", "MiladiTarihUzun": "17 Şubat 2026 Salı", "MiladiTarihUzunIso8601": "2026-02-17T00:00:00.0000000+00:00", "GreenwichOrtalamaZamani": 3.0, "Aksam": "17:25", "Gunes": "07:04", "GunesBatis": "17:18", "GunesDogus": "07:11", "Ikindi": "14:51", "Imsak": "05:19", "KibleSaati": "08:04", "Ogle": "12:19", "Yatsi": "18:57"}, {"HicriTarihKisa": "30.8.1447", "HicriTarihKisaIso8601": null, "HicriTarihUzun": "30 Şaban 1447", "HicriTarihUzunIso8601": null, "AyinSekliURL": "https://namazvakti.diyanet.gov.tr/images/ruyet.gif", "MiladiTarihKisa": "18.02.2026", "MiladiTarihKisaIso8601": "18.02.2026", "MiladiTarihUzun": "18 Şubat 2026 Çarşamba", "MiladiTarihUzunIso8601": "2026-02-18T00:00:00.0000000+00:00", "GreenwichOrtalamaZamani": 3.0, "Aksam": "17:27", "Gunes": "07:02", "GunesBatis": "17:20", "GunesDogus": "07:09", "Ikindi": "14:52", "Imsak": "05:17", "KibleSaati": "08:05", "Ogle": "12:19", "Yatsi": "18:59"}, {"HicriTarihKisa": "1.9.1447", "HicriTarihKisaIso8601": null, "HicriTarihUzun": "1 Ramazan 1447", "HicriTarihUzunIso8601": null, "AyinSekliURL": "https://namazvakti.diyanet.gov.tr/images/r1.gif", "MiladiTarihKisa": "19.02.2026", "MiladiTarihKisaIso8601": "19.02.2026", "MiladiTarihUzun": "19 Şubat 2026 Perşembe", "MiladiTarihUzunIso8601": "2026-02-19T00:00:00.0000000+00:00", "GreenwichOrtalamaZamani": 3.0, "Aksam": "17:28", "Gunes": "07:00", "GunesBatis": "17:21", "GunesDogus": "07:07", "Ikindi": "14:54", "Imsak": "05:15", "KibleSaati": "08:06", "Ogle": "12:19", "Yatsi": "19:00"}, {"HicriTarihKisa": "2.9.1447", "HicriTarihKisaIso8601": null, "HicriTarihUzun": "2 Ramazan 1447", "HicriTarihUzunIso8601": null, "AyinSekliURL": "https://namazvakti.diyanet.gov.tr/images/r2.gif", "MiladiTarihKisa": "20.02.2026", "MiladiTarihKisaIso8601": "20.02.2026", "MiladiTarihUzun": "20 Şubat 2026 Cuma", "MiladiTarihUzunIso8601": "2026-02-20T00:00:00.0000000+00:00", "GreenwichOrtalamaZamani": 3.0, "Aksam": "17:30", "Gunes": "06:58", "GunesBatis": "17:23", "GunesDogus": "07:05", "Ikindi": "14:55", "Imsak": "05:14", "KibleSaati": "08:07", "Ogle": "12:19", "Yatsi": "19:02"}, {"HicriTarihKisa": "3.9.1447", "HicriTarihKisaIso8601": null, "HicriTarihUzun": "3 Ramazan 1447", "HicriTarihUzunIso8601": null, "AyinSekliURL": "https://namazvakti.diyanet.gov.tr/images/r3.gif", "MiladiTarihKisa": "21.02.2026", "MiladiTarihKisaIso8601": "21.02.2026", "MiladiTarihUzun": "21 Şubat 2026 Cumartesi", "MiladiTarihUzunIso8601": "2026-02-21T00:00:00.0000000+00:00", "GreenwichOrtalamaZamani": 3.0, "Aksam": "17:32", "Gunes": "06:56", "GunesBatis": "17:25", "GunesDogus": "07:03", "Ikindi": "14:57", "Imsak": "05:12", "KibleSaati": "08:07", "Ogle": "12:19", "Yatsi": "19:04"}, {"HicriTarihKisa": "4.9.1447", "HicriTarihKisaIso8601": null, "HicriTarihUzun": "4 Ramazan 1447", "HicriTarihUzunIso8601": null, "AyinSekliURL": "https://namazvakti.diyanet.gov.tr/images/r4.gif", "MiladiTarihKisa": "22.02.2026", "MiladiTarihKisaIso8601": "22.02.2026", "MiladiTarihUzun": "22 Şubat 2026 Pazar", "MiladiTarihUzunIso8601": "2026-02-22T00:00:00.0000000+00:00", "GreenwichOrtalamaZamani": 3.0, "Aksam": "17:34", "Gunes": "06:54", "GunesBatis": "17:27", "GunesDogus": "07:01", "Ikindi": "14:58", "Imsak": "05:10", "KibleSaati": "08:08", "Ogle": "12:19", "Yatsi": "19:05"}, {"HicriTarihKisa": "5.9.1447", "HicriTarihKisaIso8601": null, "HicriTarihUzun": "5 Ramazan 1447", "HicriTarihUzunIso8601": null, "AyinSekliURL": "https://namazvakti.diyanet.gov.tr/images/r5.gif", "MiladiTarihKisa": "23.02.2026", "MiladiTarihKisaIso8601": "23.02.2026", "MiladiTarihUzun": "23 Şubat 2026 Pazartesi", "MiladiTarihUzunIso8601": "2026-02-23T00:00:00.0000000+00:00", "GreenwichOrtalamaZamani": 3.0, "Aksam": "17:36", "Gunes": "06:52", "GunesBatis": "17:29", "GunesDogus": "06:59", "Ikindi": "14:59", "Imsak": "05:08", "KibleSaati": "08:09", "Ogle": "12:19", "Yatsi": "19:07"}, {"HicriTarihKisa": "6.9.1447", "HicriTarihKisaIso8601": null, "HicriTarihUzun": "6 Ramazan 1447", "HicriTarihUzunIso8601": null, "AyinSekliURL": "https://namazvakti.diyanet.gov.tr/images/ilkdordun.gif", "MiladiTarihKisa": "24.02.2026", "MiladiTarihKisaIso8601": "24.02.2026", "MiladiTarihUzun": "24 Şubat 2026 Salı", "MiladiTarihUzunIso8601": "2026-02-24T00:00:00.0000000+00:00", "GreenwichOrtalamaZamani": 3.0, "Aksam": "17:37", "Gunes": "06:50", "GunesBatis": "17:30", "GunesDogus": "06:57", "Ikindi": "15:01", "Imsak": "05:06", "KibleSaati": "08:10", "Ogle": "12:19", "Yatsi": "19:09"}, {"HicriTarihKisa": "7.9.1447", "HicriTarihKisaIso8601": null, "HicriTarihUzun": "7 Ramazan 1447", "HicriTarihUzunIso8601": null, "AyinSekliURL": "https://namazvakti.diyanet.gov.tr/images/i1.gif", "MiladiTarihKisa": "25.02.2026", "MiladiTarihKisaIso8601": "25.02.2026", "MiladiTarihUzun": "25 Şubat 2026 Çarşamba", "MiladiTarihUzunIso8601": "2026-02-25T00:00:00.0000000+00:00", "GreenwichOrtalamaZamani": 3.0, "Aksam": "17:39", "Gunes": "06:48", "GunesBatis": "17:32", "GunesDogus": "06:55", "Ikindi": "15:02", "Imsak": "05:04", "KibleSaati": "08:11", "Ogle": "12:19", "Yatsi": "19:10"}, {"HicriTarihKisa": "8.9.1447", "HicriTarihKisaIso8601": null, "HicriTarihUzun": "8 Ramazan 1447", "HicriTarihUzunIso8601": null, "AyinSekliURL": "https://namazvakti.diyanet.gov.tr/images/i2.gif", "MiladiTarihKisa": "26.02.2026", "MiladiTarihKisaIso8601": "26.02.2026", "MiladiTarihUzun": "26 Şubat 2026 Perşembe", "MiladiTarihUzunIso8601": "2026-02-26T00:00:00.0000000+00:00", "GreenwichOrtalamaZamani": 3.0, "Aksam": "17:41", "Gunes": "06:46", "GunesBatis": "17:34", "GunesDogus": "06:53", "Ikindi": "15:03", "Imsak": "05:02", "KibleSaati": "08:12", "Ogle": "12:18", "Yatsi": "19:12"}, {"HicriTarihKisa": "9.9.1447", "HicriTarihKisaIso8601": null, "HicriTarihUzun": "9 Ramazan 1447", "HicriTarihUzunIso8601": null, "AyinSekliURL": "https://namazvakti.diyanet.gov.tr/images/i3.gif", "MiladiTarihKisa": "27.02.2026", "MiladiTarihKisaIso8601": "27.02.2026", "MiladiTarihUzun": "27 Şubat 2026 Cuma", "MiladiTarihUzunIso8601": "2026-02-27T00:00:00.0000000+00:00", "GreenwichOrtalamaZamani": 3.0, "Aksam": "17:43", "Gunes": "06:44", "GunesBatis": "17:36", "GunesDogus": "06:51", "Ikindi": "15:04", "Imsak": "05:00", "KibleSaati": "08:12", "Ogle": "12:18", "Yatsi": "19:14"}, {"HicriTarihKisa": "10.9.1447", "HicriTarihKisaIso8601": null, "HicriTarihUzun": "10 Ramazan 1447", "HicriTarihUzunIso8601": null, "AyinSekliURL": "https://namazvakti.diyanet.gov.tr/images/i4.gif", "MiladiTarihKisa": "28.02.2026", "MiladiTarihKisaIso8601": "28.02.2026", "MiladiTarihUzun": "28 Şubat 2026 Cumartesi", "MiladiTarihUzunIso8601": "2026-02-28T00:00:00.0000000+00:00", "GreenwichOrtalamaZamani": 3.0, "Aksam": "17:45", "Gunes": "06:41", "GunesBatis": "17:38", "GunesDogus": "06:48", "Ikindi": "15:06", "Imsak": "04:57", "KibleSaati": "08:13", "Ogle": "12:18", "Yatsi": "19:16"}, {"HicriTarihKisa": "11.9.1447", "HicriTarihKisaIso8601": null, "HicriTarihUzun": "11 Ramazan 1447", "HicriTarihUzunIso8601": null, "AyinSekliURL": "https://namazvakti.diyanet.gov.tr/images/i5.gif", "MiladiTarihKisa": "01.03.2026", "MiladiTarihKisaIso8601": "01.03.2026", "MiladiTarihUzun": "01 Mart 2026 Pazar", "MiladiTarihUzunIso8601": "2026-03-01T00:00:00.0000000+00:00", "GreenwichOrtalamaZamani": 3.0, "Aksam": "17:46", "Gunes": "06:39", "GunesBatis": "17:39", "GunesDogus": "06:46", "Ikindi": "15:07", "Imsak": "04:55", "KibleSaati": "08:14", "Ogle": "12:18", "Yatsi": "19:17"}, {"HicriTarihKisa": "12.9.1447", "HicriTarihKisaIso8601": null, "HicriTarihUzun": "12 Ramazan 1447", "HicriTarihUzunIso8601": null, "AyinSekliURL": "https://namazvakti.diyanet.gov.tr/images/i6.gif", "MiladiTarihKisa": "02.03.2026", "MiladiTarihKisaIso8601": "02.03.2026", "MiladiTarihUzun": "02 Mart 2026 Pazartesi", "MiladiTarihUzunIso8601": "2026-03-02T00:00:00.0000000+00:00", "GreenwichOrtalamaZamani": 3.0, "Aksam": "17:48", "Gunes": "06:37", "GunesBatis": "17:41", "GunesDogus": "06:44", "Ikindi": "15:08", "Imsak": "04:53", "KibleSaati": "08:15", "Ogle": "12:18", "Yatsi": "19:19"}, {"HicriTarihKisa": "13.9.1447", "HicriTarihKisaIso8601": null, "HicriTarihUzun": "13 Ramazan 1447", "HicriTarihUzunIso8601": null, "AyinSekliURL": "https://namazvakti.diyanet.gov.tr/images/dolunay.gif", "MiladiTarihKisa": "03.03.2026", "MiladiTarihKisaIso8601": "03.03.2026", "MiladiTarihUzun": "03 Mart 2026 Salı", "MiladiTarihUzunIso8601": "2026-03-03T00:00:00.0000000+00:00", "GreenwichOrtalamaZamani": 3.0, "Aksam": "17:50", "Gunes": "06:35", "GunesBatis": "17:43", "GunesDogus": "06:42", "Ikindi": "15:09", "Imsak": "04:51", "KibleSaati": "08:16", "Ogle": "12:17", "Yatsi": "19:21"}, {"HicriTarihKisa": "14.9.1447", "HicriTarihKisaIso8601": null, "HicriTarihUzun": "14 Ramazan 1447", "HicriTarihUzunIso8601": null, "AyinSekliURL": "https://namazvakti.diyanet.gov.tr/images/d1.gif", "MiladiTarihKisa": "04.03.2026", "MiladiTarihKisaIso8601": "04.03.2026", "MiladiTarihUzun": "04 Mart 2026 Çarşamba", "MiladiTarihUzunIso8601": "2026-03-04T00:00:00.0000000+00:00", "GreenwichOrtalamaZamani": 3.0, "Aksam": "17:52", "Gunes": "06:33", "GunesBatis": "17:45", "GunesDogus": "06:40", "Ikindi": "15:11", "Imsak": "04:49", "KibleSaati": "08:17", "Ogle": "12:17", "Yatsi": "19:23"}, {"HicriTarihKisa": "15.9.1447", "HicriTarihKisaIso8601": null, "HicriTarihUzun": "15 Ramazan 1447", "HicriTarihUzunIso8601": null, "AyinSekliURL": "https://namazvakti.diyanet.gov.tr/images/d2.gif", "MiladiTarihKisa": "05.03.2026", "MiladiTarihKisaIso8601": "05.03.2026", "MiladiTarihUzun": "05 Mart 2026 Perşembe", "MiladiTarihUzunIso8601": "2026-03-05T00:00:00.0000000+00:00", "GreenwichOrtalamaZamani": 3.0, "Aksam": "17:53", "Gunes": "06:31", "GunesBatis": "17:46", "GunesDogus": "06:38", "Ikindi": "15:12", "Imsak": "04:47", "KibleSaati": "08:17", "Ogle": "12:17", "Yatsi": "19:24"}, {"HicriTarihKisa": "16.9.1447", "HicriTarihKisaIso8601": null, "HicriTarihUzun": "16 Ramazan 1447", "HicriTarihUzunIso8601": null, "AyinSekliURL": "https://namazvakti.diyanet.gov.tr/images/d3.gif", "MiladiTarihKisa": "06.03.2026", "MiladiTarihKisaIso8601": "06.03.2026", "MiladiTarihUzun": "06 Mart 2026 Cuma", "MiladiTarihUzunIso8601": "2026-03-06T00:00:00.0000000+00:00", "GreenwichOrtalamaZamani": 3.0, "Aksam": "17:55", "Gunes": "06:28", "GunesBatis": "17:48", "GunesDogus": "06:35", "Ikindi": "15:13", "Imsak": "04:44", "KibleSaati": "08:18", "Ogle": "12:17", "Yatsi": "19:26"}]