[{"HicriTarihKisa": "20.8.1447", "HicriTarihKisaIso8601": null, "HicriTarihUzun": "20 Şaban 1447", "HicriTarihUzunIso8601": null, "AyinSekliURL": "https://namazvakti.diyanet.gov.tr/images/d6.gif", "MiladiTarihKisa": "08.02.2026", "MiladiTarihKisaIso8601": "08.02.2026", "MiladiTarihUzun": "08 Şubat 2026 Pazar", "MiladiTarihUzunIso8601": "2026-02-08T00:00:00.0000000+01:00", "GreenwichOrtalamaZamani": 3.0, "Aksam": "15:31", "Gunes": "08:12", "GunesBatis": "15:24", "GunesDogus": "08:19", "Ikindi": "13:03", "Imsak": "05:09", "KibleSaati": "10:10", "Ogle": "11:56", "Yatsi": "18:14"}, {"HicriTarihKisa": "21.8.1447", "HicriTarihKisaIso8601": null, "HicriTarihUzun": "21 Şaban 1447", "HicriTarihUzunIso8601": null, "AyinSekliURL": "https://namazvakti.diyanet.gov.tr/images/sondordun.gif", "MiladiTarihKisa": "09.02.2026", "MiladiTarihKisaIso8601": "09.02.2026", "MiladiTarihUzun": "09 Şubat 2026 Pazartesi", "MiladiTarihUzunIso8601": "2026-02-09T00:00:00.0000000+01:00", "GreenwichOrtalamaZamani": 3.0, "Aksam": "15:35", "Gunes": "08:08", "GunesBatis": "15:28", "GunesDogus": "08:15", "Ikindi": "13:05", "Imsak": "05:06", "KibleSaati": "10:10", "Ogle": "11:57", "Yatsi": "18:17"}, {"HicriTarihKisa": "22.8.1447", "HicriTarihKisaIso8601": null, "HicriTarihUzun": "22 Şaban 1447", "HicriTarihUzunIso8601": null, "AyinSekliURL": "https://namazvakti.diyanet.gov.tr/images/sd1.gif", "MiladiTarihKisa": "10.02.2026", "MiladiTarihKisaIso8601": "10.02.2026", "MiladiTarihUzun": "10 Şubat 2026 Salı", "MiladiTarihUzunIso8601": "2026-02-10T00:00:00.0000000+01:00", "GreenwichOrtalamaZamani": 3.0, "Aksam": "15:39", "Gunes": "08:04", "GunesBatis": "15:32", "GunesDogus": "08:11", "Ikindi": "13:08", "Imsak": "05:03", "KibleSaati": "10:11", "Ogle": "11:57", "Yatsi": "18:20"}, {"HicriTarihKisa": "23.8.1447", "HicriTarihKisaIso8601": null, "HicriTarihUzun": "23 Şaban 1447", "HicriTarihUzunIso8601": null, "AyinSekliURL": "https://namazvakti.diyanet.gov.tr/images/sd2.gif", "MiladiTarihKisa": "11.02.2026", "MiladiTarihKisaIso8601": "11.02.2026", "MiladiTarihUzun": "11 Şubat 2026 Çarşamba", "MiladiTarihUzunIso8601": "2026-02-11T00:00:00.0000000+01:00", "GreenwichOrtalamaZamani": 3.0, "Aksam": "15:43", "Gunes": "08:00", "GunesBatis": "15:36", "GunesDogus": "08:07", "Ikindi": "13:11", "Imsak": "05:00", "KibleSaati": "10:11", "Ogle": "11:57", "Yatsi": "18:23"}, {"HicriTarihKisa": "24.8.1447", "HicriTarihKisaIso8601": null, "HicriTarihUzun": "24 Şaban 1447", "HicriTarihUzunIso8601": null, "AyinSekliURL": "https://namazvakti.diyanet.gov.tr/images/sd3.gif", "MiladiTarihKisa": "12.02.2026", "MiladiTarihKisaIso8601": "12.02.2026", "MiladiTarihUzun": "12 Şubat 2026 Perşembe", "MiladiTarihUzunIso8601": "2026-02-12T00:00:00.0000000+01:00", "GreenwichOrtalamaZamani": 3.0, "Aksam": "15:47", "Gunes": "07:56", "GunesBatis": "15:40", "GunesDogus": "08:03", "Ikindi": "13:13", "Imsak": "04:56", "KibleSaati": "10:11", "Ogle": "11:57", "Yatsi": "18:26"}, {"HicriTarihKisa": "25.8.1447", "HicriTarihKisaIso8601": null, "HicriTarihUzun": "25 Şaban 1447", "HicriTarihUzunIso8601": null, "AyinSekliURL": "https://namazvakti.diyanet.gov.tr/images/sd4.gif", "MiladiTarihKisa": "13.02.2026", "MiladiTarihKisaIso8601": "13.02.2026", "MiladiTarihUzun": "13 Şubat 2026 Cuma", "MiladiTarihUzunIso8601": "2026-02-13T00:00:00.0000000+01:00", "GreenwichOrtalamaZamani": 3.0, "Aksam": "15:51", "Gunes": "07:52", "GunesBatis": "15:44", "GunesDogus": "07:59", "Ikindi": "13:16", "Imsak": "04:53", "KibleSaati": "10:11", "Ogle": "11:57", "Yatsi": "18:29"}, {"HicriTarihKisa": "26.8.1447", "HicriTarihKisaIso8601": null, "HicriTarihUzun": "26 Şaban 1447", "HicriTarihUzunIso8601": null, "AyinSekliURL": "https://namazvakti.diyanet.gov.tr/images/sd5.gif", "MiladiTarihKisa": "14.02.2026", "MiladiTarihKisaIso8601": "14.02.2026", "MiladiTarihUzun": "14 Şubat 2026 Cumartesi", "MiladiTarihUzunIso8601": "2026-02-14T00:00:00.0000000+01:00", "GreenwichOrtalamaZamani": 3.0, "Aksam": "15:55", "Gunes": "07:48", "GunesBatis": "15:48", "GunesDogus": "07:55", "Ikindi": "13:18", "Imsak": "04:50", "KibleSaati": "10:11", "Ogle": "11:57", "Yatsi": "18:32"}, {"HicriTarihKisa": "27.8.1447", "HicriTarihKisaIso8601": null, "HicriTarihUzun": "27 Şaban 1447", "HicriTarihUzunIso8601": null, "AyinSekliURL": "https://namazvakti.diyanet.gov.tr/images/sd6.gif", "MiladiTarihKisa": "15.02.2026", "MiladiTarihKisaIso8601": "15.02.2026", "MiladiTarihUzun": "15 Şubat 2026 Pazar", "MiladiTarihUzunIso8601": "2026-02-15T00:00:00.0000000+01:00", "GreenwichOrtalamaZamani": 3.0, "Aksam": "15:59", "Gunes": "07:44", "GunesBatis": "15:52", "GunesDogus": "07:51", "Ikindi": "13:21", "Imsak": "04:47", "KibleSaati": "10:12", "Ogle": "11:56", "Yatsi": "18:35"}, {"HicriTarihKisa": "28.8.1447", "HicriTarihKisaIso8601": null, "HicriTarihUzun": "28 Şaban 1447", "HicriTarihUzunIso8601": null, "AyinSekliURL": "https://namazvakti.diyanet.gov.tr/images/sd7.gif", "MiladiTarihKisa": "16.02.2026", "MiladiTarihKisaIso8601": "16.02.2026", "MiladiTarihUzun": "16 Şubat 2026 Pazartesi", "MiladiTarihUzunIso8601": "2026-02-16T00:00:00.0000000+01:00", "GreenwichOrtalamaZamani": 3.0, "Aksam": "16:03", "Gunes": "07:40", "GunesBatis": "15:56", "GunesDogus": "07:47", "Ikindi": "13:23", "Imsak": "04:43", "KibleSaati": "10:12", "Ogle": "11:56", "Yatsi": "18:39"}, {"HicriTarihKisa": "29.8.1447", "HicriTarihKisaIso8601": null, "HicriTarihUzun": "29 Şaban 1447", "HicriTarihUzunIso8601": null, "AyinSekliURL": "https://namazvakti.diyanet.gov.tr/images/ictima.gif", "MiladiTarihKisa": "17.02.2026", "MiladiTarihKisaIso8601": "17.02.2026", "MiladiTarihUzun": "17 Şubat 2026 Salı", "MiladiTarihUzunIso8601": "2026-02-17T00:00:00.0000000+01:00", "GreenwichOrtalamaZamani": 3.0, "Aksam": "16:07", "Gunes": "07:36", "GunesBatis": "16:00", "GunesDogus": "07:43", "Ikindi": "13:26", "Imsak": "04:40", "KibleSaati": "10:12", "Ogle": "11:56", "Yatsi": "18:42"}, {"HicriTarihKisa": "30.8.1447", "HicriTarihKisaIso8601": null, "HicriTarihUzun": "30 Şaban 1447", "HicriTarihUzunIso8601": null, "AyinSekliURL": "https://namazvakti.diyanet.gov.tr/images/ruyet.gif", "MiladiTarihKisa": "18.02.2026", "MiladiTarihKisaIso8601": "18.02.2026", "MiladiTarihUzun": "18 Şubat 2026 Çarşamba", "MiladiTarihUzunIso8601": "2026-02-18T00:00:00.0000000+01:00", "GreenwichOrtalamaZamani": 3.0, "Aksam": "16:11", "Gunes": "07:32", "GunesBatis": "16:04", "GunesDogus": "07:39", "Ikindi": "13:28", "Imsak": "04:36", "KibleSaati": "10:12", "Ogle": "11:56", "Yatsi": "18:45"}, {"HicriTarihKisa": "1.9.1447", "HicriTarihKisaIso8601": null, "HicriTarihUzun": "1 Ramazan 1447", "HicriTarihUzunIso8601": null, "AyinSekliURL": "https://namazvakti.diyanet.gov.tr/images/r1.gif", "MiladiTarihKisa": "19.02.2026", "MiladiTarihKisaIso8601": "19.02.2026", "MiladiTarihUzun": "19 Şubat 2026 Perşembe", "MiladiTarihUzunIso8601": "2026-02-19T00:00:00.0000000+01:00", "GreenwichOrtalamaZamani": 3.0, "Aksam": "16:14", "Gunes": "07:28", "GunesBatis": "16:07", "GunesDogus": "07:35", "Ikindi": "13:31", "Imsak": "04:33", "KibleSaati": "10:12", "Ogle": "11:56", "Yatsi": "18:49"}, {"HicriTarihKisa": "2.9.1447", "HicriTarihKisaIso8601": null, "HicriTarihUzun": "2 Ramazan 1447", "HicriTarihUzunIso8601": null, "AyinSekliURL": "https://namazvakti.diyanet.gov.tr/images/r2.gif", "MiladiTarihKisa": "20.02.2026", "MiladiTarihKisaIso8601": "20.02.2026", "MiladiTarihUzun": "20 Şubat 2026 Cuma", "MiladiTarihUzunIso8601": "2026-02-20T00:00:00.0000000+01:00", "GreenwichOrtalamaZamani": 3.0, "Aksam": "16:18", "Gunes": "07:24", "GunesBatis": "16:11", "GunesDogus": "07:31", "Ikindi": "13:33", "Imsak": "04:29", "KibleSaati": "10:12", "Ogle": "11:56", "Yatsi": "18:52"}, {"HicriTarihKisa": "3.9.1447", "HicriTarihKisaIso8601": null, "HicriTarihUzun": "3 Ramazan 1447", "HicriTarihUzunIso8601": null, "AyinSekliURL": "https://namazvakti.diyanet.gov.tr/images/r3.gif", "MiladiTarihKisa": "21.02.2026", "MiladiTarihKisaIso8601": "21.02.2026", "MiladiTarihUzun": "21 Şubat 2026 Cumartesi", "MiladiTarihUzunIso8601": "2026-02-21T00:00:00.0000000+01:00", "GreenwichOrtalamaZamani": 3.0, "Aksam": "16:22", "Gunes": "07:20", "GunesBatis": "16:15", "GunesDogus": "07:27", "Ikindi": "13:36", "Imsak": "04:26", "KibleSaati": "10:13", "Ogle": "11:56", "Yatsi": "18:55"}, {"HicriTarihKisa": "4.9.1447", "HicriTarihKisaIso8601": null, "HicriTarihUzun": "4 Ramazan 1447", "HicriTarihUzunIso8601": null, "AyinSekliURL": "https://namazvakti.diyanet.gov.tr/images/r4.gif", "MiladiTarihKisa": "22.02.2026", "MiladiTarihKisaIso8601": "22.02.2026", "MiladiTarihUzun": "22 Şubat 2026 Pazar", "MiladiTarihUzunIso8601": "2026-02-22T00:00:00.0000000+01:00", "GreenwichOrtalamaZamani": 3.0, "Aksam": "16:26", "Gunes": "07:16", "GunesBatis": "16:19", "GunesDogus": "07:23", "Ikindi": "13:38", "Imsak": "04:22", "KibleSaati": "10:13", "Ogle": "11:56", "Yatsi": "18:59"}, {"HicriTarihKisa": "5.9.1447", "HicriTarihKisaIso8601": null, "HicriTarihUzun": "5 Ramazan 1447", "HicriTarihUzunIso8601": null, "AyinSekliURL": "https://namazvakti.diyanet.gov.tr/images/r5.gif", "MiladiTarihKisa": "23.02.2026", "MiladiTarihKisaIso8601": "23.02.2026", "MiladiTarihUzun": "23 Şubat 2026 Pazartesi", "MiladiTarihUzunIso8601": "2026-02-23T00:00:00.0000000+01:00", "GreenwichOrtalamaZamani": 3.0, "Aksam": "16:29", "Gunes": "07:12", "GunesBatis": "16:22", "GunesDogus": "07:19", "Ikindi": "13:41", "Imsak": "04:18", "KibleSaati": "10:13", "Ogle": "11:56", "Yatsi": "19:02"}, {"HicriTarihKisa": "6.9.1447", "HicriTarihKisaIso8601": null, "HicriTarihUzun": "6 Ramazan 1447", "HicriTarihUzunIso8601": null, "AyinSekliURL": "https://namazvakti.diyanet.gov.tr/images/ilkdordun.gif", "MiladiTarihKisa": "24.02.2026", "MiladiTarihKisaIso8601": "24.02.2026", "MiladiTarihUzun": "24 Şubat 2026 Salı", "MiladiTarihUzunIso8601": "2026-02-24T00:00:00.0000000+01:00", "GreenwichOrtalamaZamani": 3.0, "Aksam": "16:33", "Gunes": "07:08", "GunesBatis": "16:26", "GunesDogus": "07:15", "Ikindi": "13:43", "Imsak": "04:14", "KibleSaati": "10:13", "Ogle": "11:56", "Yatsi": "19:06"}, {"HicriTarihKisa": "7.9.1447", "HicriTarihKisaIso8601": null, "HicriTarihUzun": "7 Ramazan 1447", "HicriTarihUzunIso8601": null, "AyinSekliURL": "https://namazvakti.diyanet.gov.tr/images/i1.gif", "MiladiTarihKisa": "25.02.2026", "MiladiTarihKisaIso8601": "25.02.2026", "MiladiTarihUzun": "25 Şubat 2026 Çarşamba", "MiladiTarihUzunIso8601": "2026-02-25T00:00:00.0000000+01:00", "GreenwichOrtalamaZamani": 3.0, "Aksam": "16:37", "Gunes": "07:04", "GunesBatis": "16:30", "GunesDogus": "07:11", "Ikindi": "13:46", "Imsak": "04:10", "KibleSaati": "10:13", "Ogle": "11:55", "Yatsi": "19:09"}, {"HicriTarihKisa": "8.9.1447", "HicriTarihKisaIso8601": null, "HicriTarihUzun": "8 Ramazan 1447", "HicriTarihUzunIso8601": null, "AyinSekliURL": "https://namazvakti.diyanet.gov.tr/images/i2.gif", "MiladiTarihKisa": "26.02.2026", "MiladiTarihKisaIso8601": "26.02.2026", "MiladiTarihUzun": "26 Şubat 2026 Perşembe", "MiladiTarihUzunIso8601": "2026-02-26T00:00:00.0000000+01:00", "GreenwichOrtalamaZamani": 3.0, "Aksam": "16:40", "Gunes": "07:00", "GunesBatis": "16:33", "GunesDogus": "07:07", "Ikindi": "13:48", "Imsak": "04:06", "KibleSaati": "10:13", "Ogle": "11:55", "Yatsi": "19:13"}, {"HicriTarihKisa": "9.9.1447", "HicriTarihKisaIso8601": null, "HicriTarihUzun": "9 Ramazan 1447", "HicriTarihUzunIso8601": null, "AyinSekliURL": "https://namazvakti.diyanet.gov.tr/images/i3.gif", "MiladiTarihKisa": "27.02.2026", "MiladiTarihKisaIso8601": "27.02.2026", "MiladiTarihUzun": "27 Şubat 2026 Cuma", "MiladiTarihUzunIso8601": "2026-02-27T00:00:00.0000000+01:00", "GreenwichOrtalamaZamani": 3.0, "Aksam": "16:44", "Gunes": "06:56", "GunesBatis": "16:37", "GunesDogus": "07:03", "Ikindi": "13:51", "Imsak": "04:02", "KibleSaati": "10:13", "Ogle": "11:55", "Yatsi": "19:16"}, {"HicriTarihKisa": "10.9.1447", "HicriTarihKisaIso8601": null, "HicriTarihUzun": "10 Ramazan 1447", "HicriTarihUzunIso8601": null, "AyinSekliURL": "https://namazvakti.diyanet.gov.tr/images/i4.gif", "MiladiTarihKisa": "28.02.2026", "MiladiTarihKisaIso8601": "28.02.2026", "MiladiTarihUzun": "28 Şubat 2026 Cumartesi", "MiladiTarihUzunIso8601": "2026-02-28T00:00:00.0000000+01:00", "GreenwichOrtalamaZamani": 3.0, "Aksam": "16:48", "Gunes": "06:52", "GunesBatis": "16:41", "GunesDogus": "06:59", "Ikindi": "13:53", "Imsak": "03:58", "KibleSaati": "10:13", "Ogle": "11:55", "Yatsi": "19:20"}, {"HicriTarihKisa": "11.9.1447", "HicriTarihKisaIso8601": null, "HicriTarihUzun": "11 Ramazan 1447", "HicriTarihUzunIso8601": null, "AyinSekliURL": "https://namazvakti.diyanet.gov.tr/images/i5.gif", "MiladiTarihKisa": "01.03.2026", "MiladiTarihKisaIso8601": "01.03.2026", "MiladiTarihUzun": "01 Mart 2026 Pazar", "MiladiTarihUzunIso8601": "2026-03-01T00:00:00.0000000+01:00", "GreenwichOrtalamaZamani": 3.0, "Aksam": "16:51", "Gunes": "06:48", "GunesBatis": "16:44", "GunesDogus": "06:55", "Ikindi": "13:56", "Imsak": "03:54", "KibleSaati": "10:13", "Ogle": "11:55", "Yatsi": "19:23"}, {"HicriTarihKisa": "12.9.1447", "HicriTarihKisaIso8601": null, "HicriTarihUzun": "12 Ramazan 1447", "HicriTarihUzunIso8601": null, "AyinSekliURL": "https://namazvakti.diyanet.gov.tr/images/i6.gif", "MiladiTarihKisa": "02.03.2026", "MiladiTarihKisaIso8601": "02.03.2026", "MiladiTarihUzun": "02 Mart 2026 Pazartesi", "MiladiTarihUzunIso8601": "2026-03-02T00:00:00.0000000+01:00", "GreenwichOrtalamaZamani": 3.0, "Aksam": "16:55", "Gunes": "06:44", "GunesBatis": "16:48", "GunesDogus": "06:51", "Ikindi": "13:58", "Imsak": "03:50", "KibleSaati": "10:13", "Ogle": "11:55", "Yatsi": "19:27"}, {"HicriTarihKisa": "13.9.1447", "HicriTarihKisaIso8601": null, "HicriTarihUzun": "13 Ramazan 1447", "HicriTarihUzunIso8601": null, "AyinSekliURL": "https://namazvakti.diyanet.gov.tr/images/dolunay.gif", "MiladiTarihKisa": "03.03.2026", "MiladiTarihKisaIso8601": "03.03.2026", "MiladiTarihUzun": "03 Mart 2026 Salı", "MiladiTarihUzunIso8601": "2026-03-03T00:00:00.0000000+01:00", "GreenwichOrtalamaZamani": 3.0, "Aksam": "16:59", "Gunes": "06:40", "GunesBatis": "16:52", "GunesDogus": "06:47", "Ikindi": "14:01", "Imsak": "03:46", "KibleSaati": "10:13", "Ogle": "11:54", "Yatsi": "19:31"}, {"HicriTarihKisa": "14.9.1447", "HicriTarihKisaIso8601": null, "HicriTarihUzun": "14 Ramazan 1447", "HicriTarihUzunIso8601": null, "AyinSekliURL": "https://namazvakti.diyanet.gov.tr/images/d1.gif", "MiladiTarihKisa": "04.03.2026", "MiladiTarihKisaIso8601": "04.03.2026", "MiladiTarihUzun": "04 Mart 2026 Çarşamba", "MiladiTarihUzunIso8601": "2026-03-04T00:00:00.0000000+01:00", "GreenwichOrtalamaZamani": 3.0, "Aksam": "17:02", "Gunes": "06:36", "GunesBatis": "16:55", "GunesDogus": "06:43", "Ikindi": "14:03", "Imsak": "03:41", "KibleSaati": "10:14", "Ogle": "11:54", "Yatsi": "19:34"}, {"HicriTarihKisa": "15.9.1447", "HicriTarihKisaIso8601": null, "HicriTarihUzun": "15 Ramazan 1447", "HicriTarihUzunIso8601": null, "AyinSekliURL": "https://namazvakti.diyanet.gov.tr/images/d2.gif", "MiladiTarihKisa": "05.03.2026", "MiladiTarihKisaIso8601": "05.03.2026", "MiladiTarihUzun": "05 Mart 2026 Perşembe", "MiladiTarihUzunIso8601": "2026-03-05T00:00:00.0000000+01:00", "GreenwichOrtalamaZamani": 3.0, "Aksam": "17:06", "Gunes": "06:32", "GunesBatis": "16:59", "GunesDogus": "06:39", "Ikindi": "14:05", "Imsak": "03:37", "KibleSaati": "10:14", "Ogle": "11:54", "Yatsi": "19:38"}, {"HicriTarihKisa": "16.9.1447", "HicriTarihKisaIso8601": null, "HicriTarihUzun": "16 Ramazan 1447", "HicriTarihUzunIso8601": null, "AyinSekliURL": "https://namazvakti.diyanet.gov.tr/images/d3.gif", "MiladiTarihKisa": "06.03.2026", "MiladiTarihKisaIso8601": "06.03.2026", "MiladiTarihUzun": "06 Mart 2026 Cuma", "MiladiTarihUzunIso8601": "2026-03-06T00:00:00.0000000+01:00", "GreenwichOrtalamaZamani": 3.0, "Aksam": "17:09", "Gunes": "06:28", "GunesBatis": "17:02", "GunesDogus": "06:35", "Ikindi": "14:08", "Imsak": "03:32", "KibleSaati": "10:14", "Ogle": "11:54", "Yatsi": "19:42"}, {"HicriTarihKisa": "17.9.1447", "HicriTarihKisaIso8601": null, "HicriTarihUzun": "17 Ramazan 1447", "HicriTarihUzunIso8601": null, "AyinSekliURL": "https://namazvakti.diyanet.gov.tr/images/d4.gif", "MiladiTarihKisa": "07.03.2026", "MiladiTarihKisaIso8601": "07.03.2026", "MiladiTarihUzun": "07 Mart 2026 Cumartesi", "MiladiTarihUzunIso8601": "2026-03-07T00:00:00.0000000+01:00", "GreenwichOrtalamaZamani": 3.0, "Aksam": "17:13", "Gunes": "06:24", "GunesBatis": "17:06", "GunesDogus": "06:31", "Ikindi": "14:10", "Imsak": "03:28", "KibleSaati": "10:14", "Ogle": "11:53", "Yatsi": "19:46"}, {"HicriTarihKisa": "18.9.1447", "HicriTarihKisaIso8601": null, "HicriTarihUzun": "18 Ramazan 1447", "HicriTarihUzunIso8601": null, "AyinSekliURL": "https://namazvakti.diyanet.gov.tr/images/d5.gif", "MiladiTarihKisa": "08.03.2026", "MiladiTarihKisaIso8601": "08.03.2026", "MiladiTarihUzun": "08 Mart 2026 Pazar", "MiladiTarihUzunIso8601": "2026-03-08T00:00:00.0000000+01:00", "GreenwichOrtalamaZamani": 3.0, "Aksam": "17:16", "Gunes": "06:20", "GunesBatis": "17:09", "GunesDogus": "06:27", "Ikindi": "14:12", "Imsak": "03:23", "KibleSaati": "10:14", "Ogle": "11:53", "Yatsi": "19:50"}, {"HicriTarihKisa": "19.9.1447", "HicriTarihKisaIso8601": null, "HicriTarihUzun": "19 Ramazan 1447", "HicriTarihUzunIso8601": null, "AyinSekliURL": "https://namazvakti.diyanet.gov.tr/images/d6.gif", "MiladiTarihKisa": "09.03.2026", "MiladiTarihKisaIso8601": "09.03.2026", "MiladiTarihUzun": "09 Mart 2026 Pazartesi", "MiladiTarihUzunIso8601": "2026-03-09T00:00:00.0000000+01:00", "GreenwichOrtalamaZamani": 3.0, "Aksam": "17:20", "Gunes": "06:16", "GunesBatis": "17:13", "GunesDogus": "06:23", "Ikindi": "14:15", "Imsak": "03:18", "KibleSaati": "10:14", "Ogle": "11:53", "Yatsi": "19:54"}, {"HicriTarihKisa": "20.9.1447", "HicriTarihKisaIso8601": null, "HicriTarihUzun": "20 Ramazan 1447", "HicriTarihUzunIso8601": null, "AyinSekliURL": "https://namazvakti.diyanet.gov.tr/images/d7.gif", "MiladiTarihKisa": "10.03.2026", "MiladiTarihKisaIso8601": "10.03.2026", "MiladiTarihUzun": "10 Mart 2026 Salı", "MiladiTarihUzunIso8601": "2026-03-10T00:00:00.0000000+01:00", "GreenwichOrtalamaZamani": 3.0, "Aksam": "17:23", "Gunes": "06:12", "GunesBatis": "17:16", "GunesDogus": "06:19", "Ikindi": "14:17", "Imsak": "03:13", "KibleSaati": "10:14", "Ogle": "11:53", "Yatsi": "19:58"}, {"HicriTarihKisa": "21.9.1447", "HicriTarihKisaIso8601": null, "HicriTarihUzun": "21 Ramazan 1447", "HicriTarihUzunIso8601": null, "AyinSekliURL": "https://namazvakti.diyanet.gov.tr/images/sondordun.gif", "MiladiTarihKisa": "11.03.2026", "MiladiTarihKisaIso8601": "11.03.2026", "MiladiTarihUzun": "11 Mart 2026 Çarşamba", "MiladiTarihUzunIso8601": "2026-03-11T00:00:00.0000000+01:00", "GreenwichOrtalamaZamani": 3.0, "Aksam": "17:27", "Gunes": "06:08", "GunesBatis": "17:20", "GunesDogus": "06:15", "Ikindi": "14:19", "Imsak": "03:08", "KibleSaati": "10:14", "Ogle": "11:52", "Yatsi": "20:02"}]