[{"HicriTarihKisa": "17.8.1447", "HicriTarihKisaIso8601": null, "HicriTarihUzun": "17 Şaban 1447", "HicriTarihUzunIso8601": null, "AyinSekliURL": "https://namazvakti.diyanet.gov.tr/images/d3.gif", "MiladiTarihKisa": "05.02.2026", "MiladiTarihKisaIso8601": "05.02.2026", "MiladiTarihUzun": "05 Şubat 2026 Perşembe", "MiladiTarihUzunIso8601": "2026-02-05T00:00:00.0000000+01:00", "GreenwichOrtalamaZamani": 3.0, "Aksam": "15:14", "Gunes": "08:32", "GunesBatis": "15:07", "GunesDogus": "08:39", "Ikindi": "12:52", "Imsak": "05:19", "KibleSaati": "10:10", "Ogle": "11:58", "Yatsi": "18:06"}, {"HicriTarihKisa": "18.8.1447", "HicriTarihKisaIso8601": null, "HicriTarihUzun": "18 Şaban 1447", "HicriTarihUzunIso8601": null, "AyinSekliURL": "https://namazvakti.diyanet.gov.tr/images/d4.gif", "MiladiTarihKisa": "06.02.2026", "MiladiTarihKisaIso8601": "06.02.2026", "MiladiTarihUzun": "06 Şubat 2026 Cuma", "MiladiTarihUzunIso8601": "2026-02-06T00:00:00.0000000+01:00", "GreenwichOrtalamaZamani": 3.0, "Aksam": "15:18", "Gunes": "08:28", "GunesBatis": "15:11", "GunesDogus": "08:35", "Ikindi": "12:55", "Imsak": "05:16", "KibleSaati": "10:10", "Ogle": "11:58", "Yatsi": "18:09"}, {"HicriTarihKisa": "19.8.1447", "HicriTarihKisaIso8601": null, "HicriTarihUzun": "19 Şaban 1447", "HicriTarihUzunIso8601": null, "AyinSekliURL": "https://namazvakti.diyanet.gov.tr/images/d5.gif", "MiladiTarihKisa": "07.02.2026", "MiladiTarihKisaIso8601": "07.02.2026", "MiladiTarihUzun": "07 Şubat 2026 Cumartesi", "MiladiTarihUzunIso8601": "2026-02-07T00:00:00.0000000+01:00", "GreenwichOrtalamaZamani": 3.0, "Aksam": "15:22", "Gunes": "08:24", "GunesBatis": "15:15", "GunesDogus": "08:31", "Ikindi": "12:57", "Imsak": "05:13", "KibleSaati": "10:10", "Ogle": "11:58", "Yatsi": "18:12"}, {"HicriTarihKisa": "20.8.1447", "HicriTarihKisaIso8601": null, "HicriTarihUzun": "20 Şaban 1447", "HicriTarihUzunIso8601": null, "AyinSekliURL": "https://namazvakti.diyanet.gov.tr/images/d6.gif", "MiladiTarihKisa": "08.02.2026", "MiladiTarihKisaIso8601": "08.02.2026", "MiladiTarihUzun": "08 Şubat 2026 Pazar", "MiladiTarihUzunIso8601": "2026-02-08T00:00:00.0000000+01:00", "GreenwichOrtalamaZamani": 3.0, "Aksam": "15:27", "Gunes": "08:20", "GunesBatis": "15:20", "GunesDogus": "08:27", "Ikindi": "13:00", "Imsak": "05:10", "KibleSaati": "10:11", "Ogle": "11:58", "Yatsi": "18:15"}, {"HicriTarihKisa": "21.8.1447", "HicriTarihKisaIso8601": null, "HicriTarihUzun": "21 Şaban 1447", "HicriTarihUzunIso8601": null, "AyinSekliURL": "https://namazvakti.diyanet.gov.tr/images/sondordun.gif", "MiladiTarihKisa": "09.02.2026", "MiladiTarihKisaIso8601": "09.02.2026", "MiladiTarihUzun": "09 Şubat 2026 Pazartesi", "MiladiTarihUzunIso8601": "2026-02-09T00:00:00.0000000+01:00", "GreenwichOrtalamaZamani": 3.0, "Aksam": "15:31", "Gunes": "08:16", "GunesBatis": "15:24", "GunesDogus": "08:23", "Ikindi": "13:02", "Imsak": "05:07", "KibleSaati": "10:11", "Ogle": "11:58", "Yatsi": "18:18"}, {"HicriTarihKisa": "22.8.1447", "HicriTarihKisaIso8601": null, "HicriTarihUzun": "22 Şaban 1447", "HicriTarihUzunIso8601": null, "AyinSekliURL": "https://namazvakti.diyanet.gov.tr/images/sd1.gif", "MiladiTarihKisa": "10.02.2026", "MiladiTarihKisaIso8601": "10.02.2026", "MiladiTarihUzun": "10 Şubat 2026 Salı", "MiladiTarihUzunIso8601": "2026-02-10T00:00:00.0000000+01:00", "GreenwichOrtalamaZamani": 3.0, "Aksam": "15:35", "Gunes": "08:11", "GunesBatis": "15:28", "GunesDogus": "08:18", "Ikindi": "13:05", "Imsak": "05:04", "KibleSaati": "10:11", "Ogle": "11:58", "Yatsi": "18:22"}, {"HicriTarihKisa": "23.8.1447", "HicriTarihKisaIso8601": null, "HicriTarihUzun": "23 Şaban 1447", "HicriTarihUzunIso8601": null, "AyinSekliURL": "https://namazvakti.diyanet.gov.tr/images/sd2.gif", "MiladiTarihKisa": "11.02.2026", "MiladiTarihKisaIso8601": "11.02.2026", "MiladiTarihUzun": "11 Şubat 2026 Çarşamba", "MiladiTarihUzunIso8601": "2026-02-11T00:00:00.0000000+01:00", "GreenwichOrtalamaZamani": 3.0, "Aksam": "15:39", "Gunes": "08:07", "GunesBatis": "15:32", "GunesDogus": "08:14", "Ikindi": "13:08", "Imsak": "05:00", "KibleSaati": "10:11", "Ogle": "11:58", "Yatsi": "18:25"}, {"HicriTarihKisa": "24.8.1447", "HicriTarihKisaIso8601": null, "HicriTarihUzun": "24 Şaban 1447", "HicriTarihUzunIso8601": null, "AyinSekliURL": "https://namazvakti.diyanet.gov.tr/images/sd3.gif", "MiladiTarihKisa": "12.02.2026", "MiladiTarihKisaIso8601": "12.02.2026", "MiladiTarihUzun": "12 Şubat 2026 Perşembe", "MiladiTarihUzunIso8601": "2026-02-12T00:00:00.0000000+01:00", "GreenwichOrtalamaZamani": 3.0, "Aksam": "15:43", "Gunes": "08:03", "GunesBatis": "15:36", "GunesDogus": "08:10", "Ikindi": "13:10", "Imsak": "04:57", "KibleSaati": "10:11", "Ogle": "11:58", "Yatsi": "18:28"}, {"HicriTarihKisa": "25.8.1447", "HicriTarihKisaIso8601": null, "HicriTarihUzun": "25 Şaban 1447", "HicriTarihUzunIso8601": null, "AyinSekliURL": "https://namazvakti.diyanet.gov.tr/images/sd4.gif", "MiladiTarihKisa": "13.02.2026", "MiladiTarihKisaIso8601": "13.02.2026", "MiladiTarihUzun": "13 Şubat 2026 Cuma", "MiladiTarihUzunIso8601": "2026-02-13T00:00:00.0000000+01:00", "GreenwichOrtalamaZamani": 3.0, "Aksam": "15:48", "Gunes": "07:59", "GunesBatis": "15:41", "GunesDogus": "08:06", "Ikindi": "13:13", "Imsak": "04:54", "KibleSaati": "10:12", "Ogle": "11:58", "Yatsi": "18:31"}, {"HicriTarihKisa": "26.8.1447", "HicriTarihKisaIso8601": null, "HicriTarihUzun": "26 Şaban 1447", "HicriTarihUzunIso8601": null, "AyinSekliURL": "https://namazvakti.diyanet.gov.tr/images/sd5.gif", "MiladiTarihKisa": "14.02.2026", "MiladiTarihKisaIso8601": "14.02.2026", "MiladiTarihUzun": "14 Şubat 2026 Cumartesi", "MiladiTarihUzunIso8601": "2026-02-14T00:00:00.0000000+01:00", "GreenwichOrtalamaZamani": 3.0, "Aksam": "15:52", "Gunes": "07:55", "GunesBatis": "15:45", "GunesDogus": "08:02", "Ikindi": "13:16", "Imsak": "04:50", "KibleSaati": "10:12", "Ogle": "11:58", "Yatsi": "18:35"}, {"HicriTarihKisa": "27.8.1447", "HicriTarihKisaIso8601": null, "HicriTarihUzun": "27 Şaban 1447", "HicriTarihUzunIso8601": null, "AyinSekliURL": "https://namazvakti.diyanet.gov.tr/images/sd6.gif", "MiladiTarihKisa": "15.02.2026", "MiladiTarihKisaIso8601": "15.02.2026", "MiladiTarihUzun": "15 Şubat 2026 Pazar", "MiladiTarihUzunIso8601": "2026-02-15T00:00:00.0000000+01:00", "GreenwichOrtalamaZamani": 3.0, "Aksam": "15:56", "Gunes": "07:51", "GunesBatis": "15:49", "GunesDogus": "07:58", "Ikindi": "13:18", "Imsak": "04:47", "KibleSaati": "10:12", "Ogle": "11:58", "Yatsi": "18:38"}, {"HicriTarihKisa": "28.8.1447", "HicriTarihKisaIso8601": null, "HicriTarihUzun": "28 Şaban 1447", "HicriTarihUzunIso8601": null, "AyinSekliURL": "https://namazvakti.diyanet.gov.tr/images/sd7.gif", "MiladiTarihKisa": "16.02.2026", "MiladiTarihKisaIso8601": "16.02.2026", "MiladiTarihUzun": "16 Şubat 2026 Pazartesi", "MiladiTarihUzunIso8601": "2026-02-16T00:00:00.0000000+01:00", "GreenwichOrtalamaZamani": 3.0, "Aksam": "16:00", "Gunes": "07:46", "GunesBatis": "15:53", "GunesDogus": "07:53", "Ikindi": "13:21", "Imsak": "04:44", "KibleSaati": "10:12", "Ogle": "11:58", "Yatsi": "18:41"}, {"HicriTarihKisa": "29.8.1447", "HicriTarihKisaIso8601": null, "HicriTarihUzun": "29 Şaban 1447", "HicriTarihUzunIso8601": null, "AyinSekliURL": "https://namazvakti.diyanet.gov.tr/images/ictima.gif", "MiladiTarihKisa": "17.02.2026", "MiladiTarihKisaIso8601": "17.02.2026", "MiladiTarihUzun": "17 Şubat 2026 Salı", "MiladiTarihUzunIso8601": "2026-02-17T00:00:00.0000000+01:00", "GreenwichOrtalamaZamani": 3.0, "Aksam": "16:04", "Gunes": "07:42", "GunesBatis": "15:57", "GunesDogus": "07:49", "Ikindi": "13:23", "Imsak": "04:40", "KibleSaati": "10:12", "Ogle": "11:58", "Yatsi": "18:45"}, {"HicriTarihKisa": "30.8.1447", "HicriTarihKisaIso8601": null, "HicriTarihUzun": "30 Şaban 1447", "HicriTarihUzunIso8601": null, "AyinSekliURL": "https://namazvakti.diyanet.gov.tr/images/ruyet.gif", "MiladiTarihKisa": "18.02.2026", "MiladiTarihKisaIso8601": "18.02.2026", "MiladiTarihUzun": "18 Şubat 2026 Çarşamba", "MiladiTarihUzunIso8601": "2026-02-18T00:00:00.0000000+01:00", "GreenwichOrtalamaZamani": 3.0, "Aksam": "16:08", "Gunes": "07:38", "GunesBatis": "16:01", "GunesDogus": "07:45", "Ikindi": "13:26", "Imsak": "04:36", "KibleSaati": "10:13", "Ogle": "11:58", "Yatsi": "18:48"}, {"HicriTarihKisa": "1.9.1447", "HicriTarihKisaIso8601": null, "HicriTarihUzun": "1 Ramazan 1447", "HicriTarihUzunIso8601": null, "AyinSekliURL": "https://namazvakti.diyanet.gov.tr/images/r1.gif", "MiladiTarihKisa": "19.02.2026", "MiladiTarihKisaIso8601": "19.02.2026", "MiladiTarihUzun": "19 Şubat 2026 Perşembe", "MiladiTarihUzunIso8601": "2026-02-19T00:00:00.0000000+01:00", "GreenwichOrtalamaZamani": 3.0, "Aksam": "16:12", "Gunes": "07:34", "GunesBatis": "16:05", "GunesDogus": "07:41", "Ikindi": "13:29", "Imsak": "04:33", "KibleSaati": "10:13", "Ogle": "11:58", "Yatsi": "18:51"}, {"HicriTarihKisa": "2.9.1447", "HicriTarihKisaIso8601": null, "HicriTarihUzun": "2 Ramazan 1447", "HicriTarihUzunIso8601": null, "AyinSekliURL": "https://namazvakti.diyanet.gov.tr/images/r2.gif", "MiladiTarihKisa": "20.02.2026", "MiladiTarihKisaIso8601": "20.02.2026", "MiladiTarihUzun": "20 Şubat 2026 Cuma", "MiladiTarihUzunIso8601": "2026-02-20T00:00:00.0000000+01:00", "GreenwichOrtalamaZamani": 3.0, "Aksam": "16:16", "Gunes": "07:30", "GunesBatis": "16:09", "GunesDogus": "07:37", "Ikindi": "13:31", "Imsak": "04:29", "KibleSaati": "10:13", "Ogle": "11:58", "Yatsi": "18:55"}, {"HicriTarihKisa": "3.9.1447", "HicriTarihKisaIso8601": null, "HicriTarihUzun": "3 Ramazan 1447", "HicriTarihUzunIso8601": null, "AyinSekliURL": "https://namazvakti.diyanet.gov.tr/images/r3.gif", "MiladiTarihKisa": "21.02.2026", "MiladiTarihKisaIso8601": "21.02.2026", "MiladiTarihUzun": "21 Şubat 2026 Cumartesi", "MiladiTarihUzunIso8601": "2026-02-21T00:00:00.0000000+01:00", "GreenwichOrtalamaZamani": 3.0, "Aksam": "16:20", "Gunes": "07:26", "GunesBatis": "16:13", "GunesDogus": "07:33", "Ikindi": "13:34", "Imsak": "04:25", "KibleSaati": "10:13", "Ogle": "11:58", "Yatsi": "18:58"}, {"HicriTarihKisa": "4.9.1447", "HicriTarihKisaIso8601": null, "HicriTarihUzun": "4 Ramazan 1447", "HicriTarihUzunIso8601": null, "AyinSekliURL": "https://namazvakti.diyanet.gov.tr/images/r4.gif", "MiladiTarihKisa": "22.02.2026", "MiladiTarihKisaIso8601": "22.02.2026", "MiladiTarihUzun": "22 Şubat 2026 Pazar", "MiladiTarihUzunIso8601": "2026-02-22T00:00:00.0000000+01:00", "GreenwichOrtalamaZamani": 3.0, "Aksam": "16:24", "Gunes": "07:21", "GunesBatis": "16:17", "GunesDogus": "07:28", "Ikindi": "13:36", "Imsak": "04:21", "KibleSaati": "10:13", "Ogle": "11:58", "Yatsi": "19:02"}, {"HicriTarihKisa": "5.9.1447", "HicriTarihKisaIso8601": null, "HicriTarihUzun": "5 Ramazan 1447", "HicriTarihUzunIso8601": null, "AyinSekliURL": "https://namazvakti.diyanet.gov.tr/images/r5.gif", "MiladiTarihKisa": "23.02.2026", "MiladiTarihKisaIso8601": "23.02.2026", "MiladiTarihUzun": "23 Şubat 2026 Pazartesi", "MiladiTarihUzunIso8601": "2026-02-23T00:00:00.0000000+01:00", "GreenwichOrtalamaZamani": 3.0, "Aksam": "16:28", "Gunes": "07:17", "GunesBatis": "16:21", "GunesDogus": "07:24", "Ikindi": "13:39", "Imsak": "04:17", "KibleSaati": "10:13", "Ogle": "11:57", "Yatsi": "19:06"}, {"HicriTarihKisa": "6.9.1447", "HicriTarihKisaIso8601": null, "HicriTarihUzun": "6 Ramazan 1447", "HicriTarihUzunIso8601": null, "AyinSekliURL": "https://namazvakti.diyanet.gov.tr/images/ilkdordun.gif", "MiladiTarihKisa": "24.02.2026", "MiladiTarihKisaIso8601": "24.02.2026", "MiladiTarihUzun": "24 Şubat 2026 Salı", "MiladiTarihUzunIso8601": "2026-02-24T00:00:00.0000000+01:00", "GreenwichOrtalamaZamani": 3.0, "Aksam": "16:32", "Gunes": "07:13", "GunesBatis": "16:25", "GunesDogus": "07:20", "Ikindi": "13:42", "Imsak": "04:13", "KibleSaati": "10:13", "Ogle": "11:57", "Yatsi": "19:09"}, {"HicriTarihKisa": "7.9.1447", "HicriTarihKisaIso8601": null, "HicriTarihUzun": "7 Ramazan 1447", "HicriTarihUzunIso8601": null, "AyinSekliURL": "https://namazvakti.diyanet.gov.tr/images/i1.gif", "MiladiTarihKisa": "25.02.2026", "MiladiTarihKisaIso8601": "25.02.2026", "MiladiTarihUzun": "25 Şubat 2026 Çarşamba", "MiladiTarihUzunIso8601": "2026-02-25T00:00:00.0000000+01:00", "GreenwichOrtalamaZamani": 3.0, "Aksam": "16:35", "Gunes": "07:09", "GunesBatis": "16:28", "GunesDogus": "07:16", "Ikindi": "13:44", "Imsak": "04:09", "KibleSaati": "10:13", "Ogle": "11:57", "Yatsi": "19:13"}, {"HicriTarihKisa": "8.9.1447", "HicriTarihKisaIso8601": null, "HicriTarihUzun": "8 Ramazan 1447", "HicriTarihUzunIso8601": null, "AyinSekliURL": "https://namazvakti.diyanet.gov.tr/images/i2.gif", "MiladiTarihKisa": "26.02.2026", "MiladiTarihKisaIso8601": "26.02.2026", "MiladiTarihUzun": "26 Şubat 2026 Perşembe", "MiladiTarihUzunIso8601": "2026-02-26T00:00:00.0000000+01:00", "GreenwichOrtalamaZamani": 3.0, "Aksam": "16:39", "Gunes": "07:05", "GunesBatis": "16:32", "GunesDogus": "07:12", "Ikindi": "13:47", "Imsak": "04:05", "KibleSaati": "10:14", "Ogle": "11:57", "Yatsi": "19:16"}, {"HicriTarihKisa": "9.9.1447", "HicriTarihKisaIso8601": null, "HicriTarihUzun": "9 Ramazan 1447", "HicriTarihUzunIso8601": null, "AyinSekliURL": "https://namazvakti.diyanet.gov.tr/images/i3.gif", "MiladiTarihKisa": "27.02.2026", "MiladiTarihKisaIso8601": "27.02.2026", "MiladiTarihUzun": "27 Şubat 2026 Cuma", "MiladiTarihUzunIso8601": "2026-02-27T00:00:00.0000000+01:00", "GreenwichOrtalamaZamani": 3.0, "Aksam": "16:43", "Gunes": "07:01", "GunesBatis": "16:36", "GunesDogus": "07:08", "Ikindi": "13:49", "Imsak": "04:01", "KibleSaati": "10:14", "Ogle": "11:57", "Yatsi": "19:20"}, {"HicriTarihKisa": "10.9.1447", "HicriTarihKisaIso8601": null, "HicriTarihUzun": "10 Ramazan 1447", "HicriTarihUzunIso8601": null, "AyinSekliURL": "https://namazvakti.diyanet.gov.tr/images/i4.gif", "MiladiTarihKisa": "28.02.2026", "MiladiTarihKisaIso8601": "28.02.2026", "MiladiTarihUzun": "28 Şubat 2026 Cumartesi", "MiladiTarihUzunIso8601": "2026-02-28T00:00:00.0000000+01:00", "GreenwichOrtalamaZamani": 3.0, "Aksam": "16:47", "Gunes": "06:57", "GunesBatis": "16:40", "GunesDogus": "07:04", "Ikindi": "13:52", "Imsak": "03:57", "KibleSaati": "10:14", "Ogle": "11:57", "Yatsi": "19:24"}, {"HicriTarihKisa": "11.9.1447", "HicriTarihKisaIso8601": null, "HicriTarihUzun": "11 Ramazan 1447", "HicriTarihUzunIso8601": null, "AyinSekliURL": "https://namazvakti.diyanet.gov.tr/images/i5.gif", "MiladiTarihKisa": "01.03.2026", "MiladiTarihKisaIso8601": "01.03.2026", "MiladiTarihUzun": "01 Mart 2026 Pazar", "MiladiTarihUzunIso8601": "2026-03-01T00:00:00.0000000+01:00", "GreenwichOrtalamaZamani": 3.0, "Aksam": "16:51", "Gunes": "06:52", "GunesBatis": "16:44", "GunesDogus": "06:59", "Ikindi": "13:54", "Imsak": "03:52", "KibleSaati": "10:14", "Ogle": "11:56", "Yatsi": "19:28"}, {"HicriTarihKisa": "12.9.1447", "HicriTarihKisaIso8601": null, "HicriTarihUzun": "12 Ramazan 1447", "HicriTarihUzunIso8601": null, "AyinSekliURL": "https://namazvakti.diyanet.gov.tr/images/i6.gif", "MiladiTarihKisa": "02.03.2026", "MiladiTarihKisaIso8601": "02.03.2026", "MiladiTarihUzun": "02 Mart 2026 Pazartesi", "MiladiTarihUzunIso8601": "2026-03-02T00:00:00.0000000+01:00", "GreenwichOrtalamaZamani": 3.0, "Aksam": "16:54", "Gunes": "06:48", "GunesBatis": "16:47", "GunesDogus": "06:55", "Ikindi": "13:57", "Imsak": "03:48", "KibleSaati": "10:14", "Ogle": "11:56", "Yatsi": "19:31"}, {"HicriTarihKisa": "13.9.1447", "HicriTarihKisaIso8601": null, "HicriTarihUzun": "13 Ramazan 1447", "HicriTarihUzunIso8601": null, "AyinSekliURL": "https://namazvakti.diyanet.gov.tr/images/dolunay.gif", "MiladiTarihKisa": "03.03.2026", "MiladiTarihKisaIso8601": "03.03.2026", "MiladiTarihUzun": "03 Mart 2026 Salı", "MiladiTarihUzunIso8601": "2026-03-03T00:00:00.0000000+01:00", "GreenwichOrtalamaZamani": 3.0, "Aksam": "16:58", "Gunes": "06:44", "GunesBatis": "16:51", "GunesDogus": "06:51", "Ikindi": "13:59", "Imsak": "03:43", "KibleSaati": "10:14", "Ogle": "11:56", "Yatsi": "19:35"}, {"HicriTarihKisa": "14.9.1447", "HicriTarihKisaIso8601": null, "HicriTarihUzun": "14 Ramazan 1447", "HicriTarihUzunIso8601": null, "AyinSekliURL": "https://namazvakti.diyanet.gov.tr/images/d1.gif", "MiladiTarihKisa": "04.03.2026", "MiladiTarihKisaIso8601": "04.03.2026", "MiladiTarihUzun": "04 Mart 2026 Çarşamba", "MiladiTarihUzunIso8601": "2026-03-04T00:00:00.0000000+01:00", "GreenwichOrtalamaZamani": 3.0, "Aksam": "17:02", "Gunes": "06:40", "GunesBatis": "16:55", "GunesDogus": "06:47", "Ikindi": "14:02", "Imsak": "03:39", "KibleSaati": "10:14", "Ogle": "11:56", "Yatsi": "19:39"}, {"HicriTarihKisa": "15.9.1447", "HicriTarihKisaIso8601": null, "HicriTarihUzun": "15 Ramazan 1447", "HicriTarihUzunIso8601": null, "AyinSekliURL": "https://namazvakti.diyanet.gov.tr/images/d2.gif", "MiladiTarihKisa": "05.03.2026", "MiladiTarihKisaIso8601": "05.03.2026", "MiladiTarihUzun": "05 Mart 2026 Perşembe", "MiladiTarihUzunIso8601": "2026-03-05T00:00:00.0000000+01:00", "GreenwichOrtalamaZamani": 3.0, "Aksam": "17:06", "Gunes": "06:36", "GunesBatis": "16:59", "GunesDogus": "06:43", "Ikindi": "14:04", "Imsak": "03:34", "KibleSaati": "10:14", "Ogle": "11:56", "Yatsi": "19:43"}, {"HicriTarihKisa": "16.9.1447", "HicriTarihKisaIso8601": null, "HicriTarihUzun": "16 Ramazan 1447", "HicriTarihUzunIso8601": null, "AyinSekliURL": "https://namazvakti.diyanet.gov.tr/images/d3.gif", "MiladiTarihKisa": "06.03.2026", "MiladiTarihKisaIso8601": "06.03.2026", "MiladiTarihUzun": "06 Mart 2026 Cuma", "MiladiTarihUzunIso8601": "2026-03-06T00:00:00.0000000+01:00", "GreenwichOrtalamaZamani": 3.0, "Aksam": "17:09", "Gunes": "06:32", "GunesBatis": "17:02", "GunesDogus": "06:39", "Ikindi": "14:07", "Imsak": "03:30", "KibleSaati": "10:14", "Ogle": "11:55", "Yatsi": "19:47"}, {"HicriTarihKisa": "17.9.1447", "HicriTarihKisaIso8601": null, "HicriTarihUzun": "17 Ramazan 1447", "HicriTarihUzunIso8601": null, "AyinSekliURL": "https://namazvakti.diyanet.gov.tr/images/d4.gif", "MiladiTarihKisa": "07.03.2026", "MiladiTarihKisaIso8601": "07.03.2026", "MiladiTarihUzun": "07 Mart 2026 Cumartesi", "MiladiTarihUzunIso8601": "2026-03-07T00:00:00.0000000+01:00", "GreenwichOrtalamaZamani": 3.0, "Aksam": "17:13", "Gunes": "06:27", "GunesBatis": "17:06", "GunesDogus": "06:34", "Ikindi": "14:09", "Imsak": "03:25", "KibleSaati": "10:14", "Ogle": "11:55", "Yatsi": "19:51"}, {"HicriTarihKisa": "18.9.1447", "HicriTarihKisaIso8601": null, "HicriTarihUzun": "18 Ramazan 1447", "HicriTarihUzunIso8601": null, "AyinSekliURL": "https://namazvakti.diyanet.gov.tr/images/d5.gif", "MiladiTarihKisa": "08.03.2026", "MiladiTarihKisaIso8601": "08.03.2026", "MiladiTarihUzun": "08 Mart 2026 Pazar", "MiladiTarihUzunIso8601": "2026-03-08T00:00:00.0000000+01:00", "GreenwichOrtalamaZamani": 3.0, "Aksam": "17:17", "Gunes": "06:23", "GunesBatis": "17:10", "GunesDogus": "06:30", "Ikindi": "14:11", "Imsak": "03:20", "KibleSaati": "10:14", "Ogle": "11:55", "Yatsi": "19:55"}]