[{"HicriTarihKisa": "20.8.1447", "HicriTarihKisaIso8601": null, "HicriTarihUzun": "20 Şaban 1447", "HicriTarihUzunIso8601": null, "AyinSekliURL": "https://namazvakti.diyanet.gov.tr/images/d6.gif", "MiladiTarihKisa": "08.02.2026", "MiladiTarihKisaIso8601": "08.02.2026", "MiladiTarihUzun": "08 Şubat 2026 Pazar", "MiladiTarihUzunIso8601": "2026-02-08T00:00:00.0000000+01:00", "GreenwichOrtalamaZamani": 3.0, "Aksam": "17:00", "Gunes": "08:07", "GunesBatis": "16:53", "GunesDogus": "08:14", "Ikindi": "14:28", "Imsak": "05:54", "KibleSaati": "09:40", "Ogle": "12:39", "Yatsi": "18:58"}, {"HicriTarihKisa": "21.8.1447", "HicriTarihKisaIso8601": null, "HicriTarihUzun": "21 Şaban 1447", "HicriTarihUzunIso8601": null, "AyinSekliURL": "https://namazvakti.diyanet.gov.tr/images/sondordun.gif", "MiladiTarihKisa": "09.02.2026", "MiladiTarihKisaIso8601": "09.02.2026", "MiladiTarihUzun": "09 Şubat 2026 Pazartesi", "MiladiTarihUzunIso8601": "2026-02-09T00:00:00.0000000+01:00", "GreenwichOrtalamaZamani": 3.0, "Aksam": "17:03", "Gunes": "08:05", "GunesBatis": "16:56", "GunesDogus": "08:12", "Ikindi": "14:29", "Imsak": "05:51", "KibleSaati": "09:40", "Ogle": "12:39", "Yatsi": "19:00"}, {"HicriTarihKisa": "22.8.1447", "HicriTarihKisaIso8601": null, "HicriTarihUzun": "22 Şaban 1447", "HicriTarihUzunIso8601": null, "AyinSekliURL": "https://namazvakti.diyanet.gov.tr/images/sd1.gif", "MiladiTarihKisa": "10.02.2026", "MiladiTarihKisaIso8601": "10.02.2026", "MiladiTarihUzun": "10 Şubat 2026 Salı", "MiladiTarihUzunIso8601": "2026-02-10T00:00:00.0000000+01:00", "GreenwichOrtalamaZamani": 3.0, "Aksam": "17:05", "Gunes": "08:02", "GunesBatis": "16:58", "GunesDogus": "08:09", "Ikindi": "14:31", "Imsak": "05:49", "KibleSaati": "09:41", "Ogle": "12:39", "Yatsi": "19:02"}, {"HicriTarihKisa": "23.8.1447", "HicriTarihKisaIso8601": null, "HicriTarihUzun": "23 Şaban 1447", "HicriTarihUzunIso8601": null, "AyinSekliURL": "https://namazvakti.diyanet.gov.tr/images/sd2.gif", "MiladiTarihKisa": "11.02.2026", "MiladiTarihKisaIso8601": "11.02.2026", "MiladiTarihUzun": "11 Şubat 2026 Çarşamba", "MiladiTarihUzunIso8601": "2026-02-11T00:00:00.0000000+01:00", "GreenwichOrtalamaZamani": 3.0, "Aksam": "17:08", "Gunes": "08:00", "GunesBatis": "17:01", "GunesDogus": "08:07", "Ikindi": "14:33", "Imsak": "05:47", "KibleSaati": "09:41", "Ogle": "12:39", "Yatsi": "19:04"}, {"HicriTarihKisa": "24.8.1447", "HicriTarihKisaIso8601": null, "HicriTarihUzun": "24 Şaban 1447", "HicriTarihUzunIso8601": null, "AyinSekliURL": "https://namazvakti.diyanet.gov.tr/images/sd3.gif", "MiladiTarihKisa": "12.02.2026", "MiladiTarihKisaIso8601": "12.02.2026", "MiladiTarihUzun": "12 Şubat 2026 Perşembe", "MiladiTarihUzunIso8601": "2026-02-12T00:00:00.0000000+01:00", "GreenwichOrtalamaZamani": 3.0, "Aksam": "17:10", "Gunes": "07:57", "GunesBatis": "17:03", "GunesDogus": "08:04", "Ikindi": "14:35", "Imsak": "05:45", "KibleSaati": "09:42", "Ogle": "12:39", "Yatsi": "19:07"}, {"HicriTarihKisa": "25.8.1447", "HicriTarihKisaIso8601": null, "HicriTarihUzun": "25 Şaban 1447", "HicriTarihUzunIso8601": null, "AyinSekliURL": "https://namazvakti.diyanet.gov.tr/images/sd4.gif", "MiladiTarihKisa": "13.02.2026", "MiladiTarihKisaIso8601": "13.02.2026", "MiladiTarihUzun": "13 Şubat 2026 Cuma", "MiladiTarihUzunIso8601": "2026-02-13T00:00:00.0000000+01:00", "GreenwichOrtalamaZamani": 3.0, "Aksam": "17:13", "Gunes": "07:54", "GunesBatis": "17:06", "GunesDogus": "08:01", "Ikindi": "14:37", "Imsak": "05:43", "KibleSaati": "09:42", "Ogle": "12:39", "Yatsi": "19:09"}, {"HicriTarihKisa": "26.8.1447", "HicriTarihKisaIso8601": null, "HicriTarihUzun": "26 Şaban 1447", "HicriTarihUzunIso8601": null, "AyinSekliURL": "https://namazvakti.diyanet.gov.tr/images/sd5.gif", "MiladiTarihKisa": "14.02.2026", "MiladiTarihKisaIso8601": "14.02.2026", "MiladiTarihUzun": "14 Şubat 2026 Cumartesi", "MiladiTarihUzunIso8601": "2026-02-14T00:00:00.0000000+01:00", "GreenwichOrtalamaZamani": 3.0, "Aksam": "17:15", "Gunes": "07:52", "GunesBatis": "17:08", "GunesDogus": "07:59", "Ikindi": "14:39", "Imsak": "05:40", "KibleSaati": "09:43", "Ogle": "12:39", "Yatsi": "19:11"}, {"HicriTarihKisa": "27.8.1447", "HicriTarihKisaIso8601": null, "HicriTarihUzun": "27 Şaban 1447", "HicriTarihUzunIso8601": null, "AyinSekliURL": "https://namazvakti.diyanet.gov.tr/images/sd6.gif", "MiladiTarihKisa": "15.02.2026", "MiladiTarihKisaIso8601": "15.02.2026", "MiladiTarihUzun": "15 Şubat 2026 Pazar", "MiladiTarihUzunIso8601": "2026-02-15T00:00:00.0000000+01:00", "GreenwichOrtalamaZamani": 3.0, "Aksam": "17:18", "Gunes": "07:49", "GunesBatis": "17:11", "GunesDogus": "07:56", "Ikindi": "14:41", "Imsak": "05:38", "KibleSaati": "09:43", "Ogle": "12:39", "Yatsi": "19:13"}, {"HicriTarihKisa": "28.8.1447", "HicriTarihKisaIso8601": null, "HicriTarihUzun": "28 Şaban 1447", "HicriTarihUzunIso8601": null, "AyinSekliURL": "https://namazvakti.diyanet.gov.tr/images/sd7.gif", "MiladiTarihKisa": "16.02.2026", "MiladiTarihKisaIso8601": "16.02.2026", "MiladiTarihUzun": "16 Şubat 2026 Pazartesi", "MiladiTarihUzunIso8601": "2026-02-16T00:00:00.0000000+01:00", "GreenwichOrtalamaZamani": 3.0, "Aksam": "17:21", "Gunes": "07:47", "GunesBatis": "17:14", "GunesDogus": "07:54", "Ikindi": "14:43", "Imsak": "05:36", "KibleSaati": "09:44", "Ogle": "12:39", "Yatsi": "19:16"}, {"HicriTarihKisa": "29.8.1447", "HicriTarihKisaIso8601": null, "HicriTarihUzun": "29 Şaban 1447", "HicriTarihUzunIso8601": null, "AyinSekliURL": "https://namazvakti.diyanet.gov.tr/images/ictima.gif", "MiladiTarihKisa": "17.02.2026", "MiladiTarihKisaIso8601": "17.02.2026", "MiladiTarihUzun": "17 Şubat 2026 Salı", "MiladiTarihUzunIso8601": "2026-02-17T00:00:00.0000000+01:00", "GreenwichOrtalamaZamani": 3.0, "Aksam": "17:23", "Gunes": "07:44", "GunesBatis": "17:16", "GunesDogus": "07:51", "Ikindi": "14:45", "Imsak": "05:33", "KibleSaati": "09:44", "Ogle": "12:38", "Yatsi": "19:18"}, {"HicriTarihKisa": "30.8.1447", "HicriTarihKisaIso8601": null, "HicriTarihUzun": "30 Şaban 1447", "HicriTarihUzunIso8601": null, "AyinSekliURL": "https://namazvakti.diyanet.gov.tr/images/ruyet.gif", "MiladiTarihKisa": "18.02.2026", "MiladiTarihKisaIso8601": "18.02.2026", "MiladiTarihUzun": "18 Şubat 2026 Çarşamba", "MiladiTarihUzunIso8601": "2026-02-18T00:00:00.0000000+01:00", "GreenwichOrtalamaZamani": 3.0, "Aksam": "17:26", "Gunes": "07:41", "GunesBatis": "17:19", "GunesDogus": "07:48", "Ikindi": "14:46", "Imsak": "05:31", "KibleSaati": "09:45", "Ogle": "12:38", "Yatsi": "19:20"}, {"HicriTarihKisa": "1.9.1447", "HicriTarihKisaIso8601": null, "HicriTarihUzun": "1 Ramazan 1447", "HicriTarihUzunIso8601": null, "AyinSekliURL": "https://namazvakti.diyanet.gov.tr/images/r1.gif", "MiladiTarihKisa": "19.02.2026", "MiladiTarihKisaIso8601": "19.02.2026", "MiladiTarihUzun": "19 Şubat 2026 Perşembe", "MiladiTarihUzunIso8601": "2026-02-19T00:00:00.0000000+01:00", "GreenwichOrtalamaZamani": 3.0, "Aksam": "17:28", "Gunes": "07:38", "GunesBatis": "17:21", "GunesDogus": "07:45", "Ikindi": "14:48", "Imsak": "05:28", "KibleSaati": "09:45", "Ogle": "12:38", "Yatsi": "19:22"}, {"HicriTarihKisa": "2.9.1447", "HicriTarihKisaIso8601": null, "HicriTarihUzun": "2 Ramazan 1447", "HicriTarihUzunIso8601": null, "AyinSekliURL": "https://namazvakti.diyanet.gov.tr/images/r2.gif", "MiladiTarihKisa": "20.02.2026", "MiladiTarihKisaIso8601": "20.02.2026", "MiladiTarihUzun": "20 Şubat 2026 Cuma", "MiladiTarihUzunIso8601": "2026-02-20T00:00:00.0000000+01:00", "GreenwichOrtalamaZamani": 3.0, "Aksam": "17:31", "Gunes": "07:36", "GunesBatis": "17:24", "GunesDogus": "07:43", "Ikindi": "14:50", "Imsak": "05:26", "KibleSaati": "09:45", "Ogle": "12:38", "Yatsi": "19:25"}, {"HicriTarihKisa": "3.9.1447", "HicriTarihKisaIso8601": null, "HicriTarihUzun": "3 Ramazan 1447", "HicriTarihUzunIso8601": null, "AyinSekliURL": "https://namazvakti.diyanet.gov.tr/images/r3.gif", "MiladiTarihKisa": "21.02.2026", "MiladiTarihKisaIso8601": "21.02.2026", "MiladiTarihUzun": "21 Şubat 2026 Cumartesi", "MiladiTarihUzunIso8601": "2026-02-21T00:00:00.0000000+01:00", "GreenwichOrtalamaZamani": 3.0, "Aksam": "17:33", "Gunes": "07:33", "GunesBatis": "17:26", "GunesDogus": "07:40", "Ikindi": "14:52", "Imsak": "05:23", "KibleSaati": "09:46", "Ogle": "12:38", "Yatsi": "19:27"}, {"HicriTarihKisa": "4.9.1447", "HicriTarihKisaIso8601": null, "HicriTarihUzun": "4 Ramazan 1447", "HicriTarihUzunIso8601": null, "AyinSekliURL": "https://namazvakti.diyanet.gov.tr/images/r4.gif", "MiladiTarihKisa": "22.02.2026", "MiladiTarihKisaIso8601": "22.02.2026", "MiladiTarihUzun": "22 Şubat 2026 Pazar", "MiladiTarihUzunIso8601": "2026-02-22T00:00:00.0000000+01:00", "GreenwichOrtalamaZamani": 3.0, "Aksam": "17:36", "Gunes": "07:30", "GunesBatis": "17:29", "GunesDogus": "07:37", "Ikindi": "14:54", "Imsak": "05:21", "KibleSaati": "09:46", "Ogle": "12:38", "Yatsi": "19:29"}, {"HicriTarihKisa": "5.9.1447", "HicriTarihKisaIso8601": null, "HicriTarihUzun": "5 Ramazan 1447", "HicriTarihUzunIso8601": null, "AyinSekliURL": "https://namazvakti.diyanet.gov.tr/images/r5.gif", "MiladiTarihKisa": "23.02.2026", "MiladiTarihKisaIso8601": "23.02.2026", "MiladiTarihUzun": "23 Şubat 2026 Pazartesi", "MiladiTarihUzunIso8601": "2026-02-23T00:00:00.0000000+01:00", "GreenwichOrtalamaZamani": 3.0, "Aksam": "17:38", "Gunes": "07:28", "GunesBatis": "17:31", "GunesDogus": "07:35", "Ikindi": "14:56", "Imsak": "05:18", "KibleSaati": "09:47", "Ogle": "12:38", "Yatsi": "19:32"}, {"HicriTarihKisa": "6.9.1447", "HicriTarihKisaIso8601": null, "HicriTarihUzun": "6 Ramazan 1447", "HicriTarihUzunIso8601": null, "AyinSekliURL": "https://namazvakti.diyanet.gov.tr/images/ilkdordun.gif", "MiladiTarihKisa": "24.02.2026", "MiladiTarihKisaIso8601": "24.02.2026", "MiladiTarihUzun": "24 Şubat 2026 Salı", "MiladiTarihUzunIso8601": "2026-02-24T00:00:00.0000000+01:00", "GreenwichOrtalamaZamani": 3.0, "Aksam": "17:41", "Gunes": "07:25", "GunesBatis": "17:34", "GunesDogus": "07:32", "Ikindi": "14:57", "Imsak": "05:15", "KibleSaati": "09:47", "Ogle": "12:38", "Yatsi": "19:34"}, {"HicriTarihKisa": "7.9.1447", "HicriTarihKisaIso8601": null, "HicriTarihUzun": "7 Ramazan 1447", "HicriTarihUzunIso8601": null, "AyinSekliURL": "https://namazvakti.diyanet.gov.tr/images/i1.gif", "MiladiTarihKisa": "25.02.2026", "MiladiTarihKisaIso8601": "25.02.2026", "MiladiTarihUzun": "25 Şubat 2026 Çarşamba", "MiladiTarihUzunIso8601": "2026-02-25T00:00:00.0000000+01:00", "GreenwichOrtalamaZamani": 3.0, "Aksam": "17:43", "Gunes": "07:22", "GunesBatis": "17:36", "GunesDogus": "07:29", "Ikindi": "14:59", "Imsak": "05:13", "KibleSaati": "09:48", "Ogle": "12:38", "Yatsi": "19:37"}, {"HicriTarihKisa": "8.9.1447", "HicriTarihKisaIso8601": null, "HicriTarihUzun": "8 Ramazan 1447", "HicriTarihUzunIso8601": null, "AyinSekliURL": "https://namazvakti.diyanet.gov.tr/images/i2.gif", "MiladiTarihKisa": "26.02.2026", "MiladiTarihKisaIso8601": "26.02.2026", "MiladiTarihUzun": "26 Şubat 2026 Perşembe", "MiladiTarihUzunIso8601": "2026-02-26T00:00:00.0000000+01:00", "GreenwichOrtalamaZamani": 3.0, "Aksam": "17:46", "Gunes": "07:19", "GunesBatis": "17:39", "GunesDogus": "07:26", "Ikindi": "15:01", "Imsak": "05:10", "KibleSaati": "09:48", "Ogle": "12:37", "Yatsi": "19:39"}, {"HicriTarihKisa": "9.9.1447", "HicriTarihKisaIso8601": null, "HicriTarihUzun": "9 Ramazan 1447", "HicriTarihUzunIso8601": null, "AyinSekliURL": "https://namazvakti.diyanet.gov.tr/images/i3.gif", "MiladiTarihKisa": "27.02.2026", "MiladiTarihKisaIso8601": "27.02.2026", "MiladiTarihUzun": "27 Şubat 2026 Cuma", "MiladiTarihUzunIso8601": "2026-02-27T00:00:00.0000000+01:00", "GreenwichOrtalamaZamani": 3.0, "Aksam": "17:48", "Gunes": "07:16", "GunesBatis": "17:41", "GunesDogus": "07:23", "Ikindi": "15:03", "Imsak": "05:07", "KibleSaati": "09:48", "Ogle": "12:37", "Yatsi": "19:41"}, {"HicriTarihKisa": "10.9.1447", "HicriTarihKisaIso8601": null, "HicriTarihUzun": "10 Ramazan 1447", "HicriTarihUzunIso8601": null, "AyinSekliURL": "https://namazvakti.diyanet.gov.tr/images/i4.gif", "MiladiTarihKisa": "28.02.2026", "MiladiTarihKisaIso8601": "28.02.2026", "MiladiTarihUzun": "28 Şubat 2026 Cumartesi", "MiladiTarihUzunIso8601": "2026-02-28T00:00:00.0000000+01:00", "GreenwichOrtalamaZamani": 3.0, "Aksam": "17:51", "Gunes": "07:13", "GunesBatis": "17:44", "GunesDogus": "07:20", "Ikindi": "15:05", "Imsak": "05:04", "KibleSaati": "09:49", "Ogle": "12:37", "Yatsi": "19:44"}, {"HicriTarihKisa": "11.9.1447", "HicriTarihKisaIso8601": null, "HicriTarihUzun": "11 Ramazan 1447", "HicriTarihUzunIso8601": null, "AyinSekliURL": "https://namazvakti.diyanet.gov.tr/images/i5.gif", "MiladiTarihKisa": "01.03.2026", "MiladiTarihKisaIso8601": "01.03.2026", "MiladiTarihUzun": "01 Mart 2026 Pazar", "MiladiTarihUzunIso8601": "2026-03-01T00:00:00.0000000+01:00", "GreenwichOrtalamaZamani": 3.0, "Aksam": "17:53", "Gunes": "07:11", "GunesBatis": "17:46", "GunesDogus": "07:18", "Ikindi": "15:06", "Imsak": "05:01", "KibleSaati": "09:49", "Ogle": "12:37", "Yatsi": "19:46"}, {"HicriTarihKisa": "12.9.1447", "HicriTarihKisaIso8601": null, "HicriTarihUzun": "12 Ramazan 1447", "HicriTarihUzunIso8601": null, "AyinSekliURL": "https://namazvakti.diyanet.gov.tr/images/i6.gif", "MiladiTarihKisa": "02.03.2026", "MiladiTarihKisaIso8601": "02.03.2026", "MiladiTarihUzun": "02 Mart 2026 Pazartesi", "MiladiTarihUzunIso8601": "2026-03-02T00:00:00.0000000+01:00", "GreenwichOrtalamaZamani": 3.0, "Aksam": "17:56", "Gunes": "07:08", "GunesBatis": "17:49", "GunesDogus": "07:15", "Ikindi": "15:08", "Imsak": "04:58", "KibleSaati": "09:49", "Ogle": "12:37", "Yatsi": "19:49"}, {"HicriTarihKisa": "13.9.1447", "HicriTarihKisaIso8601": null, "HicriTarihUzun": "13 Ramazan 1447", "HicriTarihUzunIso8601": null, "AyinSekliURL": "https://namazvakti.diyanet.gov.tr/images/dolunay.gif", "MiladiTarihKisa": "03.03.2026", "MiladiTarihKisaIso8601": "03.03.2026", "MiladiTarihUzun": "03 Mart 2026 Salı", "MiladiTarihUzunIso8601": "2026-03-03T00:00:00.0000000+01:00", "GreenwichOrtalamaZamani": 3.0, "Aksam": "17:58", "Gunes": "07:05", "GunesBatis": "17:51", "GunesDogus": "07:12", "Ikindi": "15:10", "Imsak": "04:56", "KibleSaati": "09:50", "Ogle": "12:36", "Yatsi": "19:51"}, {"HicriTarihKisa": "14.9.1447", "HicriTarihKisaIso8601": null, "HicriTarihUzun": "14 Ramazan 1447", "HicriTarihUzunIso8601": null, "AyinSekliURL": "https://namazvakti.diyanet.gov.tr/images/d1.gif", "MiladiTarihKisa": "04.03.2026", "MiladiTarihKisaIso8601": "04.03.2026", "MiladiTarihUzun": "04 Mart 2026 Çarşamba", "MiladiTarihUzunIso8601": "2026-03-04T00:00:00.0000000+01:00", "GreenwichOrtalamaZamani": 3.0, "Aksam": "18:00", "Gunes": "07:02", "GunesBatis": "17:53", "GunesDogus": "07:09", "Ikindi": "15:12", "Imsak": "04:53", "KibleSaati": "09:50", "Ogle": "12:36", "Yatsi": "19:54"}, {"HicriTarihKisa": "15.9.1447", "HicriTarihKisaIso8601": null, "HicriTarihUzun": "15 Ramazan 1447", "HicriTarihUzunIso8601": null, "AyinSekliURL": "https://namazvakti.diyanet.gov.tr/images/d2.gif", "MiladiTarihKisa": "05.03.2026", "MiladiTarihKisaIso8601": "05.03.2026", "MiladiTarihUzun": "05 Mart 2026 Perşembe", "MiladiTarihUzunIso8601": "2026-03-05T00:00:00.0000000+01:00", "GreenwichOrtalamaZamani": 3.0, "Aksam": "18:03", "Gunes": "06:59", "GunesBatis": "17:56", "GunesDogus": "07:06", "Ikindi": "15:13", "Imsak": "04:50", "KibleSaati": "09:51", "Ogle": "12:36", "Yatsi": "19:56"}, {"HicriTarihKisa": "16.9.1447", "HicriTarihKisaIso8601": null, "HicriTarihUzun": "16 Ramazan 1447", "HicriTarihUzunIso8601": null, "AyinSekliURL": "https://namazvakti.diyanet.gov.tr/images/d3.gif", "MiladiTarihKisa": "06.03.2026", "MiladiTarihKisaIso8601": "06.03.2026", "MiladiTarihUzun": "06 Mart 2026 Cuma", "MiladiTarihUzunIso8601": "2026-03-06T00:00:00.0000000+01:00", "GreenwichOrtalamaZamani": 3.0, "Aksam": "18:05", "Gunes": "06:56", "GunesBatis": "17:58", "GunesDogus": "07:03", "Ikindi": "15:15", "Imsak": "04:47", "KibleSaati": "09:51", "Ogle": "12:36", "Yatsi": "19:59"}, {"HicriTarihKisa": "17.9.1447", "HicriTarihKisaIso8601": null, "HicriTarihUzun": "17 Ramazan 1447", "HicriTarihUzunIso8601": null, "AyinSekliURL": "https://namazvakti.diyanet.gov.tr/images/d4.gif", "MiladiTarihKisa": "07.03.2026", "MiladiTarihKisaIso8601": "07.03.2026", "MiladiTarihUzun": "07 Mart 2026 Cumartesi", "MiladiTarihUzunIso8601": "2026-03-07T00:00:00.0000000+01:00", "GreenwichOrtalamaZamani": 3.0, "Aksam": "18:08", "Gunes": "06:53", "GunesBatis": "18:01", "GunesDogus": "07:00", "Ikindi": "15:17", "Imsak": "04:43", "KibleSaati": "09:51", "Ogle": "12:36", "Yatsi": "20:01"}, {"HicriTarihKisa": "18.9.1447", "HicriTarihKisaIso8601": null, "HicriTarihUzun": "18 Ramazan 1447", "HicriTarihUzunIso8601": null, "AyinSekliURL": "https://namazvakti.diyanet.gov.tr/images/d5.gif", "MiladiTarihKisa": "08.03.2026", "MiladiTarihKisaIso8601": "08.03.2026", "MiladiTarihUzun": "08 Mart 2026 Pazar", "MiladiTarihUzunIso8601": "2026-03-08T00:00:00.0000000+01:00", "GreenwichOrtalamaZamani": 3.0, "Aksam": "18:10", "Gunes": "06:50", "GunesBatis": "18:03", "GunesDogus": "06:57", "Ikindi": "15:18", "Imsak": "04:40", "KibleSaati": "09:52", "Ogle": "12:35", "Yatsi": "20:04"}, {"HicriTarihKisa": "19.9.1447", "HicriTarihKisaIso8601": null, "HicriTarihUzun": "19 Ramazan 1447", "HicriTarihUzunIso8601": null, "AyinSekliURL": "https://namazvakti.diyanet.gov.tr/images/d6.gif", "MiladiTarihKisa": "09.03.2026", "MiladiTarihKisaIso8601": "09.03.2026", "MiladiTarihUzun": "09 Mart 2026 Pazartesi", "MiladiTarihUzunIso8601": "2026-03-09T00:00:00.0000000+01:00", "GreenwichOrtalamaZamani": 3.0, "Aksam": "18:13", "Gunes": "06:48", "GunesBatis": "18:06", "GunesDogus": "06:55", "Ikindi": "15:20", "Imsak": "04:37", "KibleSaati": "09:52", "Ogle": "12:35", "Yatsi": "20:06"}, {"HicriTarihKisa": "20.9.1447", "HicriTarihKisaIso8601": null, "HicriTarihUzun": "20 Ramazan 1447", "HicriTarihUzunIso8601": null, "AyinSekliURL": "https://namazvakti.diyanet.gov.tr/images/d7.gif", "MiladiTarihKisa": "10.03.2026", "MiladiTarihKisaIso8601": "10.03.2026", "MiladiTarihUzun": "10 Mart 2026 Salı", "MiladiTarihUzunIso8601": "2026-03-10T00:00:00.0000000+01:00", "GreenwichOrtalamaZamani": 3.0, "Aksam": "18:15", "Gunes": "06:45", "GunesBatis": "18:08", "GunesDogus": "06:52", "Ikindi": "15:22", "Imsak": "04:34", "KibleSaati": "09:52", "Ogle": "12:35", "Yatsi": "20:09"}, {"HicriTarihKisa": "21.9.1447", "HicriTarihKisaIso8601": null, "HicriTarihUzun": "21 Ramazan 1447", "HicriTarihUzunIso8601": null, "AyinSekliURL": "https://namazvakti.diyanet.gov.tr/images/sondordun.gif", "MiladiTarihKisa": "11.03.2026", "MiladiTarihKisaIso8601": "11.03.2026", "MiladiTarihUzun": "11 Mart 2026 Çarşamba", "MiladiTarihUzunIso8601": "2026-03-11T00:00:00.0000000+01:00", "GreenwichOrtalamaZamani": 3.0, "Aksam": "18:17", "Gunes": "06:42", "GunesBatis": "18:10", "GunesDogus": "06:49", "Ikindi": "15:23", "Imsak": "04:31", "KibleSaati": "09:52", "Ogle": "12:35", "Yatsi": "20:12"}]