[
  {
    "HicriTarihKisa": "21.8.1447",
    "HicriTarihKisaIso8601": null,
    "HicriTarihUzun": "21 Şaban 1447",
    "HicriTarihUzunIso8601": null,
    "AyinSekliURL": "https://namazvakti.diyanet.gov.tr/images/sondordun.gif",
    "MiladiTarihKisa": "09.02.2026",
    "MiladiTarihKisaIso8601": "09.02.2026",
    "MiladiTarihUzun": "09 Şubat 2026 Pazartesi",
    "MiladiTarihUzunIso8601": "2026-02-09T00:00:00.0000000+10:00",
    "GreenwichOrtalamaZamani": 3.0,
    "Aksam": "18:44",
    "Gunes": "06:09",
    "GunesBatis": "18:37",
    "GunesDogus": "06:16",
    "Ikindi": "15:46",
    "Imsak": "05:04",
    "KibleSaati": "16:25",
    "Ogle": "12:31",
    "Yatsi": "19:45"
  },
  {
    "HicriTarihKisa": "22.8.1447",
    "HicriTarihKisaIso8601": null,
    "HicriTarihUzun": "22 Şaban 1447",
    "HicriTarihUzunIso8601": null,
    "AyinSekliURL": "https://namazvakti.diyanet.gov.tr/images/sd1.gif",
    "MiladiTarihKisa": "10.02.2026",
    "MiladiTarihKisaIso8601": "10.02.2026",
    "MiladiTarihUzun": "10 Şubat 2026 Salı",
    "MiladiTarihUzunIso8601": "2026-02-10T00:00:00.0000000+10:00",
    "GreenwichOrtalamaZamani": 3.0,
    "Aksam": "18:44",
    "Gunes": "06:09",
    "GunesBatis": "18:37",
    "GunesDogus": "06:16",
    "Ikindi": "15:46",
    "Imsak": "05:04",
    "KibleSaati": "16:20",
    "Ogle": "12:31",
    "Yatsi": "19:44"
  },
  {
    "HicriTarihKisa": "23.8.1447",
    "HicriTarihKisaIso8601": null,
    "HicriTarihUzun": "23 Şaban 1447",
    "HicriTarihUzunIso8601": null,
    "AyinSekliURL": "https://namazvakti.diyanet.gov.tr/images/sd2.gif",
    "MiladiTarihKisa": "11.02.2026",
    "MiladiTarihKisaIso8601": "11.02.2026",
    "MiladiTarihUzun": "11 Şubat 2026 Çarşamba",
    "MiladiTarihUzunIso8601": "2026-02-11T00:00:00.0000000+10:00",
    "GreenwichOrtalamaZamani": 3.0,
    "Aksam": "18:44",
    "Gunes": "06:09",
    "GunesBatis": "18:37",
    "GunesDogus": "06:16",
    "Ikindi": "15:45",
    "Imsak": "05:04",
    "KibleSaati": "16:15",
    "Ogle": "12:31",
    "Yatsi": "19:44"
  },
  {
    "HicriTarihKisa": "24.8.1447",
    "HicriTarihKisaIso8601": null,
    "HicriTarihUzun": "24 Şaban 1447",
    "HicriTarihUzunIso8601": null,
    "AyinSekliURL": "https://namazvakti.diyanet.gov.tr/images/sd3.gif",
    "MiladiTarihKisa": "12.02.2026",
    "MiladiTarihKisaIso8601": "12.02.2026",
    "MiladiTarihUzun": "12 Şubat 2026 Perşembe",
    "MiladiTarihUzunIso8601": "2026-02-12T00:00:00.0000000+10:00",
    "GreenwichOrtalamaZamani": 3.0,
    "Aksam": "18:43",
    "Gunes": "06:09",
    "GunesBatis": "18:36",
    "GunesDogus": "06:16",
    "Ikindi": "15:45",
    "Imsak": "05:05",
    "KibleSaati": "16:11",
    "Ogle": "12:31",
    "Yatsi": "19:44"
  },
  {
    "HicriTarihKisa": "25.8.1447",
    "HicriTarihKisaIso8601": null,
    "HicriTarihUzun": "25 Şaban 1447",
    "HicriTarihUzunIso8601": null,
    "AyinSekliURL": "https://namazvakti.diyanet.gov.tr/images/sd4.gif",
    "MiladiTarihKisa": "13.02.2026",
    "MiladiTarihKisaIso8601": "13.02.2026",
    "MiladiTarihUzun": "13 Şubat 2026 Cuma",
    "MiladiTarihUzunIso8601": "2026-02-13T00:00:00.0000000+10:00",
    "GreenwichOrtalamaZamani": 3.0,
    "Aksam": "18:43",
    "Gunes": "06:09",
    "GunesBatis": "18:36",
    "GunesDogus": "06:16",
    "Ikindi": "15:44",
    "Imsak": "05:05",
    "KibleSaati": "16:06",
    "Ogle": "12:31",
    "Yatsi": "19:44"
  },
  {
    "HicriTarihKisa": "26.8.1447",
    "HicriTarihKisaIso8601": null,
    "HicriTarihUzun": "26 Şaban 1447",
    "HicriTarihUzunIso8601": null,
    "AyinSekliURL": "https://namazvakti.diyanet.gov.tr/images/sd5.gif",
    "MiladiTarihKisa": "14.02.2026",
    "MiladiTarihKisaIso8601": "14.02.2026",
    "MiladiTarihUzun": "14 Şubat 2026 Cumartesi",
    "MiladiTarihUzunIso8601": "2026-02-14T00:00:00.0000000+10:00",
    "GreenwichOrtalamaZamani": 3.0,
    "Aksam": "18:43",
    "Gunes": "06:09",
    "GunesBatis": "18:36",
    "GunesDogus": "06:16",
    "Ikindi": "15:44",
    "Imsak": "05:05",
    "KibleSaati": "16:01",
    "Ogle": "12:31",
    "Yatsi": "19:43"
  },
  {
    "HicriTarihKisa": "27.8.1447",
    "HicriTarihKisaIso8601": null,
    "HicriTarihUzun": "27 Şaban 1447",
    "HicriTarihUzunIso8601": null,
    "AyinSekliURL": "https://namazvakti.diyanet.gov.tr/images/sd6.gif",
    "MiladiTarihKisa": "15.02.2026",
    "MiladiTarihKisaIso8601": "15.02.2026",
    "MiladiTarihUzun": "15 Şubat 2026 Pazar",
    "MiladiTarihUzunIso8601": "2026-02-15T00:00:00.0000000+10:00",
    "GreenwichOrtalamaZamani": 3.0,
    "Aksam": "18:43",
    "Gunes": "06:10",
    "GunesBatis": "18:36",
    "GunesDogus": "06:17",
    "Ikindi": "15:43",
    "Imsak": "05:05",
    "KibleSaati": "15:57",
    "Ogle": "12:31",
    "Yatsi": "19:43"
  },
  {
    "HicriTarihKisa": "28.8.1447",
    "HicriTarihKisaIso8601": null,
    "HicriTarihUzun": "28 Şaban 1447",
    "HicriTarihUzunIso8601": null,
    "AyinSekliURL": "https://namazvakti.diyanet.gov.tr/images/sd7.gif",
    "MiladiTarihKisa": "16.02.2026",
    "MiladiTarihKisaIso8601": "16.02.2026",
    "MiladiTarihUzun": "16 Şubat 2026 Pazartesi",
    "MiladiTarihUzunIso8601": "2026-02-16T00:00:00.0000000+10:00",
    "GreenwichOrtalamaZamani": 3.0,
    "Aksam": "18:43",
    "Gunes": "06:10",
    "GunesBatis": "18:36",
    "GunesDogus": "06:17",
    "Ikindi": "15:43",
    "Imsak": "05:06",
    "KibleSaati": "15:52",
    "Ogle": "12:31",
    "Yatsi": "19:43"
  },
  {
    "HicriTarihKisa": "29.8.1447",
    "HicriTarihKisaIso8601": null,
    "HicriTarihUzun": "29 Şaban 1447",
    "HicriTarihUzunIso8601": null,
    "AyinSekliURL": "https://namazvakti.diyanet.gov.tr/images/ictima.gif",
    "MiladiTarihKisa": "17.02.2026",
    "MiladiTarihKisaIso8601": "17.02.2026",
    "MiladiTarihUzun": "17 Şubat 2026 Salı",
    "MiladiTarihUzunIso8601": "2026-02-17T00:00:00.0000000+10:00",
    "GreenwichOrtalamaZamani": 3.0,
    "Aksam": "18:42",
    "Gunes": "06:10",
    "GunesBatis": "18:35",
    "GunesDogus": "06:17",
    "Ikindi": "15:42",
    "Imsak": "05:06",
    "KibleSaati": "15:48",
    "Ogle": "12:31",
    "Yatsi": "19:42"
  },
  {
    "HicriTarihKisa": "30.8.1447",
    "HicriTarihKisaIso8601": null,
    "HicriTarihUzun": "30 Şaban 1447",
    "HicriTarihUzunIso8601": null,
    "AyinSekliURL": "https://namazvakti.diyanet.gov.tr/images/ruyet.gif",
    "MiladiTarihKisa": "18.02.2026",
    "MiladiTarihKisaIso8601": "18.02.2026",
    "MiladiTarihUzun": "18 Şubat 2026 Çarşamba",
    "MiladiTarihUzunIso8601": "2026-02-18T00:00:00.0000000+10:00",
    "GreenwichOrtalamaZamani": 3.0,
    "Aksam": "18:42",
    "Gunes": "06:10",
    "GunesBatis": "18:35",
    "GunesDogus": "06:17",
    "Ikindi": "15:41",
    "Imsak": "05:06",
    "KibleSaati": "15:43",
    "Ogle": "12:31",
    "Yatsi": "19:42"
  },
  {
    "HicriTarihKisa": "1.9.1447",
    "HicriTarihKisaIso8601": null,
    "HicriTarihUzun": "1 Ramazan 1447",
    "HicriTarihUzunIso8601": null,
    "AyinSekliURL": "https://namazvakti.diyanet.gov.tr/images/r1.gif",
    "MiladiTarihKisa": "19.02.2026",
    "MiladiTarihKisaIso8601": "19.02.2026",
    "MiladiTarihUzun": "19 Şubat 2026 Perşembe",
    "MiladiTarihUzunIso8601": "2026-02-19T00:00:00.0000000+10:00",
    "GreenwichOrtalamaZamani": 3.0,
    "Aksam": "18:42",
    "Gunes": "06:10",
    "GunesBatis": "18:35",
    "GunesDogus": "06:17",
    "Ikindi": "15:40",
    "Imsak": "05:06",
    "KibleSaati": "15:39",
    "Ogle": "12:31",
    "Yatsi": "19:42"
  },
  {
    "HicriTarihKisa": "2.9.1447",
    "HicriTarihKisaIso8601": null,
    "HicriTarihUzun": "2 Ramazan 1447",
    "HicriTarihUzunIso8601": null,
    "AyinSekliURL": "https://namazvakti.diyanet.gov.tr/images/r2.gif",
    "MiladiTarihKisa": "20.02.2026",
    "MiladiTarihKisaIso8601": "20.02.2026",
    "MiladiTarihUzun": "20 Şubat 2026 Cuma",
    "MiladiTarihUzunIso8601": "2026-02-20T00:00:00.0000000+10:00",
    "GreenwichOrtalamaZamani": 3.0,
    "Aksam": "18:41",
    "Gunes": "06:10",
    "GunesBatis": "18:34",
    "GunesDogus": "06:17",
    "Ikindi": "15:40",
    "Imsak": "05:06",
    "KibleSaati": "15:34",
    "Ogle": "12:31",
    "Yatsi": "19:41"
  },
  {
    "HicriTarihKisa": "3.9.1447",
    "HicriTarihKisaIso8601": null,
    "HicriTarihUzun": "3 Ramazan 1447",
    "HicriTarihUzunIso8601": null,
    "AyinSekliURL": "https://namazvakti.diyanet.gov.tr/images/r3.gif",
    "MiladiTarihKisa": "21.02.2026",
    "MiladiTarihKisaIso8601": "21.02.2026",
    "MiladiTarihUzun": "21 Şubat 2026 Cumartesi",
    "MiladiTarihUzunIso8601": "2026-02-21T00:00:00.0000000+10:00",
    "GreenwichOrtalamaZamani": 3.0,
    "Aksam": "18:41",
    "Gunes": "06:10",
    "GunesBatis": "18:34",
    "GunesDogus": "06:17",
    "Ikindi": "15:39",
    "Imsak": "05:07",
    "KibleSaati": "15:30",
    "Ogle": "12:31",
    "Yatsi": "19:41"
  },
  {
    "HicriTarihKisa": "4.9.1447",
    "HicriTarihKisaIso8601": null,
    "HicriTarihUzun": "4 Ramazan 1447",
    "HicriTarihUzunIso8601": null,
    "AyinSekliURL": "https://namazvakti.diyanet.gov.tr/images/r4.gif",
    "MiladiTarihKisa": "22.02.2026",
    "MiladiTarihKisaIso8601": "22.02.2026",
    "MiladiTarihUzun": "22 Şubat 2026 Pazar",
    "MiladiTarihUzunIso8601": "2026-02-22T00:00:00.0000000+10:00",
    "GreenwichOrtalamaZamani": 3.0,
    "Aksam": "18:41",
    "Gunes": "06:10",
    "GunesBatis": "18:34",
    "GunesDogus": "06:17",
    "Ikindi": "15:38",
    "Imsak": "05:07",
    "KibleSaati": "15:25",
    "Ogle": "12:31",
    "Yatsi": "19:40"
  },
  {
    "HicriTarihKisa": "5.9.1447",
    "HicriTarihKisaIso8601": null,
    "HicriTarihUzun": "5 Ramazan 1447",
    "HicriTarihUzunIso8601": null,
    "AyinSekliURL": "https://namazvakti.diyanet.gov.tr/images/r5.gif",
    "MiladiTarihKisa": "23.02.2026",
    "MiladiTarihKisaIso8601": "23.02.2026",
    "MiladiTarihUzun": "23 Şubat 2026 Pazartesi",
    "MiladiTarihUzunIso8601": "2026-02-23T00:00:00.0000000+10:00",
    "GreenwichOrtalamaZamani": 3.0,
    "Aksam": "18:41",
    "Gunes": "06:10",
    "GunesBatis": "18:34",
    "GunesDogus": "06:17",
    "Ikindi": "15:37",
    "Imsak": "05:07",
    "KibleSaati": "15:21",
    "Ogle": "12:30",
    "Yatsi": "19:40"
  },
  {
    "HicriTarihKisa": "6.9.1447",
    "HicriTarihKisaIso8601": null,
    "HicriTarihUzun": "6 Ramazan 1447",
    "HicriTarihUzunIso8601": null,
    "AyinSekliURL": "https://namazvakti.diyanet.gov.tr/images/ilkdordun.gif",
    "MiladiTarihKisa": "24.02.2026",
    "MiladiTarihKisaIso8601": "24.02.2026",
    "MiladiTarihUzun": "24 Şubat 2026 Salı",
    "MiladiTarihUzunIso8601": "2026-02-24T00:00:00.0000000+10:00",
    "GreenwichOrtalamaZamani": 3.0,
    "Aksam": "18:40",
    "Gunes": "06:10",
    "GunesBatis": "18:33",
    "GunesDogus": "06:17",
    "Ikindi": "15:36",
    "Imsak": "05:07",
    "KibleSaati": "15:17",
    "Ogle": "12:30",
    "Yatsi": "19:40"
  },
  {
    "HicriTarihKisa": "7.9.1447",
    "HicriTarihKisaIso8601": null,
    "HicriTarihUzun": "7 Ramazan 1447",
    "HicriTarihUzunIso8601": null,
    "AyinSekliURL": "https://namazvakti.diyanet.gov.tr/images/i1.gif",
    "MiladiTarihKisa": "25.02.2026",
    "MiladiTarihKisaIso8601": "25.02.2026",
    "MiladiTarihUzun": "25 Şubat 2026 Çarşamba",
    "MiladiTarihUzunIso8601": "2026-02-25T00:00:00.0000000+10:00",
    "GreenwichOrtalamaZamani": 3.0,
    "Aksam": "18:40",
    "Gunes": "06:10",
    "GunesBatis": "18:33",
    "GunesDogus": "06:17",
    "Ikindi": "15:36",
    "Imsak": "05:07",
    "KibleSaati": "15:12",
    "Ogle": "12:30",
    "Yatsi": "19:39"
  },
  {
    "HicriTarihKisa": "8.9.1447",
    "HicriTarihKisaIso8601": null,
    "HicriTarihUzun": "8 Ramazan 1447",
    "HicriTarihUzunIso8601": null,
    "AyinSekliURL": "https://namazvakti.diyanet.gov.tr/images/i2.gif",
    "MiladiTarihKisa": "26.02.2026",
    "MiladiTarihKisaIso8601": "26.02.2026",
    "MiladiTarihUzun": "26 Şubat 2026 Perşembe",
    "MiladiTarihUzunIso8601": "2026-02-26T00:00:00.0000000+10:00",
    "GreenwichOrtalamaZamani": 3.0,
    "Aksam": "18:40",
    "Gunes": "06:10",
    "GunesBatis": "18:33",
    "GunesDogus": "06:17",
    "Ikindi": "15:35",
    "Imsak": "05:07",
    "KibleSaati": "15:08",
    "Ogle": "12:30",
    "Yatsi": "19:39"
  },
  {
    "HicriTarihKisa": "9.9.1447",
    "HicriTarihKisaIso8601": null,
    "HicriTarihUzun": "9 Ramazan 1447",
    "HicriTarihUzunIso8601": null,
    "AyinSekliURL": "https://namazvakti.diyanet.gov.tr/images/i3.gif",
    "MiladiTarihKisa": "27.02.2026",
    "MiladiTarihKisaIso8601": "27.02.2026",
    "MiladiTarihUzun": "27 Şubat 2026 Cuma",
    "MiladiTarihUzunIso8601": "2026-02-27T00:00:00.0000000+10:00",
    "GreenwichOrtalamaZamani": 3.0,
    "Aksam": "18:39",
    "Gunes": "06:10",
    "GunesBatis": "18:32",
    "GunesDogus": "06:17",
    "Ikindi": "15:34",
    "Imsak": "05:07",
    "KibleSaati": "15:03",
    "Ogle": "12:30",
    "Yatsi": "19:38"
  },
  {
    "HicriTarihKisa": "10.9.1447",
    "HicriTarihKisaIso8601": null,
    "HicriTarihUzun": "10 Ramazan 1447",
    "HicriTarihUzunIso8601": null,
    "AyinSekliURL": "https://namazvakti.diyanet.gov.tr/images/i4.gif",
    "MiladiTarihKisa": "28.02.2026",
    "MiladiTarihKisaIso8601": "28.02.2026",
    "MiladiTarihUzun": "28 Şubat 2026 Cumartesi",
    "MiladiTarihUzunIso8601": "2026-02-28T00:00:00.0000000+10:00",
    "GreenwichOrtalamaZamani": 3.0,
    "Aksam": "18:39",
    "Gunes": "06:10",
    "GunesBatis": "18:32",
    "GunesDogus": "06:17",
    "Ikindi": "15:33",
    "Imsak": "05:07",
    "KibleSaati": "14:59",
    "Ogle": "12:30",
    "Yatsi": "19:38"
  },
  {
    "HicriTarihKisa": "11.9.1447",
    "HicriTarihKisaIso8601": null,
    "HicriTarihUzun": "11 Ramazan 1447",
    "HicriTarihUzunIso8601": null,
    "AyinSekliURL": "https://namazvakti.diyanet.gov.tr/images/i5.gif",
    "MiladiTarihKisa": "01.03.2026",
    "MiladiTarihKisaIso8601": "01.03.2026",
    "MiladiTarihUzun": "01 Mart 2026 Pazar",
    "MiladiTarihUzunIso8601": "2026-03-01T00:00:00.0000000+10:00",
    "GreenwichOrtalamaZamani": 3.0,
    "Aksam": "18:38",
    "Gunes": "06:10",
    "GunesBatis": "18:31",
    "GunesDogus": "06:17",
    "Ikindi": "15:32",
    "Imsak": "05:07",
    "KibleSaati": "14:55",
    "Ogle": "12:29",
    "Yatsi": "19:37"
  },
  {
    "HicriTarihKisa": "12.9.1447",
    "HicriTarihKisaIso8601": null,
    "HicriTarihUzun": "12 Ramazan 1447",
    "HicriTarihUzunIso8601": null,
    "AyinSekliURL": "https://namazvakti.diyanet.gov.tr/images/i6.gif",
    "MiladiTarihKisa": "02.03.2026",
    "MiladiTarihKisaIso8601": "02.03.2026",
    "MiladiTarihUzun": "02 Mart 2026 Pazartesi",
    "MiladiTarihUzunIso8601": "2026-03-02T00:00:00.0000000+10:00",
    "GreenwichOrtalamaZamani": 3.0,
    "Aksam": "18:38",
    "Gunes": "06:10",
    "GunesBatis": "18:31",
    "GunesDogus": "06:17",
    "Ikindi": "15:31",
    "Imsak": "05:08",
    "KibleSaati": "14:50",
    "Ogle": "12:29",
    "Yatsi": "19:37"
  },
  {
    "HicriTarihKisa": "13.9.1447",
    "HicriTarihKisaIso8601": null,
    "HicriTarihUzun": "13 Ramazan 1447",
    "HicriTarihUzunIso8601": null,
    "AyinSekliURL": "https://namazvakti.diyanet.gov.tr/images/dolunay.gif",
    "MiladiTarihKisa": "03.03.2026",
    "MiladiTarihKisaIso8601": "03.03.2026",
    "MiladiTarihUzun": "03 Mart 2026 Salı",
    "MiladiTarihUzunIso8601": "2026-03-03T00:00:00.0000000+10:00",
    "GreenwichOrtalamaZamani": 3.0,
    "Aksam": "18:38",
    "Gunes": "06:10",
    "GunesBatis": "18:31",
    "GunesDogus": "06:17",
    "Ikindi": "15:30",
    "Imsak": "05:08",
    "KibleSaati": "14:46",
    "Ogle": "12:29",
    "Yatsi": "19:36"
  },
  {
    "HicriTarihKisa": "14.9.1447",
    "HicriTarihKisaIso8601": null,
    "HicriTarihUzun": "14 Ramazan 1447",
    "HicriTarihUzunIso8601": null,
    "AyinSekliURL": "https://namazvakti.diyanet.gov.tr/images/d1.gif",
    "MiladiTarihKisa": "04.03.2026",
    "MiladiTarihKisaIso8601": "04.03.2026",
    "MiladiTarihUzun": "04 Mart 2026 Çarşamba",
    "MiladiTarihUzunIso8601": "2026-03-04T00:00:00.0000000+10:00",
    "GreenwichOrtalamaZamani": 3.0,
    "Aksam": "18:37",
    "Gunes": "06:10",
    "GunesBatis": "18:30",
    "GunesDogus": "06:17",
    "Ikindi": "15:30",
    "Imsak": "05:08",
    "KibleSaati": "14:41",
    "Ogle": "12:29",
    "Yatsi": "19:36"
  },
  {
    "HicriTarihKisa": "15.9.1447",
    "HicriTarihKisaIso8601": null,
    "HicriTarihUzun": "15 Ramazan 1447",
    "HicriTarihUzunIso8601": null,
    "AyinSekliURL": "https://namazvakti.diyanet.gov.tr/images/d2.gif",
    "MiladiTarihKisa": "05.03.2026",
    "MiladiTarihKisaIso8601": "05.03.2026",
    "MiladiTarihUzun": "05 Mart 2026 Perşembe",
    "MiladiTarihUzunIso8601": "2026-03-05T00:00:00.0000000+10:00",
    "GreenwichOrtalamaZamani": 3.0,
    "Aksam": "18:37",
    "Gunes": "06:10",
    "GunesBatis": "18:30",
    "GunesDogus": "06:17",
    "Ikindi": "15:30",
    "Imsak": "05:08",
    "KibleSaati": "14:37",
    "Ogle": "12:29",
    "Yatsi": "19:36"
  },
  {
    "HicriTarihKisa": "16.9.1447",
    "HicriTarihKisaIso8601": null,
    "HicriTarihUzun": "16 Ramazan 1447",
    "HicriTarihUzunIso8601": null,
    "AyinSekliURL": "https://namazvakti.diyanet.gov.tr/images/d3.gif",
    "MiladiTarihKisa": "06.03.2026",
    "MiladiTarihKisaIso8601": "06.03.2026",
    "MiladiTarihUzun": "06 Mart 2026 Cuma",
    "MiladiTarihUzunIso8601": "2026-03-06T00:00:00.0000000+10:00",
    "GreenwichOrtalamaZamani": 3.0,
    "Aksam": "18:37",
    "Gunes": "06:10",
    "GunesBatis": "18:30",
    "GunesDogus": "06:17",
    "Ikindi": "15:30",
    "Imsak": "05:08",
    "KibleSaati": "14:33",
    "Ogle": "12:28",
    "Yatsi": "19:35"
  },
  {
    "HicriTarihKisa": "17.9.1447",
    "HicriTarihKisaIso8601": null,
    "HicriTarihUzun": "17 Ramazan 1447",
    "HicriTarihUzunIso8601": null,
    "AyinSekliURL": "https://namazvakti.diyanet.gov.tr/images/d4.gif",
    "MiladiTarihKisa": "07.03.2026",
    "MiladiTarihKisaIso8601": "07.03.2026",
    "MiladiTarihUzun": "07 Mart 2026 Cumartesi",
    "MiladiTarihUzunIso8601": "2026-03-07T00:00:00.0000000+10:00",
    "GreenwichOrtalamaZamani": 3.0,
    "Aksam": "18:36",
    "Gunes": "06:10",
    "GunesBatis": "18:29",
    "GunesDogus": "06:17",
    "Ikindi": "15:31",
    "Imsak": "05:08",
    "KibleSaati": "14:28",
    "Ogle": "12:28",
    "Yatsi": "19:35"
  },
  {
    "HicriTarihKisa": "18.9.1447",
    "HicriTarihKisaIso8601": null,
    "HicriTarihUzun": "18 Ramazan 1447",
    "HicriTarihUzunIso8601": null,
    "AyinSekliURL": "https://namazvakti.diyanet.gov.tr/images/d5.gif",
    "MiladiTarihKisa": "08.03.2026",
    "MiladiTarihKisaIso8601": "08.03.2026",
    "MiladiTarihUzun": "08 Mart 2026 Pazar",
    "MiladiTarihUzunIso8601": "2026-03-08T00:00:00.0000000+10:00",
    "GreenwichOrtalamaZamani": 3.0,
    "Aksam": "18:36",
    "Gunes": "06:10",
    "GunesBatis": "18:29",
    "GunesDogus": "06:17",
    "Ikindi": "15:31",
    "Imsak": "05:08",
    "KibleSaati": "14:24",
    "Ogle": "12:28",
    "Yatsi": "19:34"
  },
  {
    "HicriTarihKisa": "19.9.1447",
    "HicriTarihKisaIso8601": null,
    "HicriTarihUzun": "19 Ramazan 1447",
    "HicriTarihUzunIso8601": null,
    "AyinSekliURL": "https://namazvakti.diyanet.gov.tr/images/d6.gif",
    "MiladiTarihKisa": "09.03.2026",
    "MiladiTarihKisaIso8601": "09.03.2026",
    "MiladiTarihUzun": "09 Mart 2026 Pazartesi",
    "MiladiTarihUzunIso8601": "2026-03-09T00:00:00.0000000+10:00",
    "GreenwichOrtalamaZamani": 3.0,
    "Aksam": "18:35",
    "Gunes": "06:10",
    "GunesBatis": "18:28",
    "GunesDogus": "06:17",
    "Ikindi": "15:32",
    "Imsak": "05:08",
    "KibleSaati": "14:20",
    "Ogle": "12:28",
    "Yatsi": "19:34"
  },
  {
    "HicriTarihKisa": "20.9.1447",
    "HicriTarihKisaIso8601": null,
    "HicriTarihUzun": "20 Ramazan 1447",
    "HicriTarihUzunIso8601": null,
    "AyinSekliURL": "https://namazvakti.diyanet.gov.tr/images/d7.gif",
    "MiladiTarihKisa": "10.03.2026",
    "MiladiTarihKisaIso8601": "10.03.2026",
    "MiladiTarihUzun": "10 Mart 2026 Salı",
    "MiladiTarihUzunIso8601": "2026-03-10T00:00:00.0000000+10:00",
    "GreenwichOrtalamaZamani": 3.0,
    "Aksam": "18:35",
    "Gunes": "06:10",
    "GunesBatis": "18:28",
    "GunesDogus": "06:17",
    "Ikindi": "15:32",
    "Imsak": "05:08",
    "KibleSaati": "14:15",
    "Ogle": "12:27",
    "Yatsi": "19:33"
  },
  {
    "HicriTarihKisa": "21.9.1447",
    "HicriTarihKisaIso8601": null,
    "HicriTarihUzun": "21 Ramazan 1447",
    "HicriTarihUzunIso8601": null,
    "AyinSekliURL": "https://namazvakti.diyanet.gov.tr/images/sondordun.gif",
    "MiladiTarihKisa": "11.03.2026",
    "MiladiTarihKisaIso8601": "11.03.2026",
    "MiladiTarihUzun": "11 Mart 2026 Çarşamba",
    "MiladiTarihUzunIso8601": "2026-03-11T00:00:00.0000000+10:00",
    "GreenwichOrtalamaZamani": 3.0,
    "Aksam": "18:34",
    "Gunes": "06:10",
    "GunesBatis": "18:27",
    "GunesDogus": "06:17",
    "Ikindi": "15:32",
    "Imsak": "05:08",
    "KibleSaati": "14:11",
    "Ogle": "12:27",
    "Yatsi": "19:33"
  },
  {
    "HicriTarihKisa": "22.9.1447",
    "HicriTarihKisaIso8601": null,
    "HicriTarihUzun": "22 Ramazan 1447",
    "HicriTarihUzunIso8601": null,
    "AyinSekliURL": "https://namazvakti.diyanet.gov.tr/images/sd1.gif",
    "MiladiTarihKisa": "12.03.2026",
    "MiladiTarihKisaIso8601": "12.03.2026",
    "MiladiTarihUzun": "12 Mart 2026 Perşembe",
    "MiladiTarihUzunIso8601": "2026-03-12T00:00:00.0000000+10:00",
    "GreenwichOrtalamaZamani": 3.0,
    "Aksam": "18:34",
    "Gunes": "06:10",
    "GunesBatis": "18:27",
    "GunesDogus": "06:17",
    "Ikindi": "15:33",
    "Imsak": "05:08",
    "KibleSaati": "14:07",
    "Ogle": "12:27",
    "Yatsi": "19:32"
  }
]