[{"HicriTarihKisa": "18.8.1447", "HicriTarihKisaIso8601": null, "HicriTarihUzun": "18 Şaban 1447", "HicriTarihUzunIso8601": null, "AyinSekliURL": "https://namazvakti.diyanet.gov.tr/images/d4.gif", "MiladiTarihKisa": "06.02.2026", "MiladiTarihKisaIso8601": "06.02.2026", "MiladiTarihUzun": "06 Şubat 2026 Cuma", "MiladiTarihUzunIso8601": "2026-02-06T00:00:00.0000000+01:00", "GreenwichOrtalamaZamani": 3.0, "Aksam": "16:41", "Gunes": "07:18", "GunesBatis": "16:34", "GunesDogus": "07:25", "Ikindi": "14:10", "Imsak": "05:23", "KibleSaati": "09:41", "Ogle": "12:04", "Yatsi": "18:22"}, {"HicriTarihKisa": "19.8.1447", "HicriTarihKisaIso8601": null, "HicriTarihUzun": "19 Şaban 1447", "HicriTarihUzunIso8601": null, "AyinSekliURL": "https://namazvakti.diyanet.gov.tr/images/d5.gif", "MiladiTarihKisa": "07.02.2026", "MiladiTarihKisaIso8601": "07.02.2026", "MiladiTarihUzun": "07 Şubat 2026 Cumartesi", "MiladiTarihUzunIso8601": "2026-02-07T00:00:00.0000000+01:00", "GreenwichOrtalamaZamani": 3.0, "Aksam": "16:43", "Gunes": "07:16", "GunesBatis": "16:36", "GunesDogus": "07:23", "Ikindi": "14:12", "Imsak": "05:21", "KibleSaati": "09:41", "Ogle": "12:05", "Yatsi": "18:24"}, {"HicriTarihKisa": "20.8.1447", "HicriTarihKisaIso8601": null, "HicriTarihUzun": "20 Şaban 1447", "HicriTarihUzunIso8601": null, "AyinSekliURL": "https://namazvakti.diyanet.gov.tr/images/d6.gif", "MiladiTarihKisa": "08.02.2026", "MiladiTarihKisaIso8601": "08.02.2026", "MiladiTarihUzun": "08 Şubat 2026 Pazar", "MiladiTarihUzunIso8601": "2026-02-08T00:00:00.0000000+01:00", "GreenwichOrtalamaZamani": 3.0, "Aksam": "16:45", "Gunes": "07:14", "GunesBatis": "16:38", "GunesDogus": "07:21", "Ikindi": "14:14", "Imsak": "05:20", "KibleSaati": "09:42", "Ogle": "12:05", "Yatsi": "18:26"}, {"HicriTarihKisa": "21.8.1447", "HicriTarihKisaIso8601": null, "HicriTarihUzun": "21 Şaban 1447", "HicriTarihUzunIso8601": null, "AyinSekliURL": "https://namazvakti.diyanet.gov.tr/images/sondordun.gif", "MiladiTarihKisa": "09.02.2026", "MiladiTarihKisaIso8601": "09.02.2026", "MiladiTarihUzun": "09 Şubat 2026 Pazartesi", "MiladiTarihUzunIso8601": "2026-02-09T00:00:00.0000000+01:00", "GreenwichOrtalamaZamani": 3.0, "Aksam": "16:47", "Gunes": "07:12", "GunesBatis": "16:40", "GunesDogus": "07:19", "Ikindi": "14:15", "Imsak": "05:18", "KibleSaati": "09:42", "Ogle": "12:05", "Yatsi": "18:28"}, {"HicriTarihKisa": "22.8.1447", "HicriTarihKisaIso8601": null, "HicriTarihUzun": "22 Şaban 1447", "HicriTarihUzunIso8601": null, "AyinSekliURL": "https://namazvakti.diyanet.gov.tr/images/sd1.gif", "MiladiTarihKisa": "10.02.2026", "MiladiTarihKisaIso8601": "10.02.2026", "MiladiTarihUzun": "10 Şubat 2026 Salı", "MiladiTarihUzunIso8601": "2026-02-10T00:00:00.0000000+01:00", "GreenwichOrtalamaZamani": 3.0, "Aksam": "16:49", "Gunes": "07:10", "GunesBatis": "16:42", "GunesDogus": "07:17", "Ikindi": "14:17", "Imsak": "05:16", "KibleSaati": "09:43", "Ogle": "12:05", "Yatsi": "18:30"}, {"HicriTarihKisa": "23.8.1447", "HicriTarihKisaIso8601": null, "HicriTarihUzun": "23 Şaban 1447", "HicriTarihUzunIso8601": null, "AyinSekliURL": "https://namazvakti.diyanet.gov.tr/images/sd2.gif", "MiladiTarihKisa": "11.02.2026", "MiladiTarihKisaIso8601": "11.02.2026", "MiladiTarihUzun": "11 Şubat 2026 Çarşamba", "MiladiTarihUzunIso8601": "2026-02-11T00:00:00.0000000+01:00", "GreenwichOrtalamaZamani": 3.0, "Aksam": "16:51", "Gunes": "07:08", "GunesBatis": "16:44", "GunesDogus": "07:15", "Ikindi": "14:18", "Imsak": "05:14", "KibleSaati": "09:43", "Ogle": "12:05", "Yatsi": "18:31"}, {"HicriTarihKisa": "24.8.1447", "HicriTarihKisaIso8601": null, "HicriTarihUzun": "24 Şaban 1447", "HicriTarihUzunIso8601": null, "AyinSekliURL": "https://namazvakti.diyanet.gov.tr/images/sd3.gif", "MiladiTarihKisa": "12.02.2026", "MiladiTarihKisaIso8601": "12.02.2026", "MiladiTarihUzun": "12 Şubat 2026 Perşembe", "MiladiTarihUzunIso8601": "2026-02-12T00:00:00.0000000+01:00", "GreenwichOrtalamaZamani": 3.0, "Aksam": "16:53", "Gunes": "07:06", "GunesBatis": "16:46", "GunesDogus": "07:13", "Ikindi": "14:20", "Imsak": "05:12", "KibleSaati": "09:44", "Ogle": "12:05", "Yatsi": "18:33"}, {"HicriTarihKisa": "25.8.1447", "HicriTarihKisaIso8601": null, "HicriTarihUzun": "25 Şaban 1447", "HicriTarihUzunIso8601": null, "AyinSekliURL": "https://namazvakti.diyanet.gov.tr/images/sd4.gif", "MiladiTarihKisa": "13.02.2026", "MiladiTarihKisaIso8601": "13.02.2026", "MiladiTarihUzun": "13 Şubat 2026 Cuma", "MiladiTarihUzunIso8601": "2026-02-13T00:00:00.0000000+01:00", "GreenwichOrtalamaZamani": 3.0, "Aksam": "16:55", "Gunes": "07:04", "GunesBatis": "16:48", "GunesDogus": "07:11", "Ikindi": "14:22", "Imsak": "05:11", "KibleSaati": "09:44", "Ogle": "12:05", "Yatsi": "18:35"}, {"HicriTarihKisa": "26.8.1447", "HicriTarihKisaIso8601": null, "HicriTarihUzun": "26 Şaban 1447", "HicriTarihUzunIso8601": null, "AyinSekliURL": "https://namazvakti.diyanet.gov.tr/images/sd5.gif", "MiladiTarihKisa": "14.02.2026", "MiladiTarihKisaIso8601": "14.02.2026", "MiladiTarihUzun": "14 Şubat 2026 Cumartesi", "MiladiTarihUzunIso8601": "2026-02-14T00:00:00.0000000+01:00", "GreenwichOrtalamaZamani": 3.0, "Aksam": "16:57", "Gunes": "07:02", "GunesBatis": "16:50", "GunesDogus": "07:09", "Ikindi": "14:23", "Imsak": "05:09", "KibleSaati": "09:45", "Ogle": "12:05", "Yatsi": "18:37"}, {"HicriTarihKisa": "27.8.1447", "HicriTarihKisaIso8601": null, "HicriTarihUzun": "27 Şaban 1447", "HicriTarihUzunIso8601": null, "AyinSekliURL": "https://namazvakti.diyanet.gov.tr/images/sd6.gif", "MiladiTarihKisa": "15.02.2026", "MiladiTarihKisaIso8601": "15.02.2026", "MiladiTarihUzun": "15 Şubat 2026 Pazar", "MiladiTarihUzunIso8601": "2026-02-15T00:00:00.0000000+01:00", "GreenwichOrtalamaZamani": 3.0, "Aksam": "16:59", "Gunes": "07:00", "GunesBatis": "16:52", "GunesDogus": "07:07", "Ikindi": "14:25", "Imsak": "05:07", "KibleSaati": "09:45", "Ogle": "12:05", "Yatsi": "18:39"}, {"HicriTarihKisa": "28.8.1447", "HicriTarihKisaIso8601": null, "HicriTarihUzun": "28 Şaban 1447", "HicriTarihUzunIso8601": null, "AyinSekliURL": "https://namazvakti.diyanet.gov.tr/images/sd7.gif", "MiladiTarihKisa": "16.02.2026", "MiladiTarihKisaIso8601": "16.02.2026", "MiladiTarihUzun": "16 Şubat 2026 Pazartesi", "MiladiTarihUzunIso8601": "2026-02-16T00:00:00.0000000+01:00", "GreenwichOrtalamaZamani": 3.0, "Aksam": "17:01", "Gunes": "06:58", "GunesBatis": "16:54", "GunesDogus": "07:05", "Ikindi": "14:26", "Imsak": "05:05", "KibleSaati": "09:46", "Ogle": "12:05", "Yatsi": "18:40"}, {"HicriTarihKisa": "29.8.1447", "HicriTarihKisaIso8601": null, "HicriTarihUzun": "29 Şaban 1447", "HicriTarihUzunIso8601": null, "AyinSekliURL": "https://namazvakti.diyanet.gov.tr/images/ictima.gif", "MiladiTarihKisa": "17.02.2026", "MiladiTarihKisaIso8601": "17.02.2026", "MiladiTarihUzun": "17 Şubat 2026 Salı", "MiladiTarihUzunIso8601": "2026-02-17T00:00:00.0000000+01:00", "GreenwichOrtalamaZamani": 3.0, "Aksam": "17:03", "Gunes": "06:56", "GunesBatis": "16:56", "GunesDogus": "07:03", "Ikindi": "14:28", "Imsak": "05:03", "KibleSaati": "09:46", "Ogle": "12:04", "Yatsi": "18:42"}, {"HicriTarihKisa": "30.8.1447", "HicriTarihKisaIso8601": null, "HicriTarihUzun": "30 Şaban 1447", "HicriTarihUzunIso8601": null, "AyinSekliURL": "https://namazvakti.diyanet.gov.tr/images/ruyet.gif", "MiladiTarihKisa": "18.02.2026", "MiladiTarihKisaIso8601": "18.02.2026", "MiladiTarihUzun": "18 Şubat 2026 Çarşamba", "MiladiTarihUzunIso8601": "2026-02-18T00:00:00.0000000+01:00", "GreenwichOrtalamaZamani": 3.0, "Aksam": "17:05", "Gunes": "06:53", "GunesBatis": "16:58", "GunesDogus": "07:00", "Ikindi": "14:29", "Imsak": "05:01", "KibleSaati": "09:47", "Ogle": "12:04", "Yatsi": "18:44"}, {"HicriTarihKisa": "1.9.1447", "HicriTarihKisaIso8601": null, "HicriTarihUzun": "1 Ramazan 1447", "HicriTarihUzunIso8601": null, "AyinSekliURL": "https://namazvakti.diyanet.gov.tr/images/r1.gif", "MiladiTarihKisa": "19.02.2026", "MiladiTarihKisaIso8601": "19.02.2026", "MiladiTarihUzun": "19 Şubat 2026 Perşembe", "MiladiTarihUzunIso8601": "2026-02-19T00:00:00.0000000+01:00", "GreenwichOrtalamaZamani": 3.0, "Aksam": "17:07", "Gunes": "06:51", "GunesBatis": "17:00", "GunesDogus": "06:58", "Ikindi": "14:31", "Imsak": "04:59", "KibleSaati": "09:47", "Ogle": "12:04", "Yatsi": "18:46"}, {"HicriTarihKisa": "2.9.1447", "HicriTarihKisaIso8601": null, "HicriTarihUzun": "2 Ramazan 1447", "HicriTarihUzunIso8601": null, "AyinSekliURL": "https://namazvakti.diyanet.gov.tr/images/r2.gif", "MiladiTarihKisa": "20.02.2026", "MiladiTarihKisaIso8601": "20.02.2026", "MiladiTarihUzun": "20 Şubat 2026 Cuma", "MiladiTarihUzunIso8601": "2026-02-20T00:00:00.0000000+01:00", "GreenwichOrtalamaZamani": 3.0, "Aksam": "17:09", "Gunes": "06:49", "GunesBatis": "17:02", "GunesDogus": "06:56", "Ikindi": "14:32", "Imsak": "04:57", "KibleSaati": "09:48", "Ogle": "12:04", "Yatsi": "18:48"}, {"HicriTarihKisa": "3.9.1447", "HicriTarihKisaIso8601": null, "HicriTarihUzun": "3 Ramazan 1447", "HicriTarihUzunIso8601": null, "AyinSekliURL": "https://namazvakti.diyanet.gov.tr/images/r3.gif", "MiladiTarihKisa": "21.02.2026", "MiladiTarihKisaIso8601": "21.02.2026", "MiladiTarihUzun": "21 Şubat 2026 Cumartesi", "MiladiTarihUzunIso8601": "2026-02-21T00:00:00.0000000+01:00", "GreenwichOrtalamaZamani": 3.0, "Aksam": "17:11", "Gunes": "06:47", "GunesBatis": "17:04", "GunesDogus": "06:54", "Ikindi": "14:34", "Imsak": "04:55", "KibleSaati": "09:48", "Ogle": "12:04", "Yatsi": "18:50"}, {"HicriTarihKisa": "4.9.1447", "HicriTarihKisaIso8601": null, "HicriTarihUzun": "4 Ramazan 1447", "HicriTarihUzunIso8601": null, "AyinSekliURL": "https://namazvakti.diyanet.gov.tr/images/r4.gif", "MiladiTarihKisa": "22.02.2026", "MiladiTarihKisaIso8601": "22.02.2026", "MiladiTarihUzun": "22 Şubat 2026 Pazar", "MiladiTarihUzunIso8601": "2026-02-22T00:00:00.0000000+01:00", "GreenwichOrtalamaZamani": 3.0, "Aksam": "17:13", "Gunes": "06:45", "GunesBatis": "17:06", "GunesDogus": "06:52", "Ikindi": "14:35", "Imsak": "04:52", "KibleSaati": "09:48", "Ogle": "12:04", "Yatsi": "18:52"}, {"HicriTarihKisa": "5.9.1447", "HicriTarihKisaIso8601": null, "HicriTarihUzun": "5 Ramazan 1447", "HicriTarihUzunIso8601": null, "AyinSekliURL": "https://namazvakti.diyanet.gov.tr/images/r5.gif", "MiladiTarihKisa": "23.02.2026", "MiladiTarihKisaIso8601": "23.02.2026", "MiladiTarihUzun": "23 Şubat 2026 Pazartesi", "MiladiTarihUzunIso8601": "2026-02-23T00:00:00.0000000+01:00", "GreenwichOrtalamaZamani": 3.0, "Aksam": "17:15", "Gunes": "06:42", "GunesBatis": "17:08", "GunesDogus": "06:49", "Ikindi": "14:37", "Imsak": "04:50", "KibleSaati": "09:49", "Ogle": "12:04", "Yatsi": "18:54"}, {"HicriTarihKisa": "6.9.1447", "HicriTarihKisaIso8601": null, "HicriTarihUzun": "6 Ramazan 1447", "HicriTarihUzunIso8601": null, "AyinSekliURL": "https://namazvakti.diyanet.gov.tr/images/ilkdordun.gif", "MiladiTarihKisa": "24.02.2026", "MiladiTarihKisaIso8601": "24.02.2026", "MiladiTarihUzun": "24 Şubat 2026 Salı", "MiladiTarihUzunIso8601": "2026-02-24T00:00:00.0000000+01:00", "GreenwichOrtalamaZamani": 3.0, "Aksam": "17:17", "Gunes": "06:40", "GunesBatis": "17:10", "GunesDogus": "06:47", "Ikindi": "14:38", "Imsak": "04:48", "KibleSaati": "09:49", "Ogle": "12:04", "Yatsi": "18:56"}, {"HicriTarihKisa": "7.9.1447", "HicriTarihKisaIso8601": null, "HicriTarihUzun": "7 Ramazan 1447", "HicriTarihUzunIso8601": null, "AyinSekliURL": "https://namazvakti.diyanet.gov.tr/images/i1.gif", "MiladiTarihKisa": "25.02.2026", "MiladiTarihKisaIso8601": "25.02.2026", "MiladiTarihUzun": "25 Şubat 2026 Çarşamba", "MiladiTarihUzunIso8601": "2026-02-25T00:00:00.0000000+01:00", "GreenwichOrtalamaZamani": 3.0, "Aksam": "17:19", "Gunes": "06:38", "GunesBatis": "17:12", "GunesDogus": "06:45", "Ikindi": "14:40", "Imsak": "04:46", "KibleSaati": "09:50", "Ogle": "12:04", "Yatsi": "18:57"}, {"HicriTarihKisa": "8.9.1447", "HicriTarihKisaIso8601": null, "HicriTarihUzun": "8 Ramazan 1447", "HicriTarihUzunIso8601": null, "AyinSekliURL": "https://namazvakti.diyanet.gov.tr/images/i2.gif", "MiladiTarihKisa": "26.02.2026", "MiladiTarihKisaIso8601": "26.02.2026", "MiladiTarihUzun": "26 Şubat 2026 Perşembe", "MiladiTarihUzunIso8601": "2026-02-26T00:00:00.0000000+01:00", "GreenwichOrtalamaZamani": 3.0, "Aksam": "17:21", "Gunes": "06:35", "GunesBatis": "17:14", "GunesDogus": "06:42", "Ikindi": "14:41", "Imsak": "04:44", "KibleSaati": "09:50", "Ogle": "12:03", "Yatsi": "18:59"}, {"HicriTarihKisa": "9.9.1447", "HicriTarihKisaIso8601": null, "HicriTarihUzun": "9 Ramazan 1447", "HicriTarihUzunIso8601": null, "AyinSekliURL": "https://namazvakti.diyanet.gov.tr/images/i3.gif", "MiladiTarihKisa": "27.02.2026", "MiladiTarihKisaIso8601": "27.02.2026", "MiladiTarihUzun": "27 Şubat 2026 Cuma", "MiladiTarihUzunIso8601": "2026-02-27T00:00:00.0000000+01:00", "GreenwichOrtalamaZamani": 3.0, "Aksam": "17:23", "Gunes": "06:33", "GunesBatis": "17:16", "GunesDogus": "06:40", "Ikindi": "14:43", "Imsak": "04:41", "KibleSaati": "09:50", "Ogle": "12:03", "Yatsi": "19:01"}, {"HicriTarihKisa": "10.9.1447", "HicriTarihKisaIso8601": null, "HicriTarihUzun": "10 Ramazan 1447", "HicriTarihUzunIso8601": null, "AyinSekliURL": "https://namazvakti.diyanet.gov.tr/images/i4.gif", "MiladiTarihKisa": "28.02.2026", "MiladiTarihKisaIso8601": "28.02.2026", "MiladiTarihUzun": "28 Şubat 2026 Cumartesi", "MiladiTarihUzunIso8601": "2026-02-28T00:00:00.0000000+01:00", "GreenwichOrtalamaZamani": 3.0, "Aksam": "17:25", "Gunes": "06:31", "GunesBatis": "17:18", "GunesDogus": "06:38", "Ikindi": "14:44", "Imsak": "04:39", "KibleSaati": "09:51", "Ogle": "12:03", "Yatsi": "19:03"}, {"HicriTarihKisa": "11.9.1447", "HicriTarihKisaIso8601": null, "HicriTarihUzun": "11 Ramazan 1447", "HicriTarihUzunIso8601": null, "AyinSekliURL": "https://namazvakti.diyanet.gov.tr/images/i5.gif", "MiladiTarihKisa": "01.03.2026", "MiladiTarihKisaIso8601": "01.03.2026", "MiladiTarihUzun": "01 Mart 2026 Pazar", "MiladiTarihUzunIso8601": "2026-03-01T00:00:00.0000000+01:00", "GreenwichOrtalamaZamani": 3.0, "Aksam": "17:27", "Gunes": "06:28", "GunesBatis": "17:20", "GunesDogus": "06:35", "Ikindi": "14:46", "Imsak": "04:37", "KibleSaati": "09:51", "Ogle": "12:03", "Yatsi": "19:05"}, {"HicriTarihKisa": "12.9.1447", "HicriTarihKisaIso8601": null, "HicriTarihUzun": "12 Ramazan 1447", "HicriTarihUzunIso8601": null, "AyinSekliURL": "https://namazvakti.diyanet.gov.tr/images/i6.gif", "MiladiTarihKisa": "02.03.2026", "MiladiTarihKisaIso8601": "02.03.2026", "MiladiTarihUzun": "02 Mart 2026 Pazartesi", "MiladiTarihUzunIso8601": "2026-03-02T00:00:00.0000000+01:00", "GreenwichOrtalamaZamani": 3.0, "Aksam": "17:29", "Gunes": "06:26", "GunesBatis": "17:22", "GunesDogus": "06:33", "Ikindi": "14:47", "Imsak": "04:34", "KibleSaati": "09:51", "Ogle": "12:03", "Yatsi": "19:07"}, {"HicriTarihKisa": "13.9.1447", "HicriTarihKisaIso8601": null, "HicriTarihUzun": "13 Ramazan 1447", "HicriTarihUzunIso8601": null, "AyinSekliURL": "https://namazvakti.diyanet.gov.tr/images/dolunay.gif", "MiladiTarihKisa": "03.03.2026", "MiladiTarihKisaIso8601": "03.03.2026", "MiladiTarihUzun": "03 Mart 2026 Salı", "MiladiTarihUzunIso8601": "2026-03-03T00:00:00.0000000+01:00", "GreenwichOrtalamaZamani": 3.0, "Aksam": "17:31", "Gunes": "06:24", "GunesBatis": "17:24", "GunesDogus": "06:31", "Ikindi": "14:49", "Imsak": "04:32", "KibleSaati": "09:52", "Ogle": "12:02", "Yatsi": "19:09"}, {"HicriTarihKisa": "14.9.1447", "HicriTarihKisaIso8601": null, "HicriTarihUzun": "14 Ramazan 1447", "HicriTarihUzunIso8601": null, "AyinSekliURL": "https://namazvakti.diyanet.gov.tr/images/d1.gif", "MiladiTarihKisa": "04.03.2026", "MiladiTarihKisaIso8601": "04.03.2026", "MiladiTarihUzun": "04 Mart 2026 Çarşamba", "MiladiTarihUzunIso8601": "2026-03-04T00:00:00.0000000+01:00", "GreenwichOrtalamaZamani": 3.0, "Aksam": "17:33", "Gunes": "06:21", "GunesBatis": "17:26", "GunesDogus": "06:28", "Ikindi": "14:50", "Imsak": "04:29", "KibleSaati": "09:52", "Ogle": "12:02", "Yatsi": "19:11"}, {"HicriTarihKisa": "15.9.1447", "HicriTarihKisaIso8601": null, "HicriTarihUzun": "15 Ramazan 1447", "HicriTarihUzunIso8601": null, "AyinSekliURL": "https://namazvakti.diyanet.gov.tr/images/d2.gif", "MiladiTarihKisa": "05.03.2026", "MiladiTarihKisaIso8601": "05.03.2026", "MiladiTarihUzun": "05 Mart 2026 Perşembe", "MiladiTarihUzunIso8601": "2026-03-05T00:00:00.0000000+01:00", "GreenwichOrtalamaZamani": 3.0, "Aksam": "17:35", "Gunes": "06:19", "GunesBatis": "17:28", "GunesDogus": "06:26", "Ikindi": "14:51", "Imsak": "04:27", "KibleSaati": "09:52", "Ogle": "12:02", "Yatsi": "19:13"}, {"HicriTarihKisa": "16.9.1447", "HicriTarihKisaIso8601": null, "HicriTarihUzun": "16 Ramazan 1447", "HicriTarihUzunIso8601": null, "AyinSekliURL": "https://namazvakti.diyanet.gov.tr/images/d3.gif", "MiladiTarihKisa": "06.03.2026", "MiladiTarihKisaIso8601": "06.03.2026", "MiladiTarihUzun": "06 Mart 2026 Cuma", "MiladiTarihUzunIso8601": "2026-03-06T00:00:00.0000000+01:00", "GreenwichOrtalamaZamani": 3.0, "Aksam": "17:37", "Gunes": "06:16", "GunesBatis": "17:30", "GunesDogus": "06:23", "Ikindi": "14:53", "Imsak": "04:24", "KibleSaati": "09:53", "Ogle": "12:02", "Yatsi": "19:15"}, {"HicriTarihKisa": "17.9.1447", "HicriTarihKisaIso8601": null, "HicriTarihUzun": "17 Ramazan 1447", "HicriTarihUzunIso8601": null, "AyinSekliURL": "https://namazvakti.diyanet.gov.tr/images/d4.gif", "MiladiTarihKisa": "07.03.2026", "MiladiTarihKisaIso8601": "07.03.2026", "MiladiTarihUzun": "07 Mart 2026 Cumartesi", "MiladiTarihUzunIso8601": "2026-03-07T00:00:00.0000000+01:00", "GreenwichOrtalamaZamani": 3.0, "Aksam": "17:39", "Gunes": "06:14", "GunesBatis": "17:32", "GunesDogus": "06:21", "Ikindi": "14:54", "Imsak": "04:22", "KibleSaati": "09:53", "Ogle": "12:02", "Yatsi": "19:17"}, {"HicriTarihKisa": "18.9.1447", "HicriTarihKisaIso8601": null, "HicriTarihUzun": "18 Ramazan 1447", "HicriTarihUzunIso8601": null, "AyinSekliURL": "https://namazvakti.diyanet.gov.tr/images/d5.gif", "MiladiTarihKisa": "08.03.2026", "MiladiTarihKisaIso8601": "08.03.2026", "MiladiTarihUzun": "08 Mart 2026 Pazar", "MiladiTarihUzunIso8601": "2026-03-08T00:00:00.0000000+01:00", "GreenwichOrtalamaZamani": 3.0, "Aksam": "17:41", "Gunes": "06:11", "GunesBatis": "17:34", "GunesDogus": "06:18", "Ikindi": "14:55", "Imsak": "04:19", "KibleSaati": "09:53", "Ogle": "12:01", "Yatsi": "19:19"}, {"HicriTarihKisa": "19.9.1447", "HicriTarihKisaIso8601": null, "HicriTarihUzun": "19 Ramazan 1447", "HicriTarihUzunIso8601": null, "AyinSekliURL": "https://namazvakti.diyanet.gov.tr/images/d6.gif", "MiladiTarihKisa": "09.03.2026", "MiladiTarihKisaIso8601": "09.03.2026", "MiladiTarihUzun": "09 Mart 2026 Pazartesi", "MiladiTarihUzunIso8601": "2026-03-09T00:00:00.0000000+01:00", "GreenwichOrtalamaZamani": 3.0, "Aksam": "17:43", "Gunes": "06:09", "GunesBatis": "17:36", "GunesDogus": "06:16", "Ikindi": "14:57", "Imsak": "04:17", "KibleSaati": "09:54", "Ogle": "12:01", "Yatsi": "19:21"}]