[
  {
    "HicriTarihKisa": "18.8.1447",
    "HicriTarihKisaIso8601": null,
    "HicriTarihUzun": "18 Şaban 1447",
    "HicriTarihUzunIso8601": null,
    "AyinSekliURL": "https://namazvakti.diyanet.gov.tr/images/d4.gif",
    "MiladiTarihKisa": "06.02.2026",
    "MiladiTarihKisaIso8601": "06.02.2026",
    "MiladiTarihUzun": "06 Şubat 2026 Cuma",
    "MiladiTarihUzunIso8601": "2026-02-06T00:00:00.0000000-05:00",
    "GreenwichOrtalamaZamani": 3.0,
    "Aksam": "17:21",
    "Gunes": "06:57",
    "GunesBatis": "17:14",
    "GunesDogus": "07:04",
    "Ikindi": "14:55",
    "Imsak": "05:28",
    "KibleSaati": "16:13",
    "Ogle": "12:14",
    "Yatsi": "18:39"
  },
  {
    "HicriTarihKisa": "19.8.1447",
    "HicriTarihKisaIso8601": null,
    "HicriTarihUzun": "19 Şaban 1447",
    "HicriTarihUzunIso8601": null,
    "AyinSekliURL": "https://namazvakti.diyanet.gov.tr/images/d5.gif",
    "MiladiTarihKisa": "07.02.2026",
    "MiladiTarihKisaIso8601": "07.02.2026",
    "MiladiTarihUzun": "07 Şubat 2026 Cumartesi",
    "MiladiTarihUzunIso8601": "2026-02-07T00:00:00.0000000-05:00",
    "GreenwichOrtalamaZamani": 3.0,
    "Aksam": "17:22",
    "Gunes": "06:56",
    "GunesBatis": "17:15",
    "GunesDogus": "07:03",
    "Ikindi": "14:56",
    "Imsak": "05:27",
    "KibleSaati": "16:12",
    "Ogle": "12:14",
    "Yatsi": "18:40"
  },
  {
    "HicriTarihKisa": "20.8.1447",
    "HicriTarihKisaIso8601": null,
    "HicriTarihUzun": "20 Şaban 1447",
    "HicriTarihUzunIso8601": null,
    "AyinSekliURL": "https://namazvakti.diyanet.gov.tr/images/d6.gif",
    "MiladiTarihKisa": "08.02.2026",
    "MiladiTarihKisaIso8601": "08.02.2026",
    "MiladiTarihUzun": "08 Şubat 2026 Pazar",
    "MiladiTarihUzunIso8601": "2026-02-08T00:00:00.0000000-05:00",
    "GreenwichOrtalamaZamani": 3.0,
    "Aksam": "17:24",
    "Gunes": "06:55",
    "GunesBatis": "17:17",
    "GunesDogus": "07:02",
    "Ikindi": "14:57",
    "Imsak": "05:26",
    "KibleSaati": "16:11",
    "Ogle": "12:14",
    "Yatsi": "18:41"
  },
  {
    "HicriTarihKisa": "21.8.1447",
    "HicriTarihKisaIso8601": null,
    "HicriTarihUzun": "21 Şaban 1447",
    "HicriTarihUzunIso8601": null,
    "AyinSekliURL": "https://namazvakti.diyanet.gov.tr/images/sondordun.gif",
    "MiladiTarihKisa": "09.02.2026",
    "MiladiTarihKisaIso8601": "09.02.2026",
    "MiladiTarihUzun": "09 Şubat 2026 Pazartesi",
    "MiladiTarihUzunIso8601": "2026-02-09T00:00:00.0000000-05:00",
    "GreenwichOrtalamaZamani": 3.0,
    "Aksam": "17:25",
    "Gunes": "06:54",
    "GunesBatis": "17:18",
    "GunesDogus": "07:01",
    "Ikindi": "14:58",
    "Imsak": "05:25",
    "KibleSaati": "16:10",
    "Ogle": "12:14",
    "Yatsi": "18:43"
  },
  {
    "HicriTarihKisa": "22.8.1447",
    "HicriTarihKisaIso8601": null,
    "HicriTarihUzun": "22 Şaban 1447",
    "HicriTarihUzunIso8601": null,
    "AyinSekliURL": "https://namazvakti.diyanet.gov.tr/images/sd1.gif",
    "MiladiTarihKisa": "10.02.2026",
    "MiladiTarihKisaIso8601": "10.02.2026",
    "MiladiTarihUzun": "10 Şubat 2026 Salı",
    "MiladiTarihUzunIso8601": "2026-02-10T00:00:00.0000000-05:00",
    "GreenwichOrtalamaZamani": 3.0,
    "Aksam": "17:26",
    "Gunes": "06:52",
    "GunesBatis": "17:19",
    "GunesDogus": "06:59",
    "Ikindi": "14:59",
    "Imsak": "05:24",
    "KibleSaati": "16:09",
    "Ogle": "12:14",
    "Yatsi": "18:44"
  },
  {
    "HicriTarihKisa": "23.8.1447",
    "HicriTarihKisaIso8601": null,
    "HicriTarihUzun": "23 Şaban 1447",
    "HicriTarihUzunIso8601": null,
    "AyinSekliURL": "https://namazvakti.diyanet.gov.tr/images/sd2.gif",
    "MiladiTarihKisa": "11.02.2026",
    "MiladiTarihKisaIso8601": "11.02.2026",
    "MiladiTarihUzun": "11 Şubat 2026 Çarşamba",
    "MiladiTarihUzunIso8601": "2026-02-11T00:00:00.0000000-05:00",
    "GreenwichOrtalamaZamani": 3.0,
    "Aksam": "17:28",
    "Gunes": "06:51",
    "GunesBatis": "17:21",
    "GunesDogus": "06:58",
    "Ikindi": "15:00",
    "Imsak": "05:23",
    "KibleSaati": "16:08",
    "Ogle": "12:14",
    "Yatsi": "18:45"
  },
  {
    "HicriTarihKisa": "24.8.1447",
    "HicriTarihKisaIso8601": null,
    "HicriTarihUzun": "24 Şaban 1447",
    "HicriTarihUzunIso8601": null,
    "AyinSekliURL": "https://namazvakti.diyanet.gov.tr/images/sd3.gif",
    "MiladiTarihKisa": "12.02.2026",
    "MiladiTarihKisaIso8601": "12.02.2026",
    "MiladiTarihUzun": "12 Şubat 2026 Perşembe",
    "MiladiTarihUzunIso8601": "2026-02-12T00:00:00.0000000-05:00",
    "GreenwichOrtalamaZamani": 3.0,
    "Aksam": "17:29",
    "Gunes": "06:50",
    "GunesBatis": "17:22",
    "GunesDogus": "06:57",
    "Ikindi": "15:01",
    "Imsak": "05:21",
    "KibleSaati": "16:07",
    "Ogle": "12:14",
    "Yatsi": "18:46"
  },
  {
    "HicriTarihKisa": "25.8.1447",
    "HicriTarihKisaIso8601": null,
    "HicriTarihUzun": "25 Şaban 1447",
    "HicriTarihUzunIso8601": null,
    "AyinSekliURL": "https://namazvakti.diyanet.gov.tr/images/sd4.gif",
    "MiladiTarihKisa": "13.02.2026",
    "MiladiTarihKisaIso8601": "13.02.2026",
    "MiladiTarihUzun": "13 Şubat 2026 Cuma",
    "MiladiTarihUzunIso8601": "2026-02-13T00:00:00.0000000-05:00",
    "GreenwichOrtalamaZamani": 3.0,
    "Aksam": "17:30",
    "Gunes": "06:48",
    "GunesBatis": "17:23",
    "GunesDogus": "06:55",
    "Ikindi": "15:02",
    "Imsak": "05:20",
    "KibleSaati": "16:06",
    "Ogle": "12:14",
    "Yatsi": "18:47"
  },
  {
    "HicriTarihKisa": "26.8.1447",
    "HicriTarihKisaIso8601": null,
    "HicriTarihUzun": "26 Şaban 1447",
    "HicriTarihUzunIso8601": null,
    "AyinSekliURL": "https://namazvakti.diyanet.gov.tr/images/sd5.gif",
    "MiladiTarihKisa": "14.02.2026",
    "MiladiTarihKisaIso8601": "14.02.2026",
    "MiladiTarihUzun": "14 Şubat 2026 Cumartesi",
    "MiladiTarihUzunIso8601": "2026-02-14T00:00:00.0000000-05:00",
    "GreenwichOrtalamaZamani": 3.0,
    "Aksam": "17:32",
    "Gunes": "06:47",
    "GunesBatis": "17:25",
    "GunesDogus": "06:54",
    "Ikindi": "15:03",
    "Imsak": "05:19",
    "KibleSaati": "16:04",
    "Ogle": "12:14",
    "Yatsi": "18:49"
  },
  {
    "HicriTarihKisa": "27.8.1447",
    "HicriTarihKisaIso8601": null,
    "HicriTarihUzun": "27 Şaban 1447",
    "HicriTarihUzunIso8601": null,
    "AyinSekliURL": "https://namazvakti.diyanet.gov.tr/images/sd6.gif",
    "MiladiTarihKisa": "15.02.2026",
    "MiladiTarihKisaIso8601": "15.02.2026",
    "MiladiTarihUzun": "15 Şubat 2026 Pazar",
    "MiladiTarihUzunIso8601": "2026-02-15T00:00:00.0000000-05:00",
    "GreenwichOrtalamaZamani": 3.0,
    "Aksam": "17:33",
    "Gunes": "06:46",
    "GunesBatis": "17:26",
    "GunesDogus": "06:53",
    "Ikindi": "15:04",
    "Imsak": "05:18",
    "KibleSaati": "16:03",
    "Ogle": "12:14",
    "Yatsi": "18:50"
  },
  {
    "HicriTarihKisa": "28.8.1447",
    "HicriTarihKisaIso8601": null,
    "HicriTarihUzun": "28 Şaban 1447",
    "HicriTarihUzunIso8601": null,
    "AyinSekliURL": "https://namazvakti.diyanet.gov.tr/images/sd7.gif",
    "MiladiTarihKisa": "16.02.2026",
    "MiladiTarihKisaIso8601": "16.02.2026",
    "MiladiTarihUzun": "16 Şubat 2026 Pazartesi",
    "MiladiTarihUzunIso8601": "2026-02-16T00:00:00.0000000-05:00",
    "GreenwichOrtalamaZamani": 3.0,
    "Aksam": "17:34",
    "Gunes": "06:44",
    "GunesBatis": "17:27",
    "GunesDogus": "06:51",
    "Ikindi": "15:05",
    "Imsak": "05:17",
    "KibleSaati": "16:02",
    "Ogle": "12:14",
    "Yatsi": "18:51"
  },
  {
    "HicriTarihKisa": "29.8.1447",
    "HicriTarihKisaIso8601": null,
    "HicriTarihUzun": "29 Şaban 1447",
    "HicriTarihUzunIso8601": null,
    "AyinSekliURL": "https://namazvakti.diyanet.gov.tr/images/ictima.gif",
    "MiladiTarihKisa": "17.02.2026",
    "MiladiTarihKisaIso8601": "17.02.2026",
    "MiladiTarihUzun": "17 Şubat 2026 Salı",
    "MiladiTarihUzunIso8601": "2026-02-17T00:00:00.0000000-05:00",
    "GreenwichOrtalamaZamani": 3.0,
    "Aksam": "17:35",
    "Gunes": "06:43",
    "GunesBatis": "17:28",
    "GunesDogus": "06:50",
    "Ikindi": "15:06",
    "Imsak": "05:15",
    "KibleSaati": "16:01",
    "Ogle": "12:14",
    "Yatsi": "18:52"
  },
  {
    "HicriTarihKisa": "30.8.1447",
    "HicriTarihKisaIso8601": null,
    "HicriTarihUzun": "30 Şaban 1447",
    "HicriTarihUzunIso8601": null,
    "AyinSekliURL": "https://namazvakti.diyanet.gov.tr/images/ruyet.gif",
    "MiladiTarihKisa": "18.02.2026",
    "MiladiTarihKisaIso8601": "18.02.2026",
    "MiladiTarihUzun": "18 Şubat 2026 Çarşamba",
    "MiladiTarihUzunIso8601": "2026-02-18T00:00:00.0000000-05:00",
    "GreenwichOrtalamaZamani": 3.0,
    "Aksam": "17:37",
    "Gunes": "06:41",
    "GunesBatis": "17:30",
    "GunesDogus": "06:48",
    "Ikindi": "15:07",
    "Imsak": "05:14",
    "KibleSaati": "15:59",
    "Ogle": "12:14",
    "Yatsi": "18:53"
  },
  {
    "HicriTarihKisa": "1.9.1447",
    "HicriTarihKisaIso8601": null,
    "HicriTarihUzun": "1 Ramazan 1447",
    "HicriTarihUzunIso8601": null,
    "AyinSekliURL": "https://namazvakti.diyanet.gov.tr/images/r1.gif",
    "MiladiTarihKisa": "19.02.2026",
    "MiladiTarihKisaIso8601": "19.02.2026",
    "MiladiTarihUzun": "19 Şubat 2026 Perşembe",
    "MiladiTarihUzunIso8601": "2026-02-19T00:00:00.0000000-05:00",
    "GreenwichOrtalamaZamani": 3.0,
    "Aksam": "17:38",
    "Gunes": "06:40",
    "GunesBatis": "17:31",
    "GunesDogus": "06:47",
    "Ikindi": "15:08",
    "Imsak": "05:13",
    "KibleSaati": "15:58",
    "Ogle": "12:14",
    "Yatsi": "18:54"
  },
  {
    "HicriTarihKisa": "2.9.1447",
    "HicriTarihKisaIso8601": null,
    "HicriTarihUzun": "2 Ramazan 1447",
    "HicriTarihUzunIso8601": null,
    "AyinSekliURL": "https://namazvakti.diyanet.gov.tr/images/r2.gif",
    "MiladiTarihKisa": "20.02.2026",
    "MiladiTarihKisaIso8601": "20.02.2026",
    "MiladiTarihUzun": "20 Şubat 2026 Cuma",
    "MiladiTarihUzunIso8601": "2026-02-20T00:00:00.0000000-05:00",
    "GreenwichOrtalamaZamani": 3.0,
    "Aksam": "17:39",
    "Gunes": "06:38",
    "GunesBatis": "17:32",
    "GunesDogus": "06:45",
    "Ikindi": "15:09",
    "Imsak": "05:11",
    "KibleSaati": "15:57",
    "Ogle": "12:14",
    "Yatsi": "18:56"
  },
  {
    "HicriTarihKisa": "3.9.1447",
    "HicriTarihKisaIso8601": null,
    "HicriTarihUzun": "3 Ramazan 1447",
    "HicriTarihUzunIso8601": null,
    "AyinSekliURL": "https://namazvakti.diyanet.gov.tr/images/r3.gif",
    "MiladiTarihKisa": "21.02.2026",
    "MiladiTarihKisaIso8601": "21.02.2026",
    "MiladiTarihUzun": "21 Şubat 2026 Cumartesi",
    "MiladiTarihUzunIso8601": "2026-02-21T00:00:00.0000000-05:00",
    "GreenwichOrtalamaZamani": 3.0,
    "Aksam": "17:41",
    "Gunes": "06:37",
    "GunesBatis": "17:34",
    "GunesDogus": "06:44",
    "Ikindi": "15:10",
    "Imsak": "05:10",
    "KibleSaati": "15:55",
    "Ogle": "12:14",
    "Yatsi": "18:57"
  },
  {
    "HicriTarihKisa": "4.9.1447",
    "HicriTarihKisaIso8601": null,
    "HicriTarihUzun": "4 Ramazan 1447",
    "HicriTarihUzunIso8601": null,
    "AyinSekliURL": "https://namazvakti.diyanet.gov.tr/images/r4.gif",
    "MiladiTarihKisa": "22.02.2026",
    "MiladiTarihKisaIso8601": "22.02.2026",
    "MiladiTarihUzun": "22 Şubat 2026 Pazar",
    "MiladiTarihUzunIso8601": "2026-02-22T00:00:00.0000000-05:00",
    "GreenwichOrtalamaZamani": 3.0,
    "Aksam": "17:42",
    "Gunes": "06:35",
    "GunesBatis": "17:35",
    "GunesDogus": "06:42",
    "Ikindi": "15:11",
    "Imsak": "05:08",
    "KibleSaati": "15:54",
    "Ogle": "12:14",
    "Yatsi": "18:58"
  },
  {
    "HicriTarihKisa": "5.9.1447",
    "HicriTarihKisaIso8601": null,
    "HicriTarihUzun": "5 Ramazan 1447",
    "HicriTarihUzunIso8601": null,
    "AyinSekliURL": "https://namazvakti.diyanet.gov.tr/images/r5.gif",
    "MiladiTarihKisa": "23.02.2026",
    "MiladiTarihKisaIso8601": "23.02.2026",
    "MiladiTarihUzun": "23 Şubat 2026 Pazartesi",
    "MiladiTarihUzunIso8601": "2026-02-23T00:00:00.0000000-05:00",
    "GreenwichOrtalamaZamani": 3.0,
    "Aksam": "17:43",
    "Gunes": "06:34",
    "GunesBatis": "17:36",
    "GunesDogus": "06:41",
    "Ikindi": "15:12",
    "Imsak": "05:07",
    "KibleSaati": "15:53",
    "Ogle": "12:13",
    "Yatsi": "18:59"
  },
  {
    "HicriTarihKisa": "6.9.1447",
    "HicriTarihKisaIso8601": null,
    "HicriTarihUzun": "6 Ramazan 1447",
    "HicriTarihUzunIso8601": null,
    "AyinSekliURL": "https://namazvakti.diyanet.gov.tr/images/ilkdordun.gif",
    "MiladiTarihKisa": "24.02.2026",
    "MiladiTarihKisaIso8601": "24.02.2026",
    "MiladiTarihUzun": "24 Şubat 2026 Salı",
    "MiladiTarihUzunIso8601": "2026-02-24T00:00:00.0000000-05:00",
    "GreenwichOrtalamaZamani": 3.0,
    "Aksam": "17:44",
    "Gunes": "06:32",
    "GunesBatis": "17:37",
    "GunesDogus": "06:39",
    "Ikindi": "15:12",
    "Imsak": "05:05",
    "KibleSaati": "15:51",
    "Ogle": "12:13",
    "Yatsi": "19:00"
  },
  {
    "HicriTarihKisa": "7.9.1447",
    "HicriTarihKisaIso8601": null,
    "HicriTarihUzun": "7 Ramazan 1447",
    "HicriTarihUzunIso8601": null,
    "AyinSekliURL": "https://namazvakti.diyanet.gov.tr/images/i1.gif",
    "MiladiTarihKisa": "25.02.2026",
    "MiladiTarihKisaIso8601": "25.02.2026",
    "MiladiTarihUzun": "25 Şubat 2026 Çarşamba",
    "MiladiTarihUzunIso8601": "2026-02-25T00:00:00.0000000-05:00",
    "GreenwichOrtalamaZamani": 3.0,
    "Aksam": "17:46",
    "Gunes": "06:31",
    "GunesBatis": "17:39",
    "GunesDogus": "06:38",
    "Ikindi": "15:13",
    "Imsak": "05:04",
    "KibleSaati": "15:50",
    "Ogle": "12:13",
    "Yatsi": "19:02"
  },
  {
    "HicriTarihKisa": "8.9.1447",
    "HicriTarihKisaIso8601": null,
    "HicriTarihUzun": "8 Ramazan 1447",
    "HicriTarihUzunIso8601": null,
    "AyinSekliURL": "https://namazvakti.diyanet.gov.tr/images/i2.gif",
    "MiladiTarihKisa": "26.02.2026",
    "MiladiTarihKisaIso8601": "26.02.2026",
    "MiladiTarihUzun": "26 Şubat 2026 Perşembe",
    "MiladiTarihUzunIso8601": "2026-02-26T00:00:00.0000000-05:00",
    "GreenwichOrtalamaZamani": 3.0,
    "Aksam": "17:47",
    "Gunes": "06:29",
    "GunesBatis": "17:40",
    "GunesDogus": "06:36",
    "Ikindi": "15:14",
    "Imsak": "05:02",
    "KibleSaati": "15:49",
    "Ogle": "12:13",
    "Yatsi": "19:03"
  },
  {
    "HicriTarihKisa": "9.9.1447",
    "HicriTarihKisaIso8601": null,
    "HicriTarihUzun": "9 Ramazan 1447",
    "HicriTarihUzunIso8601": null,
    "AyinSekliURL": "https://namazvakti.diyanet.gov.tr/images/i3.gif",
    "MiladiTarihKisa": "27.02.2026",
    "MiladiTarihKisaIso8601": "27.02.2026",
    "MiladiTarihUzun": "27 Şubat 2026 Cuma",
    "MiladiTarihUzunIso8601": "2026-02-27T00:00:00.0000000-05:00",
    "GreenwichOrtalamaZamani": 3.0,
    "Aksam": "17:48",
    "Gunes": "06:28",
    "GunesBatis": "17:41",
    "GunesDogus": "06:35",
    "Ikindi": "15:15",
    "Imsak": "05:01",
    "KibleSaati": "15:47",
    "Ogle": "12:13",
    "Yatsi": "19:04"
  },
  {
    "HicriTarihKisa": "10.9.1447",
    "HicriTarihKisaIso8601": null,
    "HicriTarihUzun": "10 Ramazan 1447",
    "HicriTarihUzunIso8601": null,
    "AyinSekliURL": "https://namazvakti.diyanet.gov.tr/images/i4.gif",
    "MiladiTarihKisa": "28.02.2026",
    "MiladiTarihKisaIso8601": "28.02.2026",
    "MiladiTarihUzun": "28 Şubat 2026 Cumartesi",
    "MiladiTarihUzunIso8601": "2026-02-28T00:00:00.0000000-05:00",
    "GreenwichOrtalamaZamani": 3.0,
    "Aksam": "17:49",
    "Gunes": "06:26",
    "GunesBatis": "17:42",
    "GunesDogus": "06:33",
    "Ikindi": "15:16",
    "Imsak": "04:59",
    "KibleSaati": "15:46",
    "Ogle": "12:13",
    "Yatsi": "19:05"
  },
  {
    "HicriTarihKisa": "11.9.1447",
    "HicriTarihKisaIso8601": null,
    "HicriTarihUzun": "11 Ramazan 1447",
    "HicriTarihUzunIso8601": null,
    "AyinSekliURL": "https://namazvakti.diyanet.gov.tr/images/i5.gif",
    "MiladiTarihKisa": "01.03.2026",
    "MiladiTarihKisaIso8601": "01.03.2026",
    "MiladiTarihUzun": "01 Mart 2026 Pazar",
    "MiladiTarihUzunIso8601": "2026-03-01T00:00:00.0000000-05:00",
    "GreenwichOrtalamaZamani": 3.0,
    "Aksam": "17:51",
    "Gunes": "06:24",
    "GunesBatis": "17:44",
    "GunesDogus": "06:31",
    "Ikindi": "15:17",
    "Imsak": "04:58",
    "KibleSaati": "15:44",
    "Ogle": "12:12",
    "Yatsi": "19:06"
  },
  {
    "HicriTarihKisa": "12.9.1447",
    "HicriTarihKisaIso8601": null,
    "HicriTarihUzun": "12 Ramazan 1447",
    "HicriTarihUzunIso8601": null,
    "AyinSekliURL": "https://namazvakti.diyanet.gov.tr/images/i6.gif",
    "MiladiTarihKisa": "02.03.2026",
    "MiladiTarihKisaIso8601": "02.03.2026",
    "MiladiTarihUzun": "02 Mart 2026 Pazartesi",
    "MiladiTarihUzunIso8601": "2026-03-02T00:00:00.0000000-05:00",
    "GreenwichOrtalamaZamani": 3.0,
    "Aksam": "17:52",
    "Gunes": "06:23",
    "GunesBatis": "17:45",
    "GunesDogus": "06:30",
    "Ikindi": "15:18",
    "Imsak": "04:56",
    "KibleSaati": "15:43",
    "Ogle": "12:12",
    "Yatsi": "19:08"
  },
  {
    "HicriTarihKisa": "13.9.1447",
    "HicriTarihKisaIso8601": null,
    "HicriTarihUzun": "13 Ramazan 1447",
    "HicriTarihUzunIso8601": null,
    "AyinSekliURL": "https://namazvakti.diyanet.gov.tr/images/dolunay.gif",
    "MiladiTarihKisa": "03.03.2026",
    "MiladiTarihKisaIso8601": "03.03.2026",
    "MiladiTarihUzun": "03 Mart 2026 Salı",
    "MiladiTarihUzunIso8601": "2026-03-03T00:00:00.0000000-05:00",
    "GreenwichOrtalamaZamani": 3.0,
    "Aksam": "17:53",
    "Gunes": "06:21",
    "GunesBatis": "17:46",
    "GunesDogus": "06:28",
    "Ikindi": "15:18",
    "Imsak": "04:54",
    "KibleSaati": "15:41",
    "Ogle": "12:12",
    "Yatsi": "19:09"
  },
  {
    "HicriTarihKisa": "14.9.1447",
    "HicriTarihKisaIso8601": null,
    "HicriTarihUzun": "14 Ramazan 1447",
    "HicriTarihUzunIso8601": null,
    "AyinSekliURL": "https://namazvakti.diyanet.gov.tr/images/d1.gif",
    "MiladiTarihKisa": "04.03.2026",
    "MiladiTarihKisaIso8601": "04.03.2026",
    "MiladiTarihUzun": "04 Mart 2026 Çarşamba",
    "MiladiTarihUzunIso8601": "2026-03-04T00:00:00.0000000-05:00",
    "GreenwichOrtalamaZamani": 3.0,
    "Aksam": "17:54",
    "Gunes": "06:19",
    "GunesBatis": "17:47",
    "GunesDogus": "06:26",
    "Ikindi": "15:19",
    "Imsak": "04:53",
    "KibleSaati": "15:40",
    "Ogle": "12:12",
    "Yatsi": "19:10"
  },
  {
    "HicriTarihKisa": "15.9.1447",
    "HicriTarihKisaIso8601": null,
    "HicriTarihUzun": "15 Ramazan 1447",
    "HicriTarihUzunIso8601": null,
    "AyinSekliURL": "https://namazvakti.diyanet.gov.tr/images/d2.gif",
    "MiladiTarihKisa": "05.03.2026",
    "MiladiTarihKisaIso8601": "05.03.2026",
    "MiladiTarihUzun": "05 Mart 2026 Perşembe",
    "MiladiTarihUzunIso8601": "2026-03-05T00:00:00.0000000-05:00",
    "GreenwichOrtalamaZamani": 3.0,
    "Aksam": "17:56",
    "Gunes": "06:18",
    "GunesBatis": "17:49",
    "GunesDogus": "06:25",
    "Ikindi": "15:20",
    "Imsak": "04:51",
    "KibleSaati": "15:38",
    "Ogle": "12:12",
    "Yatsi": "19:11"
  },
  {
    "HicriTarihKisa": "16.9.1447",
    "HicriTarihKisaIso8601": null,
    "HicriTarihUzun": "16 Ramazan 1447",
    "HicriTarihUzunIso8601": null,
    "AyinSekliURL": "https://namazvakti.diyanet.gov.tr/images/d3.gif",
    "MiladiTarihKisa": "06.03.2026",
    "MiladiTarihKisaIso8601": "06.03.2026",
    "MiladiTarihUzun": "06 Mart 2026 Cuma",
    "MiladiTarihUzunIso8601": "2026-03-06T00:00:00.0000000-05:00",
    "GreenwichOrtalamaZamani": 3.0,
    "Aksam": "17:57",
    "Gunes": "06:16",
    "GunesBatis": "17:50",
    "GunesDogus": "06:23",
    "Ikindi": "15:21",
    "Imsak": "04:49",
    "KibleSaati": "15:37",
    "Ogle": "12:11",
    "Yatsi": "19:12"
  },
  {
    "HicriTarihKisa": "17.9.1447",
    "HicriTarihKisaIso8601": null,
    "HicriTarihUzun": "17 Ramazan 1447",
    "HicriTarihUzunIso8601": null,
    "AyinSekliURL": "https://namazvakti.diyanet.gov.tr/images/d4.gif",
    "MiladiTarihKisa": "07.03.2026",
    "MiladiTarihKisaIso8601": "07.03.2026",
    "MiladiTarihUzun": "07 Mart 2026 Cumartesi",
    "MiladiTarihUzunIso8601": "2026-03-07T00:00:00.0000000-05:00",
    "GreenwichOrtalamaZamani": 3.0,
    "Aksam": "17:58",
    "Gunes": "06:14",
    "GunesBatis": "17:51",
    "GunesDogus": "06:21",
    "Ikindi": "15:22",
    "Imsak": "04:48",
    "KibleSaati": "15:35",
    "Ogle": "12:11",
    "Yatsi": "19:14"
  },
  {
    "HicriTarihKisa": "18.9.1447",
    "HicriTarihKisaIso8601": null,
    "HicriTarihUzun": "18 Ramazan 1447",
    "HicriTarihUzunIso8601": null,
    "AyinSekliURL": "https://namazvakti.diyanet.gov.tr/images/d5.gif",
    "MiladiTarihKisa": "08.03.2026",
    "MiladiTarihKisaIso8601": "08.03.2026",
    "MiladiTarihUzun": "08 Mart 2026 Pazar",
    "MiladiTarihUzunIso8601": "2026-03-08T00:00:00.0000000-05:00",
    "GreenwichOrtalamaZamani": 3.0,
    "Aksam": "18:59",
    "Gunes": "07:13",
    "GunesBatis": "18:52",
    "GunesDogus": "07:20",
    "Ikindi": "16:22",
    "Imsak": "05:46",
    "KibleSaati": "16:34",
    "Ogle": "13:11",
    "Yatsi": "20:15"
  },
  {
    "HicriTarihKisa": "19.9.1447",
    "HicriTarihKisaIso8601": null,
    "HicriTarihUzun": "19 Ramazan 1447",
    "HicriTarihUzunIso8601": null,
    "AyinSekliURL": "https://namazvakti.diyanet.gov.tr/images/d6.gif",
    "MiladiTarihKisa": "09.03.2026",
    "MiladiTarihKisaIso8601": "09.03.2026",
    "MiladiTarihUzun": "09 Mart 2026 Pazartesi",
    "MiladiTarihUzunIso8601": "2026-03-09T00:00:00.0000000-05:00",
    "GreenwichOrtalamaZamani": 3.0,
    "Aksam": "19:00",
    "Gunes": "07:11",
    "GunesBatis": "18:53",
    "GunesDogus": "07:18",
    "Ikindi": "16:23",
    "Imsak": "05:44",
    "KibleSaati": "16:32",
    "Ogle": "13:11",
    "Yatsi": "20:16"
  }
]