[{"HicriTarihKisa": "16.8.1447", "HicriTarihKisaIso8601": null, "HicriTarihUzun": "16 Şaban 1447", "HicriTarihUzunIso8601": null, "AyinSekliURL": "https://namazvakti.diyanet.gov.tr/images/d2.gif", "MiladiTarihKisa": "04.02.2026", "MiladiTarihKisaIso8601": "04.02.2026", "MiladiTarihUzun": "04 Şubat 2026 Çarşamba", "MiladiTarihUzunIso8601": "2026-02-04T00:00:00.0000000-07:00", "GreenwichOrtalamaZamani": 3.0, "Aksam": "17:28", "Gunes": "08:08", "GunesBatis": "17:21", "GunesDogus": "08:15", "Ikindi": "14:59", "Imsak": "06:14", "KibleSaati": "14:29", "Ogle": "12:53", "Yatsi": "19:08"}, {"HicriTarihKisa": "17.8.1447", "HicriTarihKisaIso8601": null, "HicriTarihUzun": "17 Şaban 1447", "HicriTarihUzunIso8601": null, "AyinSekliURL": "https://namazvakti.diyanet.gov.tr/images/d3.gif", "MiladiTarihKisa": "05.02.2026", "MiladiTarihKisaIso8601": "05.02.2026", "MiladiTarihUzun": "05 Şubat 2026 Perşembe", "MiladiTarihUzunIso8601": "2026-02-05T00:00:00.0000000-07:00", "GreenwichOrtalamaZamani": 3.0, "Aksam": "17:30", "Gunes": "08:06", "GunesBatis": "17:23", "GunesDogus": "08:13", "Ikindi": "15:00", "Imsak": "06:13", "KibleSaati": "14:28", "Ogle": "12:53", "Yatsi": "19:10"}, {"HicriTarihKisa": "18.8.1447", "HicriTarihKisaIso8601": null, "HicriTarihUzun": "18 Şaban 1447", "HicriTarihUzunIso8601": null, "AyinSekliURL": "https://namazvakti.diyanet.gov.tr/images/d4.gif", "MiladiTarihKisa": "06.02.2026", "MiladiTarihKisaIso8601": "06.02.2026", "MiladiTarihUzun": "06 Şubat 2026 Cuma", "MiladiTarihUzunIso8601": "2026-02-06T00:00:00.0000000-07:00", "GreenwichOrtalamaZamani": 3.0, "Aksam": "17:32", "Gunes": "08:04", "GunesBatis": "17:25", "GunesDogus": "08:11", "Ikindi": "15:02", "Imsak": "06:11", "KibleSaati": "14:28", "Ogle": "12:53", "Yatsi": "19:11"}, {"HicriTarihKisa": "19.8.1447", "HicriTarihKisaIso8601": null, "HicriTarihUzun": "19 Şaban 1447", "HicriTarihUzunIso8601": null, "AyinSekliURL": "https://namazvakti.diyanet.gov.tr/images/d5.gif", "MiladiTarihKisa": "07.02.2026", "MiladiTarihKisaIso8601": "07.02.2026", "MiladiTarihUzun": "07 Şubat 2026 Cumartesi", "MiladiTarihUzunIso8601": "2026-02-07T00:00:00.0000000-07:00", "GreenwichOrtalamaZamani": 3.0, "Aksam": "17:34", "Gunes": "08:02", "GunesBatis": "17:27", "GunesDogus": "08:09", "Ikindi": "15:04", "Imsak": "06:10", "KibleSaati": "14:28", "Ogle": "12:53", "Yatsi": "19:13"}, {"HicriTarihKisa": "20.8.1447", "HicriTarihKisaIso8601": null, "HicriTarihUzun": "20 Şaban 1447", "HicriTarihUzunIso8601": null, "AyinSekliURL": "https://namazvakti.diyanet.gov.tr/images/d6.gif", "MiladiTarihKisa": "08.02.2026", "MiladiTarihKisaIso8601": "08.02.2026", "MiladiTarihUzun": "08 Şubat 2026 Pazar", "MiladiTarihUzunIso8601": "2026-02-08T00:00:00.0000000-07:00", "GreenwichOrtalamaZamani": 3.0, "Aksam": "17:36", "Gunes": "08:00", "GunesBatis": "17:29", "GunesDogus": "08:07", "Ikindi": "15:05", "Imsak": "06:08", "KibleSaati": "14:27", "Ogle": "12:53", "Yatsi": "19:15"}, {"HicriTarihKisa": "21.8.1447", "HicriTarihKisaIso8601": null, "HicriTarihUzun": "21 Şaban 1447", "HicriTarihUzunIso8601": null, "AyinSekliURL": "https://namazvakti.diyanet.gov.tr/images/sondordun.gif", "MiladiTarihKisa": "09.02.2026", "MiladiTarihKisaIso8601": "09.02.2026", "MiladiTarihUzun": "09 Şubat 2026 Pazartesi", "MiladiTarihUzunIso8601": "2026-02-09T00:00:00.0000000-07:00", "GreenwichOrtalamaZamani": 3.0, "Aksam": "17:38", "Gunes": "07:58", "GunesBatis": "17:31", "GunesDogus": "08:05", "Ikindi": "15:07", "Imsak": "06:06", "KibleSaati": "14:27", "Ogle": "12:53", "Yatsi": "19:17"}, {"HicriTarihKisa": "22.8.1447", "HicriTarihKisaIso8601": null, "HicriTarihUzun": "22 Şaban 1447", "HicriTarihUzunIso8601": null, "AyinSekliURL": "https://namazvakti.diyanet.gov.tr/images/sd1.gif", "MiladiTarihKisa": "10.02.2026", "MiladiTarihKisaIso8601": "10.02.2026", "MiladiTarihUzun": "10 Şubat 2026 Salı", "MiladiTarihUzunIso8601": "2026-02-10T00:00:00.0000000-07:00", "GreenwichOrtalamaZamani": 3.0, "Aksam": "17:40", "Gunes": "07:57", "GunesBatis": "17:33", "GunesDogus": "08:04", "Ikindi": "15:08", "Imsak": "06:05", "KibleSaati": "14:27", "Ogle": "12:53", "Yatsi": "19:18"}, {"HicriTarihKisa": "23.8.1447", "HicriTarihKisaIso8601": null, "HicriTarihUzun": "23 Şaban 1447", "HicriTarihUzunIso8601": null, "AyinSekliURL": "https://namazvakti.diyanet.gov.tr/images/sd2.gif", "MiladiTarihKisa": "11.02.2026", "MiladiTarihKisaIso8601": "11.02.2026", "MiladiTarihUzun": "11 Şubat 2026 Çarşamba", "MiladiTarihUzunIso8601": "2026-02-11T00:00:00.0000000-07:00", "GreenwichOrtalamaZamani": 3.0, "Aksam": "17:42", "Gunes": "07:55", "GunesBatis": "17:35", "GunesDogus": "08:02", "Ikindi": "15:10", "Imsak": "06:03", "KibleSaati": "14:26", "Ogle": "12:53", "Yatsi": "19:20"}, {"HicriTarihKisa": "24.8.1447", "HicriTarihKisaIso8601": null, "HicriTarihUzun": "24 Şaban 1447", "HicriTarihUzunIso8601": null, "AyinSekliURL": "https://namazvakti.diyanet.gov.tr/images/sd3.gif", "MiladiTarihKisa": "12.02.2026", "MiladiTarihKisaIso8601": "12.02.2026", "MiladiTarihUzun": "12 Şubat 2026 Perşembe", "MiladiTarihUzunIso8601": "2026-02-12T00:00:00.0000000-07:00", "GreenwichOrtalamaZamani": 3.0, "Aksam": "17:44", "Gunes": "07:53", "GunesBatis": "17:37", "GunesDogus": "08:00", "Ikindi": "15:11", "Imsak": "06:01", "KibleSaati": "14:26", "Ogle": "12:53", "Yatsi": "19:22"}, {"HicriTarihKisa": "25.8.1447", "HicriTarihKisaIso8601": null, "HicriTarihUzun": "25 Şaban 1447", "HicriTarihUzunIso8601": null, "AyinSekliURL": "https://namazvakti.diyanet.gov.tr/images/sd4.gif", "MiladiTarihKisa": "13.02.2026", "MiladiTarihKisaIso8601": "13.02.2026", "MiladiTarihUzun": "13 Şubat 2026 Cuma", "MiladiTarihUzunIso8601": "2026-02-13T00:00:00.0000000-07:00", "GreenwichOrtalamaZamani": 3.0, "Aksam": "17:46", "Gunes": "07:51", "GunesBatis": "17:39", "GunesDogus": "07:58", "Ikindi": "15:13", "Imsak": "05:59", "KibleSaati": "14:26", "Ogle": "12:53", "Yatsi": "19:24"}, {"HicriTarihKisa": "26.8.1447", "HicriTarihKisaIso8601": null, "HicriTarihUzun": "26 Şaban 1447", "HicriTarihUzunIso8601": null, "AyinSekliURL": "https://namazvakti.diyanet.gov.tr/images/sd5.gif", "MiladiTarihKisa": "14.02.2026", "MiladiTarihKisaIso8601": "14.02.2026", "MiladiTarihUzun": "14 Şubat 2026 Cumartesi", "MiladiTarihUzunIso8601": "2026-02-14T00:00:00.0000000-07:00", "GreenwichOrtalamaZamani": 3.0, "Aksam": "17:48", "Gunes": "07:49", "GunesBatis": "17:41", "GunesDogus": "07:56", "Ikindi": "15:14", "Imsak": "05:58", "KibleSaati": "14:25", "Ogle": "12:53", "Yatsi": "19:25"}, {"HicriTarihKisa": "27.8.1447", "HicriTarihKisaIso8601": null, "HicriTarihUzun": "27 Şaban 1447", "HicriTarihUzunIso8601": null, "AyinSekliURL": "https://namazvakti.diyanet.gov.tr/images/sd6.gif", "MiladiTarihKisa": "15.02.2026", "MiladiTarihKisaIso8601": "15.02.2026", "MiladiTarihUzun": "15 Şubat 2026 Pazar", "MiladiTarihUzunIso8601": "2026-02-15T00:00:00.0000000-07:00", "GreenwichOrtalamaZamani": 3.0, "Aksam": "17:50", "Gunes": "07:46", "GunesBatis": "17:43", "GunesDogus": "07:53", "Ikindi": "15:16", "Imsak": "05:56", "KibleSaati": "14:25", "Ogle": "12:53", "Yatsi": "19:27"}, {"HicriTarihKisa": "28.8.1447", "HicriTarihKisaIso8601": null, "HicriTarihUzun": "28 Şaban 1447", "HicriTarihUzunIso8601": null, "AyinSekliURL": "https://namazvakti.diyanet.gov.tr/images/sd7.gif", "MiladiTarihKisa": "16.02.2026", "MiladiTarihKisaIso8601": "16.02.2026", "MiladiTarihUzun": "16 Şubat 2026 Pazartesi", "MiladiTarihUzunIso8601": "2026-02-16T00:00:00.0000000-07:00", "GreenwichOrtalamaZamani": 3.0, "Aksam": "17:52", "Gunes": "07:44", "GunesBatis": "17:45", "GunesDogus": "07:51", "Ikindi": "15:17", "Imsak": "05:54", "KibleSaati": "14:24", "Ogle": "12:53", "Yatsi": "19:29"}, {"HicriTarihKisa": "29.8.1447", "HicriTarihKisaIso8601": null, "HicriTarihUzun": "29 Şaban 1447", "HicriTarihUzunIso8601": null, "AyinSekliURL": "https://namazvakti.diyanet.gov.tr/images/ictima.gif", "MiladiTarihKisa": "17.02.2026", "MiladiTarihKisaIso8601": "17.02.2026", "MiladiTarihUzun": "17 Şubat 2026 Salı", "MiladiTarihUzunIso8601": "2026-02-17T00:00:00.0000000-07:00", "GreenwichOrtalamaZamani": 3.0, "Aksam": "17:54", "Gunes": "07:42", "GunesBatis": "17:47", "GunesDogus": "07:49", "Ikindi": "15:19", "Imsak": "05:52", "KibleSaati": "14:24", "Ogle": "12:53", "Yatsi": "19:31"}, {"HicriTarihKisa": "30.8.1447", "HicriTarihKisaIso8601": null, "HicriTarihUzun": "30 Şaban 1447", "HicriTarihUzunIso8601": null, "AyinSekliURL": "https://namazvakti.diyanet.gov.tr/images/ruyet.gif", "MiladiTarihKisa": "18.02.2026", "MiladiTarihKisaIso8601": "18.02.2026", "MiladiTarihUzun": "18 Şubat 2026 Çarşamba", "MiladiTarihUzunIso8601": "2026-02-18T00:00:00.0000000-07:00", "GreenwichOrtalamaZamani": 3.0, "Aksam": "17:56", "Gunes": "07:40", "GunesBatis": "17:49", "GunesDogus": "07:47", "Ikindi": "15:20", "Imsak": "05:50", "KibleSaati": "14:23", "Ogle": "12:53", "Yatsi": "19:33"}, {"HicriTarihKisa": "1.9.1447", "HicriTarihKisaIso8601": null, "HicriTarihUzun": "1 Ramazan 1447", "HicriTarihUzunIso8601": null, "AyinSekliURL": "https://namazvakti.diyanet.gov.tr/images/r1.gif", "MiladiTarihKisa": "19.02.2026", "MiladiTarihKisaIso8601": "19.02.2026", "MiladiTarihUzun": "19 Şubat 2026 Perşembe", "MiladiTarihUzunIso8601": "2026-02-19T00:00:00.0000000-07:00", "GreenwichOrtalamaZamani": 3.0, "Aksam": "17:58", "Gunes": "07:38", "GunesBatis": "17:51", "GunesDogus": "07:45", "Ikindi": "15:22", "Imsak": "05:48", "KibleSaati": "14:23", "Ogle": "12:53", "Yatsi": "19:34"}, {"HicriTarihKisa": "2.9.1447", "HicriTarihKisaIso8601": null, "HicriTarihUzun": "2 Ramazan 1447", "HicriTarihUzunIso8601": null, "AyinSekliURL": "https://namazvakti.diyanet.gov.tr/images/r2.gif", "MiladiTarihKisa": "20.02.2026", "MiladiTarihKisaIso8601": "20.02.2026", "MiladiTarihUzun": "20 Şubat 2026 Cuma", "MiladiTarihUzunIso8601": "2026-02-20T00:00:00.0000000-07:00", "GreenwichOrtalamaZamani": 3.0, "Aksam": "18:00", "Gunes": "07:36", "GunesBatis": "17:53", "GunesDogus": "07:43", "Ikindi": "15:23", "Imsak": "05:46", "KibleSaati": "14:23", "Ogle": "12:53", "Yatsi": "19:36"}, {"HicriTarihKisa": "3.9.1447", "HicriTarihKisaIso8601": null, "HicriTarihUzun": "3 Ramazan 1447", "HicriTarihUzunIso8601": null, "AyinSekliURL": "https://namazvakti.diyanet.gov.tr/images/r3.gif", "MiladiTarihKisa": "21.02.2026", "MiladiTarihKisaIso8601": "21.02.2026", "MiladiTarihUzun": "21 Şubat 2026 Cumartesi", "MiladiTarihUzunIso8601": "2026-02-21T00:00:00.0000000-07:00", "GreenwichOrtalamaZamani": 3.0, "Aksam": "18:02", "Gunes": "07:34", "GunesBatis": "17:55", "GunesDogus": "07:41", "Ikindi": "15:25", "Imsak": "05:44", "KibleSaati": "14:22", "Ogle": "12:53", "Yatsi": "19:38"}, {"HicriTarihKisa": "4.9.1447", "HicriTarihKisaIso8601": null, "HicriTarihUzun": "4 Ramazan 1447", "HicriTarihUzunIso8601": null, "AyinSekliURL": "https://namazvakti.diyanet.gov.tr/images/r4.gif", "MiladiTarihKisa": "22.02.2026", "MiladiTarihKisaIso8601": "22.02.2026", "MiladiTarihUzun": "22 Şubat 2026 Pazar", "MiladiTarihUzunIso8601": "2026-02-22T00:00:00.0000000-07:00", "GreenwichOrtalamaZamani": 3.0, "Aksam": "18:04", "Gunes": "07:32", "GunesBatis": "17:57", "GunesDogus": "07:39", "Ikindi": "15:26", "Imsak": "05:42", "KibleSaati": "14:22", "Ogle": "12:53", "Yatsi": "19:40"}, {"HicriTarihKisa": "5.9.1447", "HicriTarihKisaIso8601": null, "HicriTarihUzun": "5 Ramazan 1447", "HicriTarihUzunIso8601": null, "AyinSekliURL": "https://namazvakti.diyanet.gov.tr/images/r5.gif", "MiladiTarihKisa": "23.02.2026", "MiladiTarihKisaIso8601": "23.02.2026", "MiladiTarihUzun": "23 Şubat 2026 Pazartesi", "MiladiTarihUzunIso8601": "2026-02-23T00:00:00.0000000-07:00", "GreenwichOrtalamaZamani": 3.0, "Aksam": "18:06", "Gunes": "07:29", "GunesBatis": "17:59", "GunesDogus": "07:36", "Ikindi": "15:28", "Imsak": "05:40", "KibleSaati": "14:21", "Ogle": "12:52", "Yatsi": "19:42"}, {"HicriTarihKisa": "6.9.1447", "HicriTarihKisaIso8601": null, "HicriTarihUzun": "6 Ramazan 1447", "HicriTarihUzunIso8601": null, "AyinSekliURL": "https://namazvakti.diyanet.gov.tr/images/ilkdordun.gif", "MiladiTarihKisa": "24.02.2026", "MiladiTarihKisaIso8601": "24.02.2026", "MiladiTarihUzun": "24 Şubat 2026 Salı", "MiladiTarihUzunIso8601": "2026-02-24T00:00:00.0000000-07:00", "GreenwichOrtalamaZamani": 3.0, "Aksam": "18:08", "Gunes": "07:27", "GunesBatis": "18:01", "GunesDogus": "07:34", "Ikindi": "15:29", "Imsak": "05:37", "KibleSaati": "14:20", "Ogle": "12:52", "Yatsi": "19:44"}, {"HicriTarihKisa": "7.9.1447", "HicriTarihKisaIso8601": null, "HicriTarihUzun": "7 Ramazan 1447", "HicriTarihUzunIso8601": null, "AyinSekliURL": "https://namazvakti.diyanet.gov.tr/images/i1.gif", "MiladiTarihKisa": "25.02.2026", "MiladiTarihKisaIso8601": "25.02.2026", "MiladiTarihUzun": "25 Şubat 2026 Çarşamba", "MiladiTarihUzunIso8601": "2026-02-25T00:00:00.0000000-07:00", "GreenwichOrtalamaZamani": 3.0, "Aksam": "18:09", "Gunes": "07:25", "GunesBatis": "18:02", "GunesDogus": "07:32", "Ikindi": "15:31", "Imsak": "05:35", "KibleSaati": "14:20", "Ogle": "12:52", "Yatsi": "19:45"}, {"HicriTarihKisa": "8.9.1447", "HicriTarihKisaIso8601": null, "HicriTarihUzun": "8 Ramazan 1447", "HicriTarihUzunIso8601": null, "AyinSekliURL": "https://namazvakti.diyanet.gov.tr/images/i2.gif", "MiladiTarihKisa": "26.02.2026", "MiladiTarihKisaIso8601": "26.02.2026", "MiladiTarihUzun": "26 Şubat 2026 Perşembe", "MiladiTarihUzunIso8601": "2026-02-26T00:00:00.0000000-07:00", "GreenwichOrtalamaZamani": 3.0, "Aksam": "18:11", "Gunes": "07:23", "GunesBatis": "18:04", "GunesDogus": "07:30", "Ikindi": "15:32", "Imsak": "05:33", "KibleSaati": "14:19", "Ogle": "12:52", "Yatsi": "19:47"}, {"HicriTarihKisa": "9.9.1447", "HicriTarihKisaIso8601": null, "HicriTarihUzun": "9 Ramazan 1447", "HicriTarihUzunIso8601": null, "AyinSekliURL": "https://namazvakti.diyanet.gov.tr/images/i3.gif", "MiladiTarihKisa": "27.02.2026", "MiladiTarihKisaIso8601": "27.02.2026", "MiladiTarihUzun": "27 Şubat 2026 Cuma", "MiladiTarihUzunIso8601": "2026-02-27T00:00:00.0000000-07:00", "GreenwichOrtalamaZamani": 3.0, "Aksam": "18:13", "Gunes": "07:20", "GunesBatis": "18:06", "GunesDogus": "07:27", "Ikindi": "15:33", "Imsak": "05:31", "KibleSaati": "14:19", "Ogle": "12:52", "Yatsi": "19:49"}, {"HicriTarihKisa": "10.9.1447", "HicriTarihKisaIso8601": null, "HicriTarihUzun": "10 Ramazan 1447", "HicriTarihUzunIso8601": null, "AyinSekliURL": "https://namazvakti.diyanet.gov.tr/images/i4.gif", "MiladiTarihKisa": "28.02.2026", "MiladiTarihKisaIso8601": "28.02.2026", "MiladiTarihUzun": "28 Şubat 2026 Cumartesi", "MiladiTarihUzunIso8601": "2026-02-28T00:00:00.0000000-07:00", "GreenwichOrtalamaZamani": 3.0, "Aksam": "18:15", "Gunes": "07:18", "GunesBatis": "18:08", "GunesDogus": "07:25", "Ikindi": "15:35", "Imsak": "05:29", "KibleSaati": "14:18", "Ogle": "12:52", "Yatsi": "19:51"}, {"HicriTarihKisa": "11.9.1447", "HicriTarihKisaIso8601": null, "HicriTarihUzun": "11 Ramazan 1447", "HicriTarihUzunIso8601": null, "AyinSekliURL": "https://namazvakti.diyanet.gov.tr/images/i5.gif", "MiladiTarihKisa": "01.03.2026", "MiladiTarihKisaIso8601": "01.03.2026", "MiladiTarihUzun": "01 Mart 2026 Pazar", "MiladiTarihUzunIso8601": "2026-03-01T00:00:00.0000000-07:00", "GreenwichOrtalamaZamani": 3.0, "Aksam": "18:17", "Gunes": "07:16", "GunesBatis": "18:10", "GunesDogus": "07:23", "Ikindi": "15:36", "Imsak": "05:26", "KibleSaati": "14:18", "Ogle": "12:51", "Yatsi": "19:53"}, {"HicriTarihKisa": "12.9.1447", "HicriTarihKisaIso8601": null, "HicriTarihUzun": "12 Ramazan 1447", "HicriTarihUzunIso8601": null, "AyinSekliURL": "https://namazvakti.diyanet.gov.tr/images/i6.gif", "MiladiTarihKisa": "02.03.2026", "MiladiTarihKisaIso8601": "02.03.2026", "MiladiTarihUzun": "02 Mart 2026 Pazartesi", "MiladiTarihUzunIso8601": "2026-03-02T00:00:00.0000000-07:00", "GreenwichOrtalamaZamani": 3.0, "Aksam": "18:19", "Gunes": "07:13", "GunesBatis": "18:12", "GunesDogus": "07:20", "Ikindi": "15:38", "Imsak": "05:24", "KibleSaati": "14:17", "Ogle": "12:51", "Yatsi": "19:55"}, {"HicriTarihKisa": "13.9.1447", "HicriTarihKisaIso8601": null, "HicriTarihUzun": "13 Ramazan 1447", "HicriTarihUzunIso8601": null, "AyinSekliURL": "https://namazvakti.diyanet.gov.tr/images/dolunay.gif", "MiladiTarihKisa": "03.03.2026", "MiladiTarihKisaIso8601": "03.03.2026", "MiladiTarihUzun": "03 Mart 2026 Salı", "MiladiTarihUzunIso8601": "2026-03-03T00:00:00.0000000-07:00", "GreenwichOrtalamaZamani": 3.0, "Aksam": "18:21", "Gunes": "07:11", "GunesBatis": "18:14", "GunesDogus": "07:18", "Ikindi": "15:39", "Imsak": "05:22", "KibleSaati": "14:16", "Ogle": "12:51", "Yatsi": "19:57"}, {"HicriTarihKisa": "14.9.1447", "HicriTarihKisaIso8601": null, "HicriTarihUzun": "14 Ramazan 1447", "HicriTarihUzunIso8601": null, "AyinSekliURL": "https://namazvakti.diyanet.gov.tr/images/d1.gif", "MiladiTarihKisa": "04.03.2026", "MiladiTarihKisaIso8601": "04.03.2026", "MiladiTarihUzun": "04 Mart 2026 Çarşamba", "MiladiTarihUzunIso8601": "2026-03-04T00:00:00.0000000-07:00", "GreenwichOrtalamaZamani": 3.0, "Aksam": "18:23", "Gunes": "07:09", "GunesBatis": "18:16", "GunesDogus": "07:16", "Ikindi": "15:40", "Imsak": "05:19", "KibleSaati": "14:16", "Ogle": "12:51", "Yatsi": "19:59"}, {"HicriTarihKisa": "15.9.1447", "HicriTarihKisaIso8601": null, "HicriTarihUzun": "15 Ramazan 1447", "HicriTarihUzunIso8601": null, "AyinSekliURL": "https://namazvakti.diyanet.gov.tr/images/d2.gif", "MiladiTarihKisa": "05.03.2026", "MiladiTarihKisaIso8601": "05.03.2026", "MiladiTarihUzun": "05 Mart 2026 Perşembe", "MiladiTarihUzunIso8601": "2026-03-05T00:00:00.0000000-07:00", "GreenwichOrtalamaZamani": 3.0, "Aksam": "18:25", "Gunes": "07:06", "GunesBatis": "18:18", "GunesDogus": "07:13", "Ikindi": "15:42", "Imsak": "05:17", "KibleSaati": "14:15", "Ogle": "12:51", "Yatsi": "20:01"}, {"HicriTarihKisa": "16.9.1447", "HicriTarihKisaIso8601": null, "HicriTarihUzun": "16 Ramazan 1447", "HicriTarihUzunIso8601": null, "AyinSekliURL": "https://namazvakti.diyanet.gov.tr/images/d3.gif", "MiladiTarihKisa": "06.03.2026", "MiladiTarihKisaIso8601": "06.03.2026", "MiladiTarihUzun": "06 Mart 2026 Cuma", "MiladiTarihUzunIso8601": "2026-03-06T00:00:00.0000000-07:00", "GreenwichOrtalamaZamani": 3.0, "Aksam": "18:27", "Gunes": "07:04", "GunesBatis": "18:20", "GunesDogus": "07:11", "Ikindi": "15:43", "Imsak": "05:14", "KibleSaati": "14:15", "Ogle": "12:50", "Yatsi": "20:03"}, {"HicriTarihKisa": "17.9.1447", "HicriTarihKisaIso8601": null, "HicriTarihUzun": "17 Ramazan 1447", "HicriTarihUzunIso8601": null, "AyinSekliURL": "https://namazvakti.diyanet.gov.tr/images/d4.gif", "MiladiTarihKisa": "07.03.2026", "MiladiTarihKisaIso8601": "07.03.2026", "MiladiTarihUzun": "07 Mart 2026 Cumartesi", "MiladiTarihUzunIso8601": "2026-03-07T00:00:00.0000000-07:00", "GreenwichOrtalamaZamani": 3.0, "Aksam": "18:29", "Gunes": "07:02", "GunesBatis": "18:22", "GunesDogus": "07:09", "Ikindi": "15:44", "Imsak": "05:12", "KibleSaati": "14:14", "Ogle": "12:50", "Yatsi": "20:04"}]